job_title,location,company,salary,rating,summary
"Research Scientist, Edge Intelligence - Opportunity for Working Remotely New York City, NY","New York, NY",VMware,,4.0,"Ph-d in Electrical Engineering, Computer Science or Advanced Mathematics with demonstrable expertise in machine intelligence research pertaining to Edge…"
Junior Cyber Security Analyst,"New York, NY",Octane,,3.6,"BS+ in Cyber Security, Computer Science or related field. 1-2+ years of professional experience in Cyber Security or related role."
"Business Analyst, PubOps","New York, NY 10019 (Midtown area)",Penguin Random House LLC,,4.0,Use database tools to pull large data sets and use the analysis of that data to identify issues and solutions for individual divisions or the company as a whole…
Cybercrime Analyst,"New York, NY",New York District Attorney's Office,"$47,909 a year",4.4,Strong attention to detail and high concern for data accuracy. One (1) year of paralegal or related experience preferred.
"Analyst, Business Intelligence, Publicis Health Media","New York, NY",Publicis Healthcare Communications Group,,3.9,"Experience with SAS, SPSS or other data manipulation tools a plus. 0-2 years of business experience working in Marketing, Advertising or Consulting."
Business Solutions Administrator,"White Plains, NY",Wilson Elser,,2.8,Bachelor's Degree or commensurate experience. Ability to perform data mining/extraction. Experience with or understanding of graphic design preferred.
Data Scientist - Personalization,"New York, NY",Co–Star,,,"PhD in Stats, Math, CS, or another quantitative field focused on data and its use, or equivalent experience. Identify appropriate data science techniques, tools…"
"Sr. Research Scientist I - Chem Dev, Fermentation & Biotransformation","Albany, NY",Albany Molecular Research,,2.8,"Supervise the work of assigned scientists. Ph.D. in Organic Chemistry, enzymology or related area. Thorough knowledge and Experience in conducting natural…"
Data Scientist,"New York, NY",Naka Technologies,,,A data scientist with 4-6+ years of experience in data science roles. You are capable of working with engineers to build an actual production system that uses…
IT Support Engineer,"New York, NY",Brex,,,2+ years of experience supporting a high volume IT environment (on-campus or internship experience qualifies). Know when to escalate complex issues.
"Sr. Research Scientist I - Chem Dev, Fermentation & Biotransformation","Albany, NY",Albany Molecular Research,,2.8,"Supervise the work of assigned scientists. Ph.D. in Organic Chemistry, enzymology or related area. Thorough knowledge and Experience in conducting natural…"
Data Scientist,"New York, NY",Naka Technologies,,,A data scientist with 4-6+ years of experience in data science roles. You are capable of working with engineers to build an actual production system that uses…
IT Support Engineer,"New York, NY",Brex,,,2+ years of experience supporting a high volume IT environment (on-campus or internship experience qualifies). Know when to escalate complex issues.
Field Service Engineer,"Johnson City, NY 13790","Innovation Associates, Inc.",,,Enhance or replace existing hardware and/or software based on customer. Or modify existing configurations and supporting peripherals.
"Business to Business (B2B) Marketing Specialist, Data Insights","Bethpage, NY",Altice,,3.4,"Bachelor's degree or higher in finance, data analytics, data science or related field. Advanced experience with business intelligence tools and database…"
Staff Accountant,New York State,PWNHealth,,4.3,Proficient working with data and performing analysis in spreadsheets. Demonstrated interest in healthcare or technology industry a plus.
Deposit Operations - New York Analyst,"Melville, NY 11747",BankUnited,,3.7,EDUCATION and/or EXPERIENCE: Bachelor's Degree or its equivalent with three to five years related experience in a Commercial banking or Deposit Operations…
"Sr. Analyst FP&A, Emerging Business","New York, NY",Viacom,,4.0,"2‐4 years of experience in business planning or finance. The ideal candidate will have a desire to manage large data sets, build processes, learn financial…"
"Machine Learning Research Engineer, Learning Methods","New York, NY",Twitter,,4.1,Masters’ or PhD in a Computer Science or Machine Learning related degree along with 2+ years of relevant work experience; or equivalent work experience.
Business Analyst,"New York, NY 10011 (Chelsea area)",Wolters Kluwer,,3.6,"Customer purchasing data to structure key business issues related to planning, P&L analysis supporting business reorganization."
Marketing Research Analyst,"New York, NY",Zbest Payment Solutions,,,"Bachelor’s degree or master’s degree in Marketing or related majors; Do market research & market analysis to develop Zbest product, present the results and…"
Manager FP&A - Business Intelligence & Analytics,"New York, NY",Spotify,,4.3,"Spanning data ETL, data systems design, reporting, statistical modeling, and business strategy, you will gain a broad spectrum of experience applying your…"
"Vice President, Fundamental Active Equities Research Analyst","New York, NY",BlackRock,,3.8,"Strong business sense: The candidate must possess a broad understanding of business models, industry dynamics, and competitive analysis."
"Customer Engineer, Data & Analytics","New York, NY",Microsoft,,4.2,"Demonstrates expertise in a specific solution, or several products, feature functions, or services. Identifies opportunities to articulate business value and…"
Software Engineer Intern,"New York, NY 10001 (Chelsea area)",Wickr,,4.9,"Enrolled in Bachelor of Science in Software Engineering, Computer Science, Computer Engineering, Computer Security, or a related field and completed at least…"
Marketing Data Analyst,"New York, NY",Veeva Systems,,4.0,"Mobilize a variety of tools and platforms, including SQL, Excel, and business intelligence/data visualization suites. Bachelors degree with a minimum 3.0 GPA."
Operations Strategic Data Analyst,"New York, NY",Healthfirst,,3.4,Familiarity with data models and/or data modelling. Familiarity with writing SQL (and/or SAS) queries for analyzing data and establishing business rules and…
"Software Engineer III, Data Systems","Brooklyn, NY",Mailchimp,,4.5,The Data Systems team builds systems that bridge the gap between raw business data and consumable data products that the business can trust and take action on.
Customer Experience Analyst,"New York, NY",Atom Finance,,,"Background in finance, technology, or business analytics preferred but not required. You have experience taking messy, disparate data and gleaning clear action…"
Data Analyst - CBCH,"New York, NY",Columbia University,,4.1,"Organizing and merging research data from multiple sources. Experience working with large datasets, statistical analysis, and advanced knowledge of SAS or R (or…"
Chemical Engineer,"Massena, NY 13662",Alcoa Corporation,,4.0,Collect and interpret process data to control and improve processes. Show initiative to pursue and recommend new approaches or methods for process improvements.
Senior Spatial Data and Mapping Analyst-Temporary,"Long Island City, NY 11101",Fund For Public Health In New York Inc,$33.84 - $42.03 an hour,,"Facilitate the flow of data and the data request process. Assemble analysts from across the agency with a wide variety of data skills, including data…"
Global Consumer Banking Summer Analyst - New York (2021),"New York, NY",Citi,,3.9,
Senior Scientist - Make Up,"Melville, NY 11747",The Estée Lauder Companies,,4.1,Assists in resolving product or process problems. University Degree (BA or BS) in Natural Sciences. The candidate must be a competent individual contributor who…
Senior Data Analyst,"Brooklyn, NY",Maisonette,,4.6,We're seeking an analyst with senior-level experience thinking critically about how data can best support and inform organizational needs and culture.
Government Programs Technical Business Analyst I - 008555,"Rochester, NY 14604 (Central Business District area)",Excellus,,,Minimum of three years strategic data analysis experience or advanced credentials in a business technical discipline. Excellent technical and analytic skills.
Data Engineer,"New York, NY 10036 (Midtown area)",Marsh and McLennan,,3.7,"3-5 years of relevant experience as a data engineer or in a similar role. Bachelor’s or master's degree in data science, computer science or related…"
Programmer/Data Scientist (Researcher),"New York, NY 10012 (Greenwich Village area)",New York University,,4.2,"Preferred education: Master’s in computer science, data science, or an analytical social science. You will use modern programming tools to manage multi-terabyte…"
Sr Research Informatics Business Analyst,"New York, NY 11221 (Bedford Stuyvesant area)",Weill Cornell Medicine,,4.0,Participates in data governance and policy setting activities to support custom research data repositories (RDRs) and platforms.
Grid Modernization Data Visualization and Tableau Developer,"New York, NY",Indigo Advisory Group,,,"Experience gathering stakeholder requirements, and interfacing with a diverse range of stakeholders including backend developers, data scientists, executive…"
AI Group - Dialog Research Engineer,"New York, NY",Bloomberg,,3.9,"The AI Group is the central engineering group with over 150 researchers and engineers working together to build data-driven customer-facing products, as well as…"
Solution Consultant: Planning,New York State,Workday,,4.0,"5 or more years domain experience (FP&A, corporate sales, implementation, and/or presales) with enterprise class Financial Planning Application software."
"Associate Scientist, Skincare","Melville, NY 11747",The Estée Lauder Companies,,4.1,"Actively develops commercially feasible new products or modifies existing ones. May be responsible for the development of new products, or modifications of…"
Data Scientist,"New York, NY 10014 (West Village area)",National Audubon Society,,3.9,Collaborate with data scientists on Audubon’s science team to share tools and best practices around data science.
Clinical Data Science Analyst I - Genetics,"New York, NY 10029 (East Harlem area)",Mount Sinai,,3.9,Data science and clinical informatics with specific interest in applications to clinical data. Significant expertise with programming and statistical software…
Digital Investment Banking Technology - Business Analyst,"New York, NY","JPMorgan Chase Bank, N.A.",,3.9,"Working at the intersection of business and technology, you'll sharpen your understanding of business processes and data analysis, while continuing to develop…"
Analyst,"New York, NY",Verus Analytics,,,Evaluate key data information and supporting documentation for erroneous or inconsistent results. Interest in applications of artificial intelligence also…
"iOS Engineer, Remote (Referrals from Meetup Groups)",New York State,Meetup Group Referrals,,,Work with API engineers to define how data should be structured and delivered. Experience with CocoaPods or Swift Package Manager.
Art Director Intern (Virtual / Remote),New York State,160over90,,2.3,Assist in primary research design. Emotional intelligence and intellectual curiosity. Gain basic knowledge of the agency clients’ businesses.
Data Scientist,"New York, NY 10014 (West Village area)",WebMD,,3.6,"Effectively communicate actionable or prescriptive insights to internal business partners. Bachelor’s degree in computer science, data science, statistics or at…"
Tech II- Consultant -Data Analyst,"New York, NY",CEdge Software Consultants,,3.5,Data modeling and documentation schemas with data catalog tooling. Experience with building data warehouse fact and dimensional models.
Senior Database Administrator,"Rochester, NY",CooperVision,,3.8,"Work collaboratively with the Application development, environment, server/storage, and business analyst teams. Proficient in Linux, SQL, and PL/SQL."
AI Research Scientist,"New York, NY","Two Sigma Investments, LLC.",,3.8,"Relevant research experience (publications at NeurIPS, ICML, ICLR or similar are preferred). Advanced degree in Computer Science, Engineering, or other STEM…"
Accounts Payable Clerk,"Lowville, NY",Kraft Heinz Company,$24.69 an hour,3.6,Finance/Accounting experience and/or a two year Associates Degree is preferred. Develop and maintain positive relationship with internal and external customers/…
SQL Server Database Developer with Migration experience,"New York, NY",Reliable It Group,,,"4+ yrs exp in MS SQL or PL / SQL, 2+ yrs of ETL Dev Exp. Title SQL Server Database Developer with Migration experience."
Suspicious Activity Reporting Analyst,"New York, NY",Cash App,,,"Investigative skills, including familiarity with public record research and database tools. BA/BS degree or equivalent professional experience."
Data Annotation Supervisor,"Buffalo, NY 14220 (Tifft area)",Tesla,,3.5,"Own the data annotation pipeline, ensuring quality of data annotation for the entire team. Commitment to data accuracy and throughput."
Associate Research Scientist,"New York, NY 10027 (Manhattanville area)",Columbia University,,4.1,"MD, PhD, or doctorate in related field. MD, PhD, or doctorate in related field. The ideal candidate will have expertise in viral and operant behavioral methods,…"
Data Scientist,"New York, NY",MightyHive,,,"2+ years of experience analyzing data with Python and/or R. The data scientist will help develop solutions using statistical, data mining methods and data…"
"Software Engineer, 2021 Graduate","New York, NY",Atlassian,,4.6,"Bachelors, Masters, or PhD in Computer Science / Software Engineering or a related technical field and are graduating by June 2021."
Business Analyst,"New York, NY",1199SEIU Family of Funds,,4.0,Strong knowledge of financial management best practices and data management systems. Research analytical trends and lead ongoing assessment of business…
Business Analyst,"Hicksville, NY 11801",Mahima Soft,,,"BA or BS in Business, Marketing or Financial related flied with analytical or database experience. Adept at conducting research into project-related issues and…"
Senior Data Analyst,"New York, NY",Zip,,,You seek answers in data: You are comfortable analyzing millions of transactional data points. You use data to drive decision making and make recommendations on…
Sr. Research Analyst,"Long Island City, NY",Altice,,3.4,Produce data usage reports for data providers. The Business Insights Analyst will be tasked to support businesses by deriving key performance metrics from…
Sr.SQL Server Database Developer,"New York, NY",Reliable It Group,,,"Looking for a Sr. Server Developer with strong SQL Server database experience with expertise in database design, modeling and development."
AI Group - IR Research Engineer,"New York, NY",Bloomberg,,3.9,"The AI Group is the central engineering group with over 150 researchers and engineers working together to build data-driven customer-facing products, as well as…"
Business Development Analyst,"Port Washington, NY 11050",Luxottica,,3.6,"2+ years’ experience with reporting, data and analytics. Partners with brand teams to support business objectives and reports on success of program…"
"Research Intern – True Global Intelligence, New York","New York, NY 10017 (Tudor City area)",FleishmanHillard,,3.7,"Academic coursework or professional experience in primary research (qualitative, quantitative or both). Assisting with qualitative and/or quantitative primary…"
US REITs Associate,"New York, NY",Cohen & Steers,,3.8,"Assist analysts with macro-level property sector research and individual security analysis. Programming for data analytics (PYTHON, R, SQL, MATLAB, or similar)…"
Database Administrator - Senior,"Rochester, NY",Riedman Campus,,,Provides all levels of database documentation and trains developers in utilization of database development tools. Maintains a high degree of computer expertise.
"Data Analyst, Media Partnerships Strategy & Planning","New York, NY 10003 (Flatiron District area)",Facebook,,4.2,"Maintain and improve reporting data tools, infra for org goals, and production data models. 2+ years of experience visualizing data."
AppD Competitive Intelligence Analyst,"New York, NY",Cisco Systems,,4.1,"2-5+ years overall industry experience with experience in one or more of the following: sales engineering, IT Operations, engineering and/or architecting…"
Operations Analyst,"New York, NY",Banza,,,"Use data to analyze shipping patterns and partners for optimization. 1-2 years of professional experience, relevant degree or work experience preferred."
Data Scientist,"New York, NY",Millennium Management LLC,,4.1,"The team consists of content specialists, data scientists, analysts and engineers who are responsible for discovering, maintaining and analyzing sources of…"
Sustainability Analyst,"New York, NY",Moody's Corporation,,3.7,Investigate outliers and determine whether data is erroneous or correct. Experience performing data management and quality data assurance activities including…
Database Administrator,"New York, NY",Amida Care,,3.1,"The Database Administrator also allocates database resources to achieve optimum database performance, including business continuity/backup and recovery…"
Senior Data Analyst,"New York, NY 10001 (Garment District area)",Roku,,3.2,"Partner with leadership, engineers, product managers and data engineers to understand data needs. 4+ years of relevant experience as a data analyst in…"
Business Development Analyst,"Port Washington, NY 11050",Luxottica Group,,3.6,"2+ years’ experience with reporting, data and analytics. Partners with brand teams to support business objectives and reports on success of program…"
Research Coordinator,"New York, NY 10065 (Upper East Side area)",Weill Cornell Medicine,,4.0,"Approximately 2 years of experience in health-related role, in clinical or research setting. Coordinates the collection, compilation, documentation and analysis…"
Sr. Business Intelligence Systems Analyst,"New York, NY",AdvantageCare Physicians,,2.7,"Interfaces with key IT, clinical, business and operations staff to assist in the development of efficient Reporting and data aggregation code."
QA Analyst,New York State,Voyager Digital,,,Setup and maintain test data and test case suites. Expertise in writing unit and integration test cases in Mocha or Jest.
Metrology Engineer,"Lockport, NY",General Motors,,4.1,"Utilize Math data using NX and or Adobe. Review scan data using GOM inspect. Solidworks, NX or comparable 3D software. Review requests and measurement methods."
"Data Science Analyst, M&A Strategic Shareholder Advisory, Investment Banking (BCMA)","New York, NY",Citi,,3.9,Bachelor's degree in Finance or closely related areas of Business Administration. Develop data driven tools and analyses to enhance client discussions and…
Legal Support Analyst,"Hauppauge, NY",New York State Office of the Attorney General,,4.3,Prior familiarity with and experience using eDiscovery and legal research. Analyzing large amounts of data and presenting in a cogent manner;
Analyst - Work Planning,"Rochester, NY",ROCHESTER GAS & ELEC CORP,,,Ensures the integrity and accuracy of data through weekly Scheduling update meetings. Responsible for the integrity of data input into work management systems…
Registration Analyst,"Melville, NY 11747",The Estée Lauder Companies,,4.1,Perform research with brand and/or PDS to obtain all variant/kit/set/size artwork and country of origin information required to action and complete product…
Senior Business Immigration Analyst,"New York, NY",Fragomen,,3.1,"Bachelor’s degree, associate degree or Paralegal Certification. At least two years of business immigration experience (i.e. paralegal)."
People Analytics – Data Science & Visualization,"New York, NY","D. E. Shaw & Co., L.P.",,4.2,
Occupational Therapst - per diem,"New York, NY",NYU Langone,,4.1,"New York State Occupational Therapy License or temporary permit. In this role, the successful candidate Responsible for evaluating occupational therapy needs…"
"Junior Database Administrator, Information Technology Services","New York, NY",United Jewish Appeal-Fed of Jewish,,,"In addition, the Junior DBA will write stored procedures, functions, and queries to manage database systems and to support reporting and business data analysis."
Senior Data Scientist,"New York, NY",Drizly,,3.0,"You love working with teams including Data Engineering and Business Intelligence to transform raw data into highly actionable business insights through Looker,…"
Software Engineer - Big Data,"New York, NY",Wells Fargo,,3.7,Help in design and implementation of algorithms and tools for analytics and data scientist teams. 2+ years of experience with H2O software or Keras with…
"Sr. Analyst, Business Intelligence","New York, NY",Vimeo,,,Expert knowledge of Microsoft Excel and data visualization. Experience with SQL and large data sets (terabyte scale) is a must.
"Business Analyst, HR Process Optimization","New York, NY 10017 (Midtown area)",Memorial Sloan-Kettering Cancer Center,,4.2,Work with leaders cross functionally to understand their business requirements and help transform them into robust solutions.
Data Pipeline Engineer,"New York, NY",Radancy,,,Ingest and aggregate data from both internal and external data sources. Radacny programmatic works on data services across the programmatic platform within…
Finance Analyst - Entry Level,"Malta, NY",GLOBALFOUNDRIES,,3.3,"B S in Finance, Accounting, or relevant field of study. This Finance analyst position will take on responsibilities for execution of forecasting, tracking,…"
Senior Database Application Engineer,"New York, NY",WorkFusion,,,"Develop data scripts, troubleshoot code and assist developers with performance tuning. Create, maintain, and execute scheduled jobs, data extracts, data…"
Encounter Data Analyst,"New York, NY",Archcare,,2.5,"Works closely with all applicable departments to ensure data completeness, data accuracy, and data availability."
Database Administrator (PostgreSQL),"New York, NY",Innovative Interfaces Inc.,,,"Minimum 3 years of database administration experience. Assists developers with complex query tuning and schema refinement. In this position, you will also…."
Part-Time Research Scientist,"New York, NY 10012 (Greenwich Village area)",New York University,,4.2,"We are seeking individuals with a strong background in biomedical engineering, biochemistry, biophysics, and/or related field."
"Research Associate - New York, NY","New York, NY 10004 (Financial District area)",Oxford Economics,,,"Conduct desk research and produce literature reviews related to current or future programs. Work with Research Analyst to build data visualizations (i.e., what…"
Senior Business Analyst - Financial Services,"New York, NY 10014 (SoHo area)",Publicis Sapient,,3.9,Analyze and conceive new business processes and re-engineer existing ones for optimization. Ability to deal with ambiguity and decipher business unit lingo.
Analyst | PARKS,"Manhattan, NY 10007 (Financial District area)",OFFICE OF MANAGEMENT & BUDGET,"$46,856 - $70,291 a year",4.1,"Analyst ($62,480+): Bachelor's degree in Business, Finance, Economics, Public Policy Analysis/Administration, or a subject related to the specific assignment…"
"Director, Data Architecture & Modernization Engineer","White Plains, NY 10601",Sterling National Bank,,2.9,Assist in mentoring legacy data integration engineers and analysts to further their professional growth. Encourage application and business teams to leverage…
"Asset Management, Middle Office Business Analyst / Project Manager, Associate","New York, NY","JPMorgan Chase Bank, N.A.",,3.9,Demonstrable awareness of data governance and data strategy methodologies. Understanding of Investments data and market data supporting investment processes.
Data Scientist – Institutional Clients Group (ICG) Analytics VP,"New York, NY",Citi,,3.9,"Responsible for documenting data requirements, data collection / processing / cleaning, and exploratory data analysis; which may include utilizing statistical…"
Planning Solutions Analyst,"New York, NY",Viacom,,4.0,"Ability to analyze data, develop insights and clearly communicate the impact of varying data points. In this role, you will work with a team of data scientists…"
Senior Data Scientist - Risk Model Governance (Work At Home) - Evernorth,"New York, NY 10017 (Midtown area)",Cigna,,3.7,"7+ years of strong technical skills to extract and analyze data with proficiency in SAS, Python, or R. Manage model governance needs across business partners in…"
Python Data Science Software Engineer,"New York, NY",Bloomberg,,3.9,"Perform your own exploration and research to understand, describe, and analyze data. Experience working with graph data."
Analyst - Accounting,"New York, NY",Spotify,,4.3,"Previous experience of IFRS and/or SOX is an advantage. Experience with major ERP systems preferred (Oracle, SAP or Netsuite). Bachelor’s degree in Accounting."
IGA Developer-Engineer (Sailpoint),"New York, NY",NBCUniversal,,4.0,Leverage scripting and/or coding skills to automate processes. NBCU Cyber IAM Team is currently seeking an IGA developer to join a cyber security organization…
Assistant Research Scientist (Programmer / Analyst / Research Coordinator),"New York, NY 10012 (Greenwich Village area)",New York University,,4.2,"Demonstrated experience with SAS or equivalent database or statistical language; experience with large database management; excellent interpersonal,…"
Laboratory Scientist,"Plattsburgh, NY 12901",SCHLUTER SYSTEMS L.P.,,3.6,"Collaborate with other departments to collect, evaluate and analyze data. A combination of education and/or relevant experience will be considered."
