job_title,location,company,salary,rating,summary
CMBS Analyst,"New York, NY",Citi,,3.9,Bachelor’s degree in Real Estate or Finance. Prepare data tapes and various mortgage loan schedules used by CMBS investors and nationally recognized statistical…
Ref Data QA Engineer,"New York, NY",BGC Partners,,3.6,3 or more years of professional work experience in software QA or engineering. Write medium to complex SQL queries for data validation.
Data Analyst (Financials),"New York, NY",NYU Langone,,4.1,"To qualify you must have a Bachelors degree with a major in a business subject (e.g. accounting, finance, economics) or information systems/technology and at…"
Knowledge Management Content and Data Analyst,"New York, NY",Cooley LLP,"$69,000 - $83,000 a year",4.0,"Preferred candidates will have BS or MS degree in fields such as business, math, data architecture, library science, and extensive knowledge of Data Governance,…"
Research Analyst - Healthcare,"New York, NY 10020 (Midtown area)",AllianceBernstein,,3.5,"A bachelor’s degree in business, quantitative or scientific disciplines. Attend conferences and industry events, while forging relationships with the relevant…"
Senior Data Engineer,New York State,Crowdskout,,,"Strong experience building out data warehouse and/or data lake infrastructure. Provide thought leadership in data infrastructure, database design, data…"
Data Science Software Developer,"New York, NY",Nielsen,,3.8,"Degree in computer science, engineering, or data science. You enjoy bridging the fields of data science and software development."
Database Engineer,"Garden City, NY","Miller & Milone, P.C.",,3.4,"The Database Engineer will work closely with other developers, data analysts, and managers to gather and execute on data-related business initiatives,…"
Business Analyst - Ecommerce,"New York, NY 07030",Pearson,,3.7,"Time Management : You have excellent organizational skills with the ability to manage and balance multiple priorities in a fast-paced, complex business…"
Senior Informatica EDC Developer-Business Intelligence (Contract),"New York, NY",Bloomberg,,3.9,"The vision of the team is to build products and provide data services that drive data quality and data governance across various master data domains (prospect,…"
Healthy Together Navigator,"Troy, NY 12180",Alliance for Better Health Care LLC,,,M-F flexible schedule during regular business hours. Maintain communication with the client and/or the referring organization to ensure acceptance and…
Business Analyst,"New York, NY",EZOPS,,,"Working closely with internal business, technicians, developers to agree to end client business specifications. Ability to simplify complex information."
Credit Quantitative Analyst/Data Scientist,"New York, NY",Citi,,3.9,"Create, implement, and support quantitative models for the credit trading business leveraging a combination of meticulous data analysis, traditional statistical…"
SENIOR RESEARCH ASSOCIATE,"Manhattan, NY",HRA/DEPT OF SOCIAL SERVICES,"$84,468 - $111,003 a year",3.9,Data as well as new research in income poverty metrics. Familiarity in analyzing administrative data or large datasets such as the American Community.
Data Science Software Developer,"New York, NY",Nielsen,,3.8,"Degree in computer science, engineering, or data science. You enjoy bridging the fields of data science and software development."
Data Governance and Strategy Analyst,"East Aurora, NY 14052",Moog Inc.,,3.8,"8 - 10 years of data governance and data strategy experience. Knowledge of Moog businesses preferable. Bachelor’s Degree in Business, IT or related field."
Research Engineer - Mechanical Components/Systems,"Niskayuna, NY 12309",General Electric,,4.0,"Extensive testing of rotating component, data acquisition, data reduction and design validation. PhD or MS with a minimum of 3 years of industrial experience in…"
Equity Research - Machinery Analyst / Associate,"New York, NY",Morgan Stanley,,3.9,"Experience writing in a professional capacity, e.g. crafting equity research notes / correspondence; presentation and/or development of industry reports."
Senior Data Analyst,"New York, NY 10019 (Midtown area)",Allianz Global Investors,,3.9,GDM team members leverage on dual competences: strong business knowledge of the data and advanced data analysis techniques.
"Business Intelligence Lead, Global Business Strategy & Operations","New York, NY (Chelsea area)",Google,,4.3,Bachelor's degree in a technical or quantitative/business-oriented field or equivalent practical experience. The Global Business Strategy (GBS) team helps make…
Data Pipeline Engineer,"New York, NY 10003 (Flatiron District area)",Rockerbox,,,We are looking for an engineer who is comfortable managing complex data pipelines and architecting the services behind them.
Data Analyst,"New York, NY",DataDog,,3.9,You have some experience with data stores similar to AWS Redshift or S3. You are able to clean a dataset and conduct a data analysis in Python or similar…
Senior Data Analyst,"New York, NY 10019 (Midtown area)",Allianz Global Investors,,3.9,GDM team members leverage on dual competences: strong business knowledge of the data and advanced data analysis techniques.
"Business Intelligence Lead, Global Business Strategy & Operations","New York, NY (Chelsea area)",Google,,4.3,Bachelor's degree in a technical or quantitative/business-oriented field or equivalent practical experience. The Global Business Strategy (GBS) team helps make…
Data Pipeline Engineer,"New York, NY 10003 (Flatiron District area)",Rockerbox,,,We are looking for an engineer who is comfortable managing complex data pipelines and architecting the services behind them.
Data Analyst,"New York, NY",DataDog,,3.9,You have some experience with data stores similar to AWS Redshift or S3. You are able to clean a dataset and conduct a data analysis in Python or similar…
Salesforce Senior Business Analyst,"New York, NY",Accenture,,4.0,"Minimum of 2 years’ as a Salesforce administrator or Salesforce App Builder. In addition to being responsible for business analyses, the BA would work directly…"
Sr. Database Developer,"New York, NY 10286 (Tribeca area)",BNY Mellon,,3.5,"Collaborate cross-functionally with data engineers, business users, project managers and other engineers to achieve elegant solutions."
Data Scientist,"New York, NY",Rhino New York,,,"As a member of the Data Science Team at Rhino, you will be partnering with Data Engineers and business teams to solve business problems by doing scalable…"
Research Scientist,"Syracuse, NY 13202 (Downtown area)",Textwise,,,"You will work with a team of scientists, software engineers, domain expertise and product managers to turn data into critical information and knowledge that…"
Database Administrator,"Amherst, NY 14226",AAA of Western & Central NY,,3.2,"Experience with data warehousing, business intelligence tools or data science a real plus. Develops data integration and security strategies."
Marketing Research Associate Job,"Glenville, NY 12302",MadAddie Marketing,,5.0,Can read lots of online data and help analyze client marketing opportunities. You go nuts over exploring new tracking tools and understand their algorithms of…
Business Administrator,"New York, NY","American Federation of State, County and Municipal...",,4.2,Work with membership database and dues related issues. Responding promptly and accurately to telephone or written inquiries.
Senior Medicaid Data Analyst,"Albany, NY",SVAM International Inc.,,,Knowledge of data integration and master data management. Knowledge of database and software development. Master’s degree or 3-5 years of experience in health…
Customer Asset Management Analyst - Business Banking Portfolio,"Getzville, NY",M&T Bank,,3.6,"Conduct highly complex data review, research, and/or reconciliation for assigned areas of CAM. Oversee and/or coordinate development and production of highly…"
Data Scientist - Training Specialist,"New York, NY",Dataiku,,,"Technical knowledge in key data analysis areas (machine learning algorithms, statistical analysis, relational database modelling, SQL, data manipulation and…"
"Manager, Data Governance","New York, NY",Turner,,4.0,Drive the development and implementation of data quality and data protection standards across relevant data domains.
Recruiting Coordinator,"New York, NY",Employment Opportunities at BuzzFeed,,,"This role is based in our NYC HQ and reports to the Director, Talent Acquisition. This is an entry-level position that is great for someone who is eager to…"
Specialized Contract Analyst,"Manhattan, NY 10007 (Financial District area)",OFFICE OF THE COMPTROLLER,"$50,000 - $65,000 a year",4.4,A four year high school diploma or its educational equivalent approved by a State’s Department of Education or a recognized accrediting organization and four…
Senior Data Analyst,"Westchester County, NY",Alliant Insight,,,Score data with existing models for analysis. Provide summaries of data assets for internal and external clients. Must have strong Microsoft Excel experience.
Data Software Engineer - Venn,"New York, NY","Two Sigma Investments, LLC.",,3.8,Background in building data models from various data sources. Demonstrated ability in identifying data validation rules and alerts based on data publishing…
Business Analyst,"Long Island City, NY 11104","Steve Madden, Ltd",,3.6,"Must have experience in the apparel, footwear, or fashion industry. Must have experience with the wholesale business processes from the vendor side."
"Data Analyst, WorkMarket","New York, NY 10001 (Chelsea area)",ADP,,3.8,Knowledge of SaaS-based business. Enterprise-grade data and systems knowledge. A myriad of data projects as needs arise.
Senior Data Engineer,"New York, NY",NDWA Labs,"$80,000 - $110,000 a year",,"Experience working in unions, workers’ rights, and/or social justice. Experience with lean and agile methodologies and/or with small, early-stage teams."
Business Analyst - SUNY Orange,"Middletown, NY 10940",SUNY Orange,"$45,220 - $59,915 a year",4.5,"The IT Business Analyst will play a critical role in participating in or leading requirements definition, data analysis, data modeling, and data integration…"
Data Scientist,"New York, NY",WorkFusion,,,This position requires a data scientist with a deep understanding of Machine Learning techniques and hands-on experience applying them to solve business…
"Manager, Business Intelligence","New York, NY","Horizon Media, Inc.",,3.8,"Experience with Git or a similar version control system Experience with Python or a similar programming language Experience with Presto, Hive, or Spark SQL…"
Head of IT,New York State,Quantum-Si,,,"The role will be a trusted business partner, constantly assessing the needs of the businesses as they enter varying phases of growth."
Data Base Administrator,"Rochester, NY",University of Rochester,,4.0,"Major hierarchical data base or major rational data base packages, communication and distributed systems experience preferred."
"Data Analyst I, Division of Pulmonary Medicine","New York, NY 10029 (East Harlem area)",Mount Sinai,,3.9,Identifies and implements solutions to data management issues and concerns that arise during the conduct of research studies.
Senior Data Engineer with Hadoop,"New York, NY 10006 (Financial District area)",Luxoft,,4.4,Assist data managers and developers with transformation rules and job scheduling. Construct and/or configure applications for data interfaces and conversion.
"Senior Data Scientist, Momentum","New York, NY",Worldgroup Careers MWT,,4.0,Take analytical objectives and define data requirements. Produce accurate statistical analysis and ensure high quality of the data analysis produced.
"Manager, Business Intelligence","New York, NY","Horizon Media, Inc.",,3.8,"Experience with Git or a similar version control system Experience with Python or a similar programming language Experience with Presto, Hive, or Spark SQL…"
Head of IT,New York State,Quantum-Si,,,"The role will be a trusted business partner, constantly assessing the needs of the businesses as they enter varying phases of growth."
Senior Research Scientist,"Albany, NY 12206 (Campus Area (University District) area)",Pearson,,3.7,"Familiarity with data privacy and ethics considerations associated with human subjects research. Locate, identify and/or extract usable data, both on- and off…"
Data Base Administrator,"Rochester, NY",University of Rochester,,4.0,"Major hierarchical data base or major rational data base packages, communication and distributed systems experience preferred."
"Data Analyst I, Division of Pulmonary Medicine","New York, NY 10029 (East Harlem area)",Mount Sinai,,3.9,Identifies and implements solutions to data management issues and concerns that arise during the conduct of research studies.
Senior Data Engineer with Hadoop,"New York, NY 10006 (Financial District area)",Luxoft,,4.4,Assist data managers and developers with transformation rules and job scheduling. Construct and/or configure applications for data interfaces and conversion.
"Senior Data Scientist, Momentum","New York, NY",Worldgroup Careers MWT,,4.0,Take analytical objectives and define data requirements. Produce accurate statistical analysis and ensure high quality of the data analysis produced.
Business Systems Analyst,"Bethpage, NY",Altice,,3.4,Synthesize business intelligence or trend data to support recommendations for action. Keen understanding of data storage with the ability to blend data from…
Data Analyst/ Data Quality,"Stony Brook, NY",iknowvate technologies,,,"2-3 years’ experience in a data analysis role and environment, with a strong emphasis on data quality. Bachelor's degree in Math, Data Science, or Engineering,…"
Sr Data Analyst - Inference and Insights,New York State,Collage.com,,4.6,"Experience retrieving data from SQL databases, and manipulating and analyzing data using complex SQL queries and computing languages such as R or Python."
Business Objects Developer,"New York, NY",SVAM International Inc.,,,"Must have excellent business analysis skills, able to interact with senior business staff to derive and interpret business needs."
Knowledge & Research Analyst,"New York, NY 10022 (Turtle Bay area)",Shearman & Sterling LLP,,3.9,Significant knowledge or data management experience within the legal or professional services environment. Support onboarding efforts of new attorneys and staff…
Data Operations Engineer,"Garden City, NY","HealthCare Partners, MSO",,1.8,Contribute to the enterprise data governance and data management processes. Serve as the resident technical expert with respect to relational database and…
Data Technician (Full- or Part-Time),"New York, NY",Thasos Group,,,The Data Technician role is an entry-level position suitable for someone looking to break into the startup/big data world and gain experience working with top…
TABLEAU DEVELOPER/ANALYTICS ANALYST,"New York, NY",Intone Networks,,4.2,Primary Responsibilities: • Utilize and blend data across programs and agencies developing advanced algorithms and scripts to improve health care and human…
Business Process Analyst,"Garden City, NY","HealthCare Partners, MSO",,1.8,Bachelor’s degree or equivalent experience in HealthCare operations field. Critical thinker with ability to draw conclusions from data that may not be expected.
Consultant- Strategy3,"New York, NY",Ipsos North America,,3.7,"Our Consultants play a key role in delivering on our client engagements, assisting in executive interviews, conducting primary and secondary research, preparing…"
Associate Data Scientist,"Buffalo, NY 14213 (Grant Ferry area)",Rich Products Corporation,,3.6,"The role may also support the related roles of data analyst, data engineer and DevOps engineer at times. Ability to understand business & functional needs and…"
Senior Data Analyst (Cooking),"New York, NY",The New York Times,,4.0,"Collaborate with internal data, engineering and product stakeholders to understand the business and develop data solutions. Experience with A/B testing."
"2021 Summer Analyst Program, Group Operations","New York, NY",UBS,,3.8,"Support new or emerging business areas by identifying limitations including systems, risk and operational feasibility. Plan, organize and communicate well."
LatAm and CEEMEA Institutional Equity Sales - Associate,"New York, NY","JPMorgan Chase Bank, N.A.",,3.9,Review the distribution of equity capital markets products for international companies into the U.S. Help match international firms that are looking to tap into…
Database Administrator,"Albany, NY",Maxpro,,5.0,Troubleshooting performance related issues on database level or PL/SQL query level. Moving huge amount of data using transportable tablespace method from one…
"Lead Data Engineer, Analytics",New York State,Duetto Research,,,Collaborate closely with data scientists and analysts to automate the processes around cleansing and validating data.
Business Analyst - Coverpath Distribution Management,"New York, NY",Haven Life,,,"Minimum 5 years of experience in a business analyst, project management or similar role. Analyze the 3rd party/product/downstream integration aspects of…"
"Senior Software, Data Analytics Engineer, SRE","New York, NY",Viacom,,4.0,"Respond to emerging incidents, solve critical issues through data, and follow through with a plan for resolution or future mitigation based on data."
Business Development Analyst,"New York, NY 10019 (Midtown area)","Paul, Weiss, Rifkind, Wharton & Garrison LLP",,4.0,"Bachelor’s degree, and two to four years of experience in an analyst/competitive intelligence/information services or technology/public relations/business…"
Analyst | DOE Revenue,"Manhattan, NY 10007 (Financial District area)",OFFICE OF MANAGEMENT & BUDGET,"$46,856 - $62,480 a year",4.1,"Analyst ($62,480): Bachelor's degree and a minimum of two years responsible administrative and/or budget experience; or an awarded Master's degree in Financial…"
Consulting Systems Engineer – Data Center Networking,"New York, NY",Aruba Networks,,3.8,"Master’s degree; or equivalent experience. CCIE, CWNE, ACMX and/or ACDX expert level certifications are preferred. Expert level knowledge with core switching."
Business Analytics & Reporting Analyst II,"Buffalo, NY",M&T Bank,,3.6,"Perform non-routine data review, research, and/or reconciliation. Identify resources that can be utilized to support business operations or improve existing…"
Specialized Contract Analyst,"Manhattan, NY 10007 (Financial District area)",Mayor's Office of Contract Services,"$50,000 - $65,000 a year",,A four year high school diploma or its educational equivalent approved by a State’s Department of Education or a recognized accrediting organization and four…
SENIOR RESEARCH ASSOCIATE,"New York, NY 10310 (West Brighton area)",Mayor's Office of Contract Services,"$84,468 - $111,003 a year",,Data as well as new research in income poverty metrics. Familiarity in analyzing administrative data or large datasets such as the American Community.
Biotechnology Research Analyst,"New York, NY",Tang Capital Management,,5.0,"Bachelor's or advanced degree in life sciences, chemistry or medicine required. This involves analyzing and interpreting complex medical, scientific and…"
Technology Operations Analyst,New York State,Unite Us,,5.0,Understand the business processes and how it impacts technical operations to consistently meet customer's business goals.
"Quantitative Business Analyst, Analytics and Decision Support, YouTube","New York, NY",YouTube,,4.4,Experience designing data models or table schema. 3 years of experience in manipulating data sets and conducting data analysis using SQL and Python.
DATA ANALYST,"Ronkonkoma, NY 11779",Perfume Center of America,,3.3,"Experience in SQL or other query languages. Great with data visualization- R Graphics, Tableau. As we want to develop our in-house Analytics, we want someone to…"
"Research Data Associate, Psychiatry - Addictive Disorders","New York, NY",NYU Langone,,4.1,"Experience in clinical research, public health, or community outreach and interest in working within addiction and/or mental health preferred."
"Research Analyst, Global Research & Insights Team","New York, NY",Conde Nast,,4.0,"Effectively work with external research vendors throughout research process: data collection, data processing and results reporting; QA vendor deliverables…"
"Data Analyst, Growth","SoHo, NY",Lemonade Insurance Company,,2.5,Proven track record of leveraging analytical expertise to deliver actionable and impactful business insights.
Business Analyst/Project Manager,"New York, NY",Citi,,3.9,"Identify and communicate risks and impacts, considering business implications of the application of technology to the current business environment."
DATA ANALYST,"Bronx, NY 10451 (South Bronx area)",Montefiore Medical Center,,4.1,"Minimum bachelor's (data analytics, computer science, information systems, health administration, or related fields) with 2 years of experience as data analyst."
Product Data Analyst,"New York, NY 10001 (Chelsea area)",Food52,,,"Use business intelligence tools to automate reporting across and deliver data, modeling out metrics, table schema, and reporting dashboards."
Specialized Contract Analyst,"Manhattan, NY 10007 (Financial District area)",OFFICE OF THE COMPTROLLER,"$50,000 - $65,000 a year",4.4,A four year high school diploma or its educational equivalent approved by a State’s Department of Education or a recognized accrediting organization and four…
"Staff Writer, HWD, Vanity Fair","New York, NY",Conde Nast,,4.0,"Muscular long-form journalism, stunning photography, insightful essays, and superb design make each issue of Vanity Fair a must-read."
"Data Scientist, Analytics - Business Payments","New York, NY 10003 (Flatiron District area)",Facebook,,4.2,"Python, R or SQL experience. BS, MS or PhD Degree in Statistics, Computer Science, Econometrics, or similar domain."
Research Assistant,"New York, NY",Columbia University,"$51,958 a year",4.1,Assist on the database maintenance and data cleaning. Generate analysis files needed by genetic analysts. Bachelor's degree and at least one and one-half years…
Senior Associate Scientist -Vaccine Research and Development – Formulation Development,"Pearl River, NY 10965",Pfizer,,4.2,"BS in Pharmaceutics, Biochemistry, Life Sciences or related discipline plus 2 or more years of related work experience, or MS in related discipline."
Value Analysis Business Coordinator,"Johnson City, NY 13790",United Health Services,,3.3,"Provides primary analyst support for all system supply chain activities at UHS. Bachelor’s of Science degree in Management Engineering, Industrial Engineering,…"
"Senior Data Scientist, Analytics & Inference",New York State,Codecademy,,4.2,"4+ years of industry experience in a data science, analytics, or research role. Mentor and consult with a cross-functional team of data scientists, engineers,…"
Sr. Business Analyst,"New York, NY 10014 (West Village area)",Medidata Solutions,,3.6,"Facilitate integration of new data sources/elements for analytics and business intelligence products, and provide ongoing monitoring of data sources and data…"
"Senior Analyst, Data Analytics","New York, NY",Unqork,,,3+ years experience performing advanced analytics using structured and unstructured data. Communicate and present data driven insights to the product and…
Head of Content Business Innovation and Market Intelligence,"New York, NY",Spotify,,4.3,"Highly analytical; critically and objectively evaluates information, data and insights to enhance your understanding and make strategic business recommendations…"
Sr Data Scientist,"New York, NY 10104 (Midtown area)",Digitas,,3.8,"Developing and testing scalable data pipelines or models for real-time applications. A Bachelor’s or Master’s degree in a quantitative field such as statistics,…"
Business Analyst,"New York, NY",Excellent Business Consultants,,,"Gather data on competitors & analyze their prices, sales, & method of marketing & distribution. Conversant with marketing, advertising, & communications…"
Business Process Analyst,"Garden City, NY","HealthCare Partners, MSO",,1.8,Bachelor’s degree or equivalent experience in HealthCare operations field. Critical thinker with ability to draw conclusions from data that may not be expected.
Sales Engineering Business Analyst,"New York, NY",Spotify,,4.3,"3+ years experience as a Business Analyst, business systems analysis, or related business process improvement function. Perks of being in the band."
Senior Data Engineer,"New York, NY",ION,,3.9,"College degree in Computer Science or related field of study or equivalent experience. Communicate with leadership, product owners, other technologists and…"
Consulting Systems Engineer – Data Center Networking,"New York, NY",Aruba Networks,,3.8,"Master’s degree; or equivalent experience. CCIE, CWNE, ACMX and/or ACDX expert level certifications are preferred. Expert level knowledge with core switching."
Business Analyst,"Bronx, NY 10474 (Hunts Point area)",S Katzman Produce,,,The business analyst will define scope and objectives and formulate systems to support the overall business strategies. Analysis of pricing & buying trends.
TABLEAU DEVELOPER/ANALYTICS ANALYST,"New York, NY",Intone Networks,,4.2,Primary Responsibilities: • Utilize and blend data across programs and agencies developing advanced algorithms and scripts to improve health care and human…
Data Administrator - Finance (FTE),"New York, NY","Stage 4 Solutions, inc.",,,Working experience in administration of business intelligence tools like Tableau or integrations tools like Talend.
