job_title,location,company,salary,rating,summary
Food Systems Specialist,"Tempe, AZ",Arizona State University,"$38,000 - $50,000 a year",4.2,Collects and analyzes research data and other literature and drafts research materials as part of the research team for the Swette Center’s food policy related…
"Analyst, Enterprise Security","Tempe, AZ 85281",Carvana,,2.7,"Work with end-users to validate data and ensure buy-in with new reporting or analysis. Master's degree (preferably in business, finance, criminal justice, or…"
Financial Analyst,"Phoenix, AZ 85018 (Camelback East area)",Shamrock Foods,,3.3,"Collects and analyzes financial information for assigned accounts, products or product lines, or business units in order to track the organization's progress."
VIAS Nonprofit Investment Analyst Manager,"Scottsdale, AZ 85260 (North Scottsdale area)",Vanguard,,3.8,Oversees internal partnerships and the use of external data systems or tools to support the department's analytical capabilities.
"Claims Experience Advocate, Liability","Scottsdale, AZ",Lemonade Insurance Company,,2.5,"Comfortable with and adaptable to new technology and business tools. Licensed as an adjuster in NY, CA, or FL – a plus."
Summer Branch Analyst Program,"Phoenix, AZ",Morgan Stanley,,3.9,Perform market research and analyze financial data for client portfolios. An ability to understand and interpret numeric data.
Resolutions Administrator,"Phoenix, AZ 85017 (Alhambra area)",Grand Canyon University,,3.9,"Familiarity with working with large data bases, Excel and/or Access. Occasional weekends, evening or holiday work may occur."
Chief Engineer,"Chandler, AZ",JLL,,3.8,"High School diploma or GED equivalent. Supervise and manage engineers and maintenance staff including hiring, training and personal development."
Data & Demographics Reporter,"Phoenix, AZ",Gannett,,3.1,Bachelor's or master’s degree in journalism or data-related field or an equivalent combination of education and experience.
Senior Application Analyst,"Glendale, AZ 85304",Washington Elementary School District 6,,3.8,"The employee is occasionally required to stand; walk; climb or balance; stoop, kneel, crouch, or crawl; and taste or smell."
Associate Consulting Engineer – Federal (Data Center),"Phoenix, AZ 85001 (Central City area)",CDW,,3.7,"Ability to work select weekends and/or after hours when business needs arise. 3+ years relevant practical experience in IT networking, information systems…"
Environmental Engineer Specialist 3 - Waste Programs,"Phoenix, AZ 85007 (Central City area)",AZ Dept of Environmental Quality,"$70,000 - $75,000 a year",,Bachelor’s degree in environmental/chemical engineering or other engineering discipline. We are looking for engineers to help drive our agency towards…
Water Quality Specialist,"City of Tempe, AZ",City of Tempe Arizona,$23.06 - $31.13 an hour,,"Requires two years of treatment, maintenance or laboratory testing experience in water or wastewater systems. Collect drinking water, wastewater, stormwater and…"
Customer Experience Manager,"Scottsdale, AZ",Lemonade Insurance Company,,2.5,"A passion for using data to improve your team’s performance. Impressive leadership skills, with experience coaching a team of 5 or more."
Customer Engineer IV (C4),"Chandler, AZ",Applied Materials Inc.,,3.9,Uses routine process data and on site data logging functions to diagnose system downs. Gathers and analyzes data to identify and solve problems that arise with…
Business Development Manager,"Phoenix, AZ",626 Holdings LLC,"$40,000 - $85,000 a year",5.0,"Document and share lead/customers intelligence with sales managers and sales team. Generates and promote new leads, close contractual and contractual business…"
Packaging and Test Research and Development Engineer,"Phoenix, AZ 85018 (Camelback East area)",Intel,,4.1,3 to 5 years of experience in RF and/or optical packaging and/or test required. CQN is looking for a Packaging and Test engineer with experience in Radio…
Senior RF Research Scientist,"Mesa, AZ",Cree Inc,,3.4,"The research scientist will own and drive to completion projects to develop new integration methods, design methodologies, and technical capabilities…"
Customer Experience Manager,"Scottsdale, AZ",Lemonade Insurance Company,,2.5,"A passion for using data to improve your team’s performance. Impressive leadership skills, with experience coaching a team of 5 or more."
Customer Engineer IV (C4),"Chandler, AZ",Applied Materials Inc.,,3.9,Uses routine process data and on site data logging functions to diagnose system downs. Gathers and analyzes data to identify and solve problems that arise with…
MySQL / Mariadb Database Administrator Dba,,BODIS,,4.0,"Experience working with big data and analytical-type queries. Work with team to provide them SQL export data when needed. MYSQL 8.0+, 5+ years experience."
Business Development Manager,"Phoenix, AZ",626 Holdings LLC,"$40,000 - $85,000 a year",5.0,"Document and share lead/customers intelligence with sales managers and sales team. Generates and promote new leads, close contractual and contractual business…"
Packaging and Test Research and Development Engineer,"Phoenix, AZ 85018 (Camelback East area)",Intel,,4.1,3 to 5 years of experience in RF and/or optical packaging and/or test required. CQN is looking for a Packaging and Test engineer with experience in Radio…
Senior RF Research Scientist,"Mesa, AZ",Cree Inc,,3.4,"The research scientist will own and drive to completion projects to develop new integration methods, design methodologies, and technical capabilities…"
Manager / Senior Manager - Data Scientist / Risk Management,"Phoenix, AZ",American Express,,4.1,"Demonstrated ability to frame business problems into machine learning problems, leverage external thinking and tools (from academia and/or other industries) to…"
Logistics,"Phoenix, AZ 85016 (Camelback East area)",Next Phase Enterprises,,4.2,"Constantly look for ways to improve the business. Foresee and effectively address issues in production, delivery, upcoming promotions, and changes in inventory…"
Performance Improvement Analyst 02303,"Mesa, AZ","Community Bridges, INC",,3.1,Creates graphical representations and/or dashboard reports using data from multiple systems and/or sources. Provides analytical support for business operations…
Digital Banking - Engineering Director,"Phoenix, AZ",American Express,,4.1,"Solid foundation in design, data structures and algorithms, and strong analytical and debugging skills with customer-facing products experience."
Internal Business Consultant Associate,"Tempe, AZ",John Hancock,,4.0,"Provide superior support by providing timely reports, conducting research, and collaborating on ongoing projects."
Programmer Analyst,"Mesa, AZ 85201 (Northwest area)",Cognizant Technology Solutions,,3.9,"Troubleshooting outlook issues like configuration issues while configuring accessing emails, PST, Creation PST files, tracking and retrieving data application…"
Senior Technical Analyst – Customer Data & CRM,"Phoenix, AZ 85027",PetSmart,,3.5,"Acts as liaison between database administrator, business analyst and data architect to drive optimal architecture that delivers the business requirements."
Lead Financial Analyst - Artificial Intelligence Strategic Growth Offering (AI SGO) Finance & Investment,"Phoenix, AZ 85012 (Encanto area)",Deloitte,,4.0,Co-owner of the AI SGO Business Case as well as other financial and business models needed for the business. The AI SGO Finance & Investment Lead will assist in…
Manufacturing Engineer,"Phoenix, AZ 85040 (South Mountain area)",Barnes Group Inc.,,3.8,"Prepares method instructions (Operation Sheets) to include setup procedure, tool lists, operation sequence, machine speeds and feeds time standards, process…"
Sourcer-Remote,"Phoenix, AZ","Side, Inc.",,1.6,3+ years of relevant sourcing experience required (either in-house or agency). Our stewardship of the data of many of our customers means that a background and…
Revenue Integrity Analyst,"Phoenix, AZ",St Josephs Hospital and Medical Center,,3.9,Bachelors in Business or related field preferred. Working with CDM analyst and department managers to control late charges and improve charge capture.
Software Testing Engineer and Support Team Leader Job Details,"Mesa, AZ 85212","Manageware, LLC","$30,000 - $55,000 a year",,"High school or equivalent (Preferred). Sanitizing, disinfecting, or cleaning procedures in place. Risk assessment to the business across all projects,…"
In-Geography Sales Leader,,OMNI Healthcare & Glofin Financial,"$60,000 - $200,000 a year",,Associates or Bachelor's Degree (or equivalent experience). Prior healthcare and\\or personal injury attorney marketing experience a plus.
Planning Intern - 2021,"Tempe, AZ",WSP USA,,3.7,"Current standing as a Rising Junior, Senior or Graduate student actively enrolled in an accredited Planning (or related) Undergraduate or Graduate program."
Product Management Intern - Summer 2021,"Scottsdale, AZ 85257 (South Scottsdale area)",Paradox,,4.5,"Be a rising senior or graduate student in Computer Science, Business, or a related field. Support the product development life-cycle, including research,…"
"Manager, ESG Reporting - Opportunity for Working Remotely Phoenix, AZ","Phoenix, AZ",VMware,,4.0,Build relationships across functions and business units to enable opportunities for improvement. Bachelor’s degree (advanced degree preferred) or equivalent…
Sr. Associate - Projects,"Glendale, AZ 85301",Cognizant Technology Solutions,,3.9,Guide the service analyst on estimation. Collate data and provide inputs for reporting requirements. Communication with Business users related to resolving…
"Sales Operations Analyst, Sr.","Scottsdale, AZ 85254 (Paradise Valley area)","United Rentals, Inc.",,3.6,Degree in Finance or Accounting preferred. Gather customer and company historical data to create analyses that support the sales organization to leverage the…
Clinical Systems Analyst III – Imaging/Radiology,"Scottsdale, AZ 85254 (North Scottsdale area)",Phoenix Children's Hospital,,3.9,"Researches, plans and makes recommendations to meet business requirements. Demonstrates effective emotional intelligence in order to effectively handle pressure…"
Senior SCADA Engineer,"Phoenix, AZ 85024 (Deer Valley area)","POWER Engineers, Inc.",,3.6,"Data Acquisition: Prepare points lists of all data to be transferred between control centers and controlled apparatus, assign and program data addressing and…"
AZ Health Zone Local Agency Liaison,"Phoenix, AZ 85007 (Central City area)",State of Arizona,"Up to $51,626 a year",3.5,"Developing trainings and/or tools to address reporting concerns. Policies, data management, data collection, analysis, and interpretation, and technical report…"
Research & Development Tech I,"Chandler, AZ",Isola Group,,2.9,"You have previous experience in manufacturing and/or R&D,. You will support chemist, engineers and other departments, which R&D partners."
Associate EHS Specialist,"Mesa, AZ 85202 (Southwest area)",Dexcom,,3.3,Follows standard practices and procedures in analyzing situations or data from which answers can be readily obtained.
AML Rule Engineer,"Chandler, AZ 85286",PayPal,,3.9,"5+ years experience in database design and data modeling. Experience with data modeling, ETL development and other data warehousing."
Research & Development Tech I,"Chandler, AZ",Isola Group,,2.9,"You have previous experience in manufacturing and/or R&D,. You will support chemist, engineers and other departments, which R&D partners."
Associate EHS Specialist,"Mesa, AZ 85202 (Southwest area)",Dexcom,,3.3,Follows standard practices and procedures in analyzing situations or data from which answers can be readily obtained.
AML Rule Engineer,"Chandler, AZ 85286",PayPal,,3.9,"5+ years experience in database design and data modeling. Experience with data modeling, ETL development and other data warehousing."
Software QA Engineer,"Scottsdale, AZ 85260 (North Scottsdale area)",Integrated transportation Management LLC,"$70,000 - $80,000 a year",,"The employee is occasionally required to sit; climb or balance; and stoop, kneel, crouch or crawl. Knowledge or experience in the logistics industry preferred."
Cost Analyst,"Phoenix, AZ 85009 (Maryvale area)",Shamrock Foods,,3.3,Bachelor's degree in accounting or finance. 2-4 years of experience in financial analysis roles directly supporting business leaders.
Dispute Analyst I - Customer Service,"Scottsdale, AZ",GlobalTranz,,3.2,"High School Diploma or equivalent (prefer some college). This would require the ability to lift files, open filing cabinets and bending or standing on a stool…"
Software Support Representative,"Scottsdale, AZ 85250 (South Scottsdale area)",AutoMon LLC,"$35,000 - $40,000 a year",,"Record customer information within our customer service database. Sanitizing, disinfecting, or cleaning procedures in place."
Financial Analyst,"Scottsdale, AZ 85258 (North Scottsdale area)",Natural Partners Fullscript,"$70,000 a year",3.7,Lead or assist in the creation of ad hoc analysis including costing analysis to drive greater understanding of the underlying business. MBA/CPA is a plus.
UTILITIES ENGINEER,"Phoenix, AZ 85007 (Central City area)",State of Arizona,,3.5,"Degree in Civil, Sanitary, Environmental, Civil Technology, Chemical or Mechanical Engineering, and/or registration as a Professional Engineer."
Study Facilitator,"Phoenix, AZ 85027 (Deer Valley area)",Exponent,,4.0,"Master’s or Ph.D. (preferred) level students in Developmental, Experimental, Industrial or Cognitive Psychology, or Industrial Engineering (emphasis on Human…"
"Director, ShapingEDU","Tempe, AZ",Arizona State University,,4.2,Experience leading and/or managing a quickly-evolving organization or team; experience leading and collaborating with cross-functional teams.
Contract Monitor-Quality Work Review,"Glendale, AZ 85301","City of Glendale, AZ","$49,446 - $74,169 a year",3.8,"Serves as a backup administrator to work order system. Municipal, or City of Glendale, contractual procedures. Coordinates contractor and customer scheduling."
Staff Verification Engineer,"Chandler, AZ",Arm,,4.2,"MS or BS in Computer Science, Electrical Engineering, or Computer Engineering or similar disciplines. Strong software engineering skills including understanding…"
Accountant/Finance Business Partner,"Phoenix, AZ",GKN Aerospace,,3.4,"Provide business partnering to site based functions – provide insight, analysis and reporting according to their requirements, and support in interpreting and…"
Intelligent Transportation Systems (ITS) Network Engineer,"Gilbert, AZ 85296",Town of Gilbert,"$72,374 - $108,561 a year",2.9,"Experience Implementing I2V, V2I, protocol or C2V portal which allows real-time traffic data to be published to connected vehicles and devices;"
VIAS Nonprofit Investment Analyst Manager,"Scottsdale, AZ 85260 (North Scottsdale area)",Vanguard,,3.8,Oversees internal partnerships and the use of external data systems or tools to support the department's analytical capabilities.
"Claims Experience Advocate, Liability","Scottsdale, AZ",Lemonade Insurance Company,,2.5,"Comfortable with and adaptable to new technology and business tools. Licensed as an adjuster in NY, CA, or FL – a plus."
Summer Branch Analyst Program,"Phoenix, AZ",Morgan Stanley,,3.9,Perform market research and analyze financial data for client portfolios. An ability to understand and interpret numeric data.
Resolutions Administrator,"Phoenix, AZ 85017 (Alhambra area)",Grand Canyon University,,3.9,"Familiarity with working with large data bases, Excel and/or Access. Occasional weekends, evening or holiday work may occur."
Chief Engineer,"Chandler, AZ",JLL,,3.8,"High School diploma or GED equivalent. Supervise and manage engineers and maintenance staff including hiring, training and personal development."
Data & Demographics Reporter,"Phoenix, AZ",Gannett,,3.1,Bachelor's or master’s degree in journalism or data-related field or an equivalent combination of education and experience.
Senior Application Analyst,"Glendale, AZ 85304",Washington Elementary School District 6,,3.8,"The employee is occasionally required to stand; walk; climb or balance; stoop, kneel, crouch, or crawl; and taste or smell."
Associate Consulting Engineer – Federal (Data Center),"Phoenix, AZ 85001 (Central City area)",CDW,,3.7,"Ability to work select weekends and/or after hours when business needs arise. 3+ years relevant practical experience in IT networking, information systems…"
Environmental Engineer Specialist 3 - Waste Programs,"Phoenix, AZ 85007 (Central City area)",AZ Dept of Environmental Quality,"$70,000 - $75,000 a year",,Bachelor’s degree in environmental/chemical engineering or other engineering discipline. We are looking for engineers to help drive our agency towards…
Water Quality Specialist,"City of Tempe, AZ",City of Tempe Arizona,$23.06 - $31.13 an hour,,"Requires two years of treatment, maintenance or laboratory testing experience in water or wastewater systems. Collect drinking water, wastewater, stormwater and…"
Customer Experience Manager,"Scottsdale, AZ",Lemonade Insurance Company,,2.5,"A passion for using data to improve your team’s performance. Impressive leadership skills, with experience coaching a team of 5 or more."
Customer Engineer IV (C4),"Chandler, AZ",Applied Materials Inc.,,3.9,Uses routine process data and on site data logging functions to diagnose system downs. Gathers and analyzes data to identify and solve problems that arise with…
Business Development Manager,"Phoenix, AZ",626 Holdings LLC,"$40,000 - $85,000 a year",5.0,"Document and share lead/customers intelligence with sales managers and sales team. Generates and promote new leads, close contractual and contractual business…"
Packaging and Test Research and Development Engineer,"Phoenix, AZ 85018 (Camelback East area)",Intel,,4.1,3 to 5 years of experience in RF and/or optical packaging and/or test required. CQN is looking for a Packaging and Test engineer with experience in Radio…
Senior RF Research Scientist,"Mesa, AZ",Cree Inc,,3.4,"The research scientist will own and drive to completion projects to develop new integration methods, design methodologies, and technical capabilities…"
Packaging and Test Research and Development Engineer,"Phoenix, AZ 85018 (Camelback East area)",Intel,,4.1,3 to 5 years of experience in RF and/or optical packaging and/or test required. CQN is looking for a Packaging and Test engineer with experience in Radio…
Senior RF Research Scientist,"Mesa, AZ",Cree Inc,,3.4,"The research scientist will own and drive to completion projects to develop new integration methods, design methodologies, and technical capabilities…"
Manager / Senior Manager - Data Scientist / Risk Management,"Phoenix, AZ",American Express,,4.1,"Demonstrated ability to frame business problems into machine learning problems, leverage external thinking and tools (from academia and/or other industries) to…"
Logistics,"Phoenix, AZ 85016 (Camelback East area)",Next Phase Enterprises,,4.2,"Constantly look for ways to improve the business. Foresee and effectively address issues in production, delivery, upcoming promotions, and changes in inventory…"
Performance Improvement Analyst 02303,"Mesa, AZ","Community Bridges, INC",,3.1,Creates graphical representations and/or dashboard reports using data from multiple systems and/or sources. Provides analytical support for business operations…
Digital Banking - Engineering Director,"Phoenix, AZ",American Express,,4.1,"Solid foundation in design, data structures and algorithms, and strong analytical and debugging skills with customer-facing products experience."
Internal Business Consultant Associate,"Tempe, AZ",John Hancock,,4.0,"Provide superior support by providing timely reports, conducting research, and collaborating on ongoing projects."
Programmer Analyst,"Mesa, AZ 85201 (Northwest area)",Cognizant Technology Solutions,,3.9,"Troubleshooting outlook issues like configuration issues while configuring accessing emails, PST, Creation PST files, tracking and retrieving data application…"
Senior Technical Analyst – Customer Data & CRM,"Phoenix, AZ 85027",PetSmart,,3.5,"Acts as liaison between database administrator, business analyst and data architect to drive optimal architecture that delivers the business requirements."
Lead Financial Analyst - Artificial Intelligence Strategic Growth Offering (AI SGO) Finance & Investment,"Phoenix, AZ 85012 (Encanto area)",Deloitte,,4.0,Co-owner of the AI SGO Business Case as well as other financial and business models needed for the business. The AI SGO Finance & Investment Lead will assist in…
Manufacturing Engineer,"Phoenix, AZ 85040 (South Mountain area)",Barnes Group Inc.,,3.8,"Prepares method instructions (Operation Sheets) to include setup procedure, tool lists, operation sequence, machine speeds and feeds time standards, process…"
Logistics Transportation Analyst,,Knight & Swift Logistics,"$40,000 - $45,000 a year",3.1,Transportation Analysts also focus on securing new business relationships with third-party freight carriers and helping our business model expand all the…
Client Operations Analyst,"Scottsdale, AZ",Willis Towers Watson,,3.7,Must successfully complete appropriate licensing exam(s) and/or maintain required licensing by completing various Continuing Education activities as needed.
"Vice President, Brand Digital & Social","Phoenix, AZ",Phoenix Suns / Sports & Entertainment Services/Pho...,,,Analysis & Insight – A strong reliance on data analysis is expected to measure performance against set critical metrics annually.
Sourcer-Remote,"Phoenix, AZ","Side, Inc.",,1.6,3+ years of relevant sourcing experience required (either in-house or agency). Our stewardship of the data of many of our customers means that a background and…
QA Engineer II,"Tempe, AZ 85281",PulteGroup,,3.8,Consults with other teams regarding technology solutions for business needs and/or problem resolution. Analyzes business requirements and asks probing questions…
Data Designer @ Fjord,"Phoenix, AZ 85016 (Camelback East area)",Accenture,,4.0,"3+ years of big data, analytics, or data visualization experience; prior consultancy experience preferred. Bachelor's degree or equivalent (minimum 12 years)…"
Customer Experience Analyst,"Mesa, AZ",Santander Bank,,3.6,Monitors database activity and the relationships between the database users and applications to ensure appropriate data usage and resolve data conflicts.
Technical Support Associate Analyst,"Tempe, AZ 85281",Cigna,,3.7,Works on site specific department projects and/or sub-projects. Interacts with other support groups to restore service and /or identify and correct end-user…
Sr. Windows Operations Engineer,"Tempe, AZ","Mufg Union Bank, National Association",,,"Bachelor’s degree in Information Technology or Computer Science. Knowledge of network security systems, intrusion detection systems, and data backup."
Project Administrator,"Scottsdale, AZ 85253 (South Scottsdale area)",The McShane Companies,,,Associates degree or equivalent combination of education and experience. Ability to use or learn project management software. Assist with take-off analysis.
Information Security Engineer,"Chandler, AZ",Abtsus LLC,$33 - $50 an hour,,Ability to analyze data feeds and provide feedback to business partners. Ability to work with business partners to trouble shoot issues.
Customer Service - Online T-Shirt Design,"Tempe, AZ 85281",DesignAShirt,$15 - $18 an hour,,"Record customer information within our customer service database. Communicating with other departments like production, artists, and web developers."
Senior Financial Rate Analyst,"Phoenix, AZ 85007 (Central City area)",State of Arizona,"Up to $52,300 a year",3.5,Analyze financial data accurately to develop meaningful conclusions. Bachelor's degree in Business/Finance or a related field with 4 years of work experience in…
Graduate Intern Technical,"Phoenix, AZ 85018 (Camelback East area)",Intel,,4.1,6+ months of numerical or experimental research in fluid dynamics/thermals or related field. Pursuing MS or PhD degree in Mechanical Engineering or related…
Flow Cytometry Clinical Laboratory Scientist - Glendale AZ,,Palo Verde Cancer Specialists - TBO,"$60,000 - $70,000 a year",,"Personal protective equipment provided or required. Sanitizing, disinfecting, or cleaning procedures in place. Written and verbal communication skills."
BCBA - Board Certified Behavior Analyst,,Scottsdale Pediatric Behavioral Services,"$90,000 - $100,000 a year",,"Personal protective equipment provided or required. Sanitizing, disinfecting, or cleaning procedures in place. A bright and sunlit working environment with."
Public Safety Radio Engineer,,Maricopa County,$25.00 - $33.88 an hour,3.5,"Must possess a valid Arizona driver's license, or obtain one at the time of hire. Maintains database with the up to date status reports of county radio licenses…"
Semiconductor Device Engineer,,"Advent Diamond, Inc.",$40 - $60 an hour,,"Analyze and present electrical data. May guide technicians and/or interns and carry out other research, fabrication, design, and testing responsibilities as…"
"Senior Technician, Engineering",,EPCOR USA,$12 - $47 an hour,,"Communicate frequently with developers, homebuilders, engineers, customers and operators of water and wastewater systems."
Data Engineer,,LeaseHawk,"$87,566 - $150,473 a year",4.5,"Demonstrated understanding of data lakes and data warehouses using Snowflake, Redshift, or similar platform. Proficient with SQL, data modeling, data management…"
