job_title,location,company,salary,rating,summary
Process Analyst,"Mesa, AZ 85202 (Southwest area)",Dexcom,,3.3,Works on problems of moderate scope where analysis of situations or data requires a review of a variety of factors. Diagrams and evaluates existing processes.
Principal Engineer - IAM Data Scientist,"Phoenix, AZ",Wells Fargo,,3.7,3+ years of experience in one or more business intelligence tools. A Masters degree or higher in computer science or finance. A Master's degree or higher.
Financial Analyst,"Phoenix, AZ",4Front Ventures,"$72,000 - $88,000 a year",2.9,Monthly business performance reviews support. Ability to collaborate among multiple business units. Ability to thrive in situations without much direction or…
Field Engineer / Depot Operations,"Gilbert, AZ 85233",LOCKHEED MARTIN CORPORATION,,4.0,Documents work in automated maintenance data collection systems IAW Apache Fire Control processes and procedures. Ability to lift 35 pounds.
Head of Marketing - Scale up,"Phoenix, AZ 85004 (Central City area)",BlueOptima,"$82,000 a year",4.0,Broader experience in Product Management and/or Sales. Experience of working in an SME or Start-up environment.
Lead Machine Learning Engineer,"Scottsdale, AZ","U.S. Xpress Enterprises, Inc.","Up to $150,000 a year",3.0,"Experience with big data frameworks, such as Kafka, Spark, or Hadoop. Physical Requirements: * While performing the duties of this job the employee must have…"
ASIIS Application Analyst,"Phoenix, AZ 85007 (Central City area)",State of Arizona,"Up to $47,500 a year",3.5,"Bachelor's degree in business administration and 1 year experience in business administration and related experience in the analysis, presentation and…"
"Deloitte Alumni: Talent Temporary Workforce – Lead, Talent Business Analyst","Phoenix, AZ 85012 (Encanto area)",Deloitte,,4.0,Analyzes data and fundamental information about the business and provides high level expertise and analytics. Undergraduate degree required (4 year).
Data / Integration Engineer - REMOTE,"Phoenix, AZ",Grid Dynamics,,,Design and build robust data integrations within our data platform and between the engineering systems to enable touchless data processing.
Valuation Analyst,"Phoenix, AZ",Eave Inc,,,Prior experience with valuing or buying residential real estate. Comfort with ambiguity and ability to change course or adopt new processes as needed.
Business Analyst / Project Manager,"Glendale, AZ 85306",Peoria Unified School District,,3.9,For the purpose of conveying and/or documenting information regarding District activities and/or procedures. Performs other duties as assigned or required.
DevOps Engineer,"Tempe, AZ 85281",Mindspace,,3.4,Have excellent working knowledge of Docker (or other containerization technology) and Kubernetes. You will also play a critical role in supporting the…
GPR Analyst,"Phoenix, AZ",Penhall Company,,3.0,"Has background or experience with GPR, concrete scanning, utility location and/or general construction. Must be able to lift at least 50 lbs. or more."
Credit Analyst - National Credit Center,"Chandler, AZ 85286",GM Financial,,3.6,"Associate Degree with emphasis in Marketing/Finance, or related field, or equivalent experience preferred. High School Diploma or equivalent required."
Product Engineer,,NXP Semiconductors,,3.8,Bachelor’s degree or higher and at least 10 years or more of experience. Experience with data analysis software in support of Characterization Reports and Yield…
Sr. Operations Business Analyst - Verint,,Cenlar FSB,,2.9,Project management/leadership and/or business analyst experience preferred. Strong analytical skills – Ability to work with large amounts of data and translate…
Marketing Operations Analyst,,Trox,,3.9,"Bachelor’s degree in marketing, business, data analytics or related field. Champion efforts surrounding data management, data integrity, lead generation scoring…"
Pre-Sales Engineer (Solutions Architect),,"Global Market Innovators, Inc.",,,"Minimum six years of sales or sales engineering experience in a business-to-business, large/strategic customer segment; or a record of achievement and technical…"
Public Safety Radio Engineer,,Maricopa County,$25.00 - $33.88 an hour,3.5,"Must possess a valid Arizona driver's license, or obtain one at the time of hire. Maintains database with the up to date status reports of county radio licenses…"
Senior Operations Business Analyst,"Tempe, AZ",Cenlar FSB,,2.9,Strong analytical skills – Ability to work with large amounts of data and translate into analytical findings and business recommendations.
Data Engineer – Insurance Group Domain client,"Phoenix, AZ 85001 (Central City area)",Ivy Tech Solutions inc,,,Develops data models to define new or modify existing data structures in support of data integration initiatives. Data Engineer – Insurance Group Domain client.
BUSINESS SYSTEMS ANALYST,"Scottsdale, AZ 85260 (North Scottsdale area)",Electronic Payment Providers Inc,,,5 years of hands-on experience as a business systems analyst or Agile Scrum product owner delivering cutting edge technology solutions.
"Senior Analyst, Global Data Governance & Strategy","Tempe, AZ 85284",Circle K,,3.3,Ensures data element lineage and business/technical metadata is well documented. Aid in the development of the business data dictionary across all functions.
Small Business Development Analyst Senior (Specially Funded),"Maricopa County, AZ",Maricopa Community Colleges,"$48,728 - $63,347 a year",3.8,"A. Four (4) or more years of experience in financial analysis, business planning, access to capital, gathering information on business operations, conducting…"
Operations Analyst,"Phoenix, AZ",Synchronoss Technologies,,3.4,This role contributes to Synchronoss’ Media Support team by providing assistance to business operations such as front end document or transaction content…
Business Process Analyst,"Chandler, AZ 85286",PayPal,,3.9,"Business analyst or equivalent experience. Knowledge of solutions that utilize artificial intelligence, machine learning and/or neural networking."
Business Process Management Analyst,"Phoenix, AZ 85003",Public Consulting Group,,3.9,"Experience: Minimum of 2 years of experience in a health or human services related field, lean six sigma role, or similar industry required."
Business System Analyst 3,"Chandler, AZ 85286",PayPal,,3.9,"Experience in building Insights from data - associations among data, business rules/logics, data flows, data usages. Conduct user acceptance testing (UAT)."
Big Data Engineer,"Phoenix, AZ 85016 (Camelback East area)",Accenture,,4.0,A Big Data engineering maestro who knows how to build modern data architectures to provide mountains of data to data analysts and scientists.
"Engineer, Planning",,EPCOR USA,$29 - $46 an hour,,"Personal protective equipment provided or required. Education: 4-year degree in Civil or Environmental Engineering, or a related technical degree."
Semiconductor Device Engineer,,"Advent Diamond, Inc.",$40 - $60 an hour,,"Analyze and present electrical data. May guide technicians and/or interns and carry out other research, fabrication, design, and testing responsibilities as…"
Data Engineer,,LeaseHawk,"$87,566 - $150,473 a year",4.5,"Demonstrated understanding of data lakes and data warehouses using Snowflake, Redshift, or similar platform. Proficient with SQL, data modeling, data management…"
MVC / .NET / SQL Developer,,"Agate Software, Inc.","$54,000 - $84,000 a year",,Associates Degree in Computer Science or equivalent. The system is built in such a way that developers create tools and custom modules that our configuration…
COLLECTIONS ANALYST,,Clarivate,,,Four years high volume business to business collections experience. Initiates telephone and/or email contact with internal & external customers with amounts…
"Geotechnical Engineer, PE",,ACS Services LLC,"$65,000 - $120,000 a year",3.5,Personal protective equipment provided or required. Evaluate laboratory and field data for geotechnical reports. Perform seismic analysis of soil strata.
Applications Developer,"Phoenix, AZ 85007 (Central City area)",State of Arizona,,3.5,Apply creative solutions to business problems to ensure business needs are most effectively met. Bachelor’s degree plus 5 or more years of programming and…
Member Insights Analyst,"Phoenix, AZ","AAA Northern California, Nevada & Utah",,3.5,"May travel by car, plane or other form of transportation to attend business meetings or conferences. Supports the design, execution analysis and communication…"
Senior Financial Analyst,"Scottsdale, AZ 85260 (North Scottsdale area)",Discovery Land Company,,3.7,Facilitate data gathering for new analytical or systems initiatives. Ensure data integrity of the financial reporting systems and forecasting tools.
"Senior Data Scientist - Opportunity for Working Remotely Phoenix, AZ","Phoenix, AZ",Carbon Black,,3.6,"Working experience in analytics, data mining, and/or predictive modeling, and data interpretation. Experience in big data technologies."
"DOL TAP Employment Facilitator (Part-time) - Luke AFB, AZ","Glendale Luke AFB, AZ 85309",Serco North America,,3.5,"An associate’s degree, any discipline from an accredited college or university or at least 3 years of experience as a professional trainer or facilitator."
Incident Manager,"Phoenix, AZ 85027 (Deer Valley area)",Safeway Inc./Albertson's Inc,"$100,000 - $120,000 a year",3.3,\* Understanding of IT impact to the business and raises alternatives workarounds. \* Requires 3+ years work experience as an incident analyst/manager in a…
Business Development Manager,"Phoenix, AZ","Insight Enterprises, Inc.","$75,000 - $100,000 a year",3.6,Implement and execute internally created call campaigns by leveraging business intelligence and database queries to identify areas of opportunity.
Digital Marketing Analyst,"Phoenix, AZ 85017 (Alhambra area)",Grand Canyon Education,,3.6,"Master’s degree in data analytics or related field preferred. Bachelor’s degree in data analytics, finance, economics or related field required from a…"
Knowledge Management Coordinator-Remote,"Glendale, AZ",Pearson,,3.7,"4-year degree from an accredited institution and/or equivalent experience. At least two years of work experience, in knowledge management and/or communications."
Senior Analyst,,Aml Rightsource Llc,,2.3,Bachelor's Degree with 2 or more years of Anti-Money Laundering (AML) experience or Associates Degree with 3 or more years of AML experience.
Senior Engineer - BI & Reporting,"Phoenix, AZ",American Express,,4.1,"Responsible for designing and building BI solution involving data virtualization, query, report and visualize large volumes of data across multiple source…"
Research Assistant - Neurosurgery,"Phoenix, AZ",St Josephs Hospital and Medical Center,,3.9,"Performs routine procedures in one or more sections of the laboratory facilities under the supervision of either a principal investigator, staff scientist,…"
Legal Operations Analyst,"Scottsdale, AZ 85260 (North Scottsdale area)",Early Warning Services,,2.9,Ability to maintain confidentiality of highly sensitive data. May provide backup or overflow support to Legal staff as necessary.
Engineer - Digital Servicing,"Phoenix, AZ",American Express,,4.1,Work with data scientists and analysts to improve software. Create security and data protection settings. Testing and fixing bugs or other coding issues.
"Sr Consultant, Data Analytics","Tempe, AZ 85284",Northern Trust Corp.,,3.9,"Identify opportunities to enhance processes regarding data flow and data quality to improve accuracy, viability and value 13."
Global Fraud Prevention Team - Regional Manager,"Scottsdale, AZ 85260 (North Scottsdale area)",Vanguard,,3.8,Solutions will be via automation and/or improvements to controls in business processes. A minimum of 5 years supervisory or management experience in white…
Mechanical Engineer,"Mesa, AZ 85210",Autoline Industries,"$50,000 - $92,000 a year",4.2,"Sanitizing, disinfecting, or cleaning procedures in place. Apply new design, process, materials or testing methods. Oversee testing and validation of new parts."
"Manager, Competitive Intelligence - Opportunity for Working Remotely Phoenix, AZ","Phoenix, AZ",VMware,,4.0,"Engage industry analysts to ascertain relevant research, scope custom projects, and build RFPs. Develop competitive intelligence, critical insights, and…"
Database Adminstrator,"Chandler, AZ 85248 (Ocotillo area)",TCS,,3.8,System DBA with MemSQL as Database. Responsible for coordination and execution of engineering and technical aspects of each assigned project.
"CRCO Reporting Analyst, Associate/AVP","Phoenix, AZ","Mufg Union Bank, National Association",,,Develop and/or update written Standard Operating Procedures for reporting processes and data validation routines. 4-year university degree in related field.
Network Engineer-Data And Telecommunications,"Phoenix, AZ",SwitchThink Solutions LLC,,,"Associates or better in Computer Science. Associate's Degree, Trade or Technical School; Computer Science, Computer Information Systems, or related degree."
Facilities Assessment Engineer/Architect,"Phoenix, AZ",Bureau Veritas Building Assessments & Project Mana...,,,Education and/or Experience: * Degree in Architecture and/or Engineering or ideal. Personal protective equipment provided or required.
"Human Capital Analyst, Multiple Locations","Phoenix, AZ 85012 (Encanto area)",Deloitte,,4.0,"Conduct relevant research, data analysis, and create reports. Experience with consulting or project management supporting federal, state and/or local government…"
Reseach Analyst,"Phoenix, AZ 85018 (Camelback East area)",Fox Corporation,,4.0,Access and distribute Nielsen Overnight data daily. Coordinate all research efforts with national rep firm. Create ratings estimates for sales’ master planners…
Portfolio Manager,"Phoenix, AZ",Desert Financial,,3.4,Demonstrated expertise in Excel and other research/data compilation tools. 5+ years of experience as a Portfolio Manager or Trader.
Healthcare Reimbursement Analyst,"Phoenix, AZ 85012 (Encanto area)",Adelante Healthcare,,3.0,"Responsible for collecting, documenting, and analyzing reimbursement data. Establishes effective relationships with other AHC departments; builds and maintains…"
Sr.Claims Data Analyst,"Phoenix, AZ",TriWest Healthcare Alliance,,3.3,"3 year experience in healthcare analysis, data management or equivalent. Able to combine data from multiple sources and research various systems to develop…"
Associate Project Manager - Dam Safety,"Phoenix, AZ","Maricopa County, AZ","$61,048 - $87,984 a year",3.5,"Direct work experience in dam safety or dam technology. Meets with various levels of staff, including leadership, engineers, operations and maintenance,…"
Senior Staff Scientist,"Tempe, AZ 85282",Terracon,,3.2,"May oversee work performed by lower level scientists/engineers and Technicians. Performs site visits, field observations and field data collection or…"
Digital Marketing Analyst,"Phoenix, AZ 85004 (Central City area)",CHIME TECHNOLOGIES INC,,,"Participate in new business pitches, etc. Troubleshooting skill: data issue & tracking issue. Provide assistance to Head of Interaction for business development…"
Sr Data Scientist and Machine Learning Engineer,"Tempe, AZ 85281",Medtronic,,3.9,Collaborate with process/product engineers and stakeholders throughout the organization to understand business needs and identify opportunities for leveraging…
Snowflake Engineer,"Phoenix, AZ",Slalom Consulting,,3.7,"You will design and build highly scalable and reliable modern data platforms including data lakes and data warehouse using Amazon Web Services, Azure, Google…"
Principal Data Scientist,"Phoenix, AZ 85001 (Central City area)",Cognizant Technology Solutions,,3.9,"Our clients need flexible data structures and a streamlined data architecture that quickly turns data resources into informative, meaningful intelligence."
Digital Workspace Engineer,"Scottsdale, AZ 85257 (South Scottsdale area)",vCORE Technology Partners,,4.2,"Working knowledge of virtualization, VMWare, or equivalent. Strong knowledge of implementing and effectively developing helpdesk and IT operations best…"
QA Engineer II,"Tempe, AZ 85281",PulteGroup,,3.8,Consults with other teams regarding technology solutions for business needs and/or problem resolution. Analyzes business requirements and asks probing questions…
Data Designer @ Fjord,"Phoenix, AZ 85016 (Camelback East area)",Accenture,,4.0,"3+ years of big data, analytics, or data visualization experience; prior consultancy experience preferred. Bachelor's degree or equivalent (minimum 12 years)…"
Customer Experience Analyst,"Mesa, AZ",Santander Bank,,3.6,Monitors database activity and the relationships between the database users and applications to ensure appropriate data usage and resolve data conflicts.
Technical Support Associate Analyst,"Tempe, AZ 85281",Cigna,,3.7,Works on site specific department projects and/or sub-projects. Interacts with other support groups to restore service and /or identify and correct end-user…
Sr. Windows Operations Engineer,"Tempe, AZ","Mufg Union Bank, National Association",,,"Bachelor’s degree in Information Technology or Computer Science. Knowledge of network security systems, intrusion detection systems, and data backup."
Project Administrator,"Scottsdale, AZ 85253 (South Scottsdale area)",The McShane Companies,,,Associates degree or equivalent combination of education and experience. Ability to use or learn project management software. Assist with take-off analysis.
Information Security Engineer,"Chandler, AZ",Abtsus LLC,$33 - $50 an hour,,Ability to analyze data feeds and provide feedback to business partners. Ability to work with business partners to trouble shoot issues.
Customer Service - Online T-Shirt Design,"Tempe, AZ 85281",DesignAShirt,$15 - $18 an hour,,"Record customer information within our customer service database. Communicating with other departments like production, artists, and web developers."
Senior Financial Rate Analyst,"Phoenix, AZ 85007 (Central City area)",State of Arizona,"Up to $52,300 a year",3.5,Analyze financial data accurately to develop meaningful conclusions. Bachelor's degree in Business/Finance or a related field with 4 years of work experience in…
Graduate Intern Technical,"Phoenix, AZ 85018 (Camelback East area)",Intel,,4.1,6+ months of numerical or experimental research in fluid dynamics/thermals or related field. Pursuing MS or PhD degree in Mechanical Engineering or related…
"NOC Specialist, Data Center","Phoenix, AZ 85067 (Alhambra area)",Iron Mountain,,3.7,"Subject matter knowledge in database schemas and data integration methodologies. AS or BS in Computer Science, Information Technology, or related field or the…"
Finance Analyst,"Phoenix, AZ",Quadel Consulting and Training,,,"Two years of college, business or technical school at an accredited educational institution. Continually required to talk or hear."
IVR Engineer,,Oscar Health,,3.4,Develops applications that can retrieve data using various data sources and data types through internal ingestion systems.
Business Systems Analyst,"Mesa, AZ 85204 (Concord Village area)",Optimum Technologies,,4.1,"Business analysis experience, including use of structured business process analysis and/or improvement methodologies. Ensure developments are fully tested."
Big Data Engineer/Admin,"Tempe, AZ","Allstate Insurance - 1202 Irving, TX",,,Allstate is looking for top engineers to help build next generation data analytic and big data platforms and software solutions.
Commercial Banking Development Program -Credit Analyst-Portfolio Risk Management,"Phoenix, AZ",Western Alliance Bank,,3.2,"Knowledge of Credit Risk, Commercial Banking, data warehousing, business intelligence. Bachelor’s degree or advanced degree program in Business Analytics;…"
HL7 Analyst,"Phoenix, AZ 85007 (Central City area)",State of Arizona,"Up to $65,000 a year",3.5,"Ability to run basic SQL database queries. As an HL7 analyst, the individual in this role will work with other program staff and external partners to set up and…"
Plant Process Engineer,"Phoenix, AZ 85009 (Maryvale area)",Shamrock Foods,,3.3,"Train technicians and other members of project teams on equipment use, data collection, and data analysis. Assessing weaknesses in milk processing or packaging…"
FEMA NFIP Claim Specialist - Disaster Support,"Phoenix, AZ 85004 (Central City area)",Serco North America,,3.5,Or 7 years of relevant experience. This position is contingent upon contract award or funding award. Provide support to NFIP claim activities during flood…
Sr Business Systems Analyst,"Tempe, AZ",BNP Paribas,,3.9,Ensures proper coordination between assigned staff and all interfacing business units. Responsible for directing and approving the application of technical…
Sponsored Projects Specialist - Research,"Scottsdale, AZ 85250 (South Scottsdale area)",Mayo Clinic,,4.1,"A bachelor's degree is required in business, public administration, finance or related major preferred plus 2 - 3 years of related experience in research,…"
Dean (Student Affairs) (multiple positions at MCC),"Maricopa County, AZ",Maricopa Community Colleges,"$95,856 - $124,613 a year",3.8,Indicate whether former or current employment is Full-Time or; May require numerous evenings or weekends. A. Four (4) or more years of progressive leadership…
Senior Data Quality Analyst,"Phoenix, AZ 85014 (Encanto area)",Health Current,,3.6,"Perform activities with integration engineers, project managers and account managers in implementing business rules and standards that will detect data quality…"
Business Systems Analyst,"Mesa, AZ 85202 (Southwest area)",Dexcom,,3.3,May lead cross-functional linked teams to address business or systems issues. Works on moderately complex problems where analysis of situations or data requires…
PRODUCT ENGINEER - EMBEDDED SYSTEMS,"Tempe, AZ 85283",Minit Charger,"From $73,000 a year",,Personal protective equipment provided or required. Manage hardware/firmware development spanned across the globe. Product development: 3 years (Preferred).
Analyst I,"Phoenix, AZ",Eurofins Central Laboratory,,3.0,B.S. or B.A. degree in a physical or natural science. Uploads laboratory data into LIMS system to generate data packages for delivery to clients.
Analyst I,"Phoenix, AZ",Eurofins Central Laboratory,,3.0,B.S. or B.A. degree in a physical or natural science. Uploads laboratory data into LIMS system to generate data packages for delivery to clients.
Global Fraud Prevention Team - Regional Manager,"Scottsdale, AZ 85260 (North Scottsdale area)",Vanguard,,3.8,Solutions will be via automation and/or improvements to controls in business processes. A minimum of 5 years supervisory or management experience in white…
Mechanical Engineer,"Mesa, AZ 85210",Autoline Industries,"$50,000 - $92,000 a year",4.2,"Sanitizing, disinfecting, or cleaning procedures in place. Apply new design, process, materials or testing methods. Oversee testing and validation of new parts."
"Manager, Competitive Intelligence - Opportunity for Working Remotely Phoenix, AZ","Phoenix, AZ",VMware,,4.0,"Engage industry analysts to ascertain relevant research, scope custom projects, and build RFPs. Develop competitive intelligence, critical insights, and…"
Database Adminstrator,"Chandler, AZ 85248 (Ocotillo area)",TCS,,3.8,System DBA with MemSQL as Database. Responsible for coordination and execution of engineering and technical aspects of each assigned project.
DevOps Engineer,"Phoenix, AZ 85014 (Camelback East area)",Cyberitas Technologies LLC,"$88,508 - $170,234 a year",,Personal protective equipment provided or required. Development experience in either Python or PHP. Node.js management and/or development experience.
"CRCO Reporting Analyst, Associate/AVP","Phoenix, AZ","Mufg Union Bank, National Association",,,Develop and/or update written Standard Operating Procedures for reporting processes and data validation routines. 4-year university degree in related field.
Network Engineer-Data And Telecommunications,"Phoenix, AZ",SwitchThink Solutions LLC,,,"Associates or better in Computer Science. Associate's Degree, Trade or Technical School; Computer Science, Computer Information Systems, or related degree."
Facilities Assessment Engineer/Architect,"Phoenix, AZ",Bureau Veritas Building Assessments & Project Mana...,,,Education and/or Experience: * Degree in Architecture and/or Engineering or ideal. Personal protective equipment provided or required.
"Human Capital Analyst, Multiple Locations","Phoenix, AZ 85012 (Encanto area)",Deloitte,,4.0,"Conduct relevant research, data analysis, and create reports. Experience with consulting or project management supporting federal, state and/or local government…"
Sr Financial Analyst,,"CSAA Insurance Group, a AAA Insurer","$72,000 - $85,500 a year",3.4,"Please note, hourly or salary compensation, or the range of hourly or salary compensation available for a position may vary by location."
Reseach Analyst,"Phoenix, AZ 85018 (Camelback East area)",Fox Corporation,,4.0,Access and distribute Nielsen Overnight data daily. Coordinate all research efforts with national rep firm. Create ratings estimates for sales’ master planners…
Portfolio Manager,"Phoenix, AZ",Desert Financial,,3.4,Demonstrated expertise in Excel and other research/data compilation tools. 5+ years of experience as a Portfolio Manager or Trader.
Healthcare Reimbursement Analyst,"Phoenix, AZ 85012 (Encanto area)",Adelante Healthcare,,3.0,"Responsible for collecting, documenting, and analyzing reimbursement data. Establishes effective relationships with other AHC departments; builds and maintains…"
