job_title,location,company,salary,rating,summary
Junior Quantitative Developer - Data Analysis,"Chicago, IL",Akuna Capital,,3.2,Strong Python or C++ programming background. Experience with generic and/or parallel programming. Legal authorization to work in the U.S. is required on the…
Computer Vision Data Scientist,"Chicago, IL 60607 (West Town area)",McDonald's Corporation,,3.5,McDonald’s is looking to hire a Data Scientist with experience in developing Computer Vision Models. The role will focus on building predictive/prescriptive…
Technical Business Analyst,"Chicago, IL",Virtusa,,3.7,The Technical Business Analyst (BA) will be responsible for owning the overall design of assigned projects from business functionality perspective as well as…
Senior Data Science Analyst,"Riverwoods, IL 60015",Discover Financial Services,,3.9,"Manages multiple priorities, communicate business performance and project progress to management & business partners. Group Auto, Home and Pet Insurance."
Financial Analyst,,Exelon Corporation,,4.0,Liaison to business units to ensure efficiency and effectiveness of information exchange. Assist in preparation of various reports and data requests and answers…
Mid-Level Business Intelligence Developer,,PCMI Corporation,,4.0,He or she will focus on database management systems revolving around working with clients to convert data between different formats that are compatible with our…
Senior Business Analyst,"Lansing, IL 60438",Nippon Paint Automotives of Americas formerly NB C...,"From $78,000 a year",,"College diploma or university degree in computer science, computer information systems, or management information systems, and/or 5-8 years equivalent work…"
Lead Data Engineer,"Chicago, IL 60654 (River North area)",Riskonnect Inc.,,,"Design and Build data conversion processes to meet business requirements. Experience in the Risk Management, Healthcare, Financial, and/or Insurance industries…"
Data Quality Engineer,"Chicago, IL 60606 (Loop area)",Envoy Global,,3.3,"Validation of data in data repositories (DW, Data Marts) against data from source systems and validation of metrics and data in reports/dashboards against data…"
Corporate Intern – Software Engineer/Data Analytics,"Chicago, IL 60661 (Near West Side area)",Caterpillar,,3.9,"Data Analytics - Interns will apply analytics techniques on a very large set of diverse data from IoT connected assets, anomaly detection, business analytics,…"
Data Engineer (Healthcare Solutions),"Chicago, IL",Komodo Health,,3.0,"Demonstrably deep experience with relevant 'big data' processing either via Spark or through a modern MPP database like Snowflake, ideally with experience in…"
Data Warehouse and Visualization Analyst,"Chicago, IL 60661 (Near West Side area)",All Chicago Making Homelessness History,"$44,700 - $60,900 a year",,"Strong knowledge of the fundamentals of data warehouse, and experience supporting and developing data warehouses. STATUS: Exempt, salaried, full-time."
ADAS Test Operator - Chicago,"Chicago, IL",Tesla,,3.5,"Communicate with developers and test engineers, be on-call for questions/comments if necessary. Must be comfortable driving prototype vehicles during testing…"
Database Administrator,"Chicago, IL 60642 (Bucktown area)",Redwood Logistics,,3.7,"You will be accountable for the performance and integrity of the database, working with users to plan for development and troubleshoot any issues related to…"
Database Developer,"Chicago, IL 60601 (New Eastside area)",Jacobs,,3.9,Business intelligence and reporting platforms such as PowerBI or SAP Business Objects experience. Bachelor’s degree in Computer Science or relevant field study.
Trading Analyst,"Chicago, IL 60605 (South Loop area)",Group One Trading,,4.0,"They should become fluent with both the usage and rules of all applications that provide market research, theoretical/analytical data, order entry applications,…"
Senior Digital Marketing Analyst,,BlueChew,,,"Conduct competitive research and analyze benchmarking data. Must have a passion for data analysis. Use multiple data sources and tools to identify, interpret…"
Senior Data Scientist / Engineer,,"AMI Group, LLC","$120,000 - $140,000 a year",,The Senior Data Scientist assists in overseeing the activities of the data analyst(s) and provides advanced expertise and guidance on statistical and…
Board Certified Behavior Analyst (BCBA) Supervisor - Orland Park,,The Place for Children with Autism,,,Conduct regular mentor meetings and established performance evaluations for clinical staff and provide feedback in areas of strength or improvement.
Senior Product Designer,,CareAdvisors,"$80,000 - $110,000 a year",,At least 5 year(s) of experience working as a Product Designer or UX/UI Designer or similar roles. Collaborate with the product manager and the designer to…
Sr. Business/Research Analyst - Remote Opportunity,,"Proactive Worldwide, Inc.","$80,000 - $90,000 a year",,Experience with Tableau or other data visualization tools is a plus. Lead the analysis of research findings to identify key business and operational insights…
Sr Engineer (ComEd - Database Administrator),,Exelon Corporation,,4.0,Review engineering drawing and device settings to perform data validation on database data. Provides consultation and recommendations to the Company within and…
"Manager, Data Scientist","Chicago, IL",Annalect,,2.7,"Perform exploratory data analysis and data queries against outlined objectives, to ensure the availability of the right data and required sample sizes."
Strategy & Growth Analyst,"Chicago, IL",Kalderos,,,At least 2 years of post undergraduate experience working within top-tier management consulting or business strategy roles.
GCP Data Engineer,"Arlington Heights, IL",Capgemini,,3.8,"Minimum 2 year experience in using Python in data engineering, Cloudformation or as Object oriented ( Pandas, Spark library, NumPy or SciPy library)."
Operations Performance Analyst,"Chicago, IL 60611 (Streeterville area)","SMS Assist, LLC",,2.3,"Make recommendations targeting business processes, customer service, or other improvements based on analysis of trends and KPIs."
"Senior Business Analyst, Carrier Experience","Chicago, IL (Near West Side area)",Uber,,3.7,"Commitment to continuously improving (self and business). Domain-specific knowledge in reliability, customer service, tracking, compliance, fraud, and/or safety…"
Commercial Banking - Business Management and Analysis - Associate,"Chicago, IL","JPMorgan Chase Bank, N.A.",,3.9,"The successful candidate will have a unique mix of technical data skills and business acumen, with strong past experience in operational process monitoring &…"
Jr. Salesforce Administrator,"Chicago, IL",Numerator,,3.6,"Bachelor's Degree or equivalent. Create and update Reports and Dashboards for all business stakeholders. As a Jr. Salesforce Administrator, you will have the…"
Settlement Analyst,,Celero Commerce,"$42,000 - $48,000 a year",,Liaison with customer service & risk analyst as this role works closely with Customer Service and Risk analysts to manage the ticket process.
Financial Consulting Analyst,"Chicago, IL 60606 (The Loop area)",Alpha IR Group,,,Compose white paper research and editing on various market topics for client education and business development. Desire to provide top-notch client service.
Research Assistant - Sustainable Finance,"Chicago, IL 60601 (Loop area)",S&P Global,,3.9,"Ability to speak Spanish and / or Portugese a plus, though not required. Background on the type of research undertaken in this area can be found on the…"
User Research 2021 Internship,"Chicago, IL",Motorola Solutions,,4.1,"Prior coursework in user research methods, interaction design or experience design. Currently pursuing a graduate degree in Human Computer Interaction,…"
Technical Business Analyst,"Chicago, IL",CA Ventures,,3.7,"3+ years of relevant systems analyst and/or business analysis experience. You will work closely with business users, data team, and the leadership teams to…"
Data Engineer,"Chicago, IL (The Loop area)",Capital One - US,,3.9,"2+ years of experience developing software solutions to solve complex business problems. 1+ years of experience with Amazon Web Services (AWS), Microsoft Azure…"
Analyst - Finalta,"Chicago, IL",McKinsey & Company,,4.3,"Recent graduates or those with 6 months - 1 year of experience in data analytics, strategy, financial services, insurance or consultancy."
Business Development Representative,"Chicago, IL 60603 (The Loop area)",BMI Mergers & Acquisitions,"Up to $80,000 a year",,"2 or more years of experience in a; business development, sales, marketing, or admin role. In addition to being a tenacious business developer, this position…"
Principal Data Scientist,"Chicago, IL 60601 (Loop area)",Anthem,,3.7,Champion the design & execution of machine learning projects to address specific business problems determined by consultation with business partners.
IT Data Analyst,"Chicago, IL",Motorola Solutions,,4.1,Work with multiple business partners to investigate & document business requirements for data & reports. Ensures data integrity and availability by gathering…
TBM Data Analyst,"Northfield, IL",Medline Industries Inc,,3.4,"Conduct data quality reviews and work with source data owners and identify opportunities to clean data, improve data structures, or improve data management…"
"2021 Summer Intern, Business Intelligence - Advanced Analytics","Oak Brook, IL 60523",Chamberlain Group Inc,,3.7,"Conceptual knowledge of query design, data modeling, and data visualization. Currently pursuing a Bachelor’s or Master’s Degree in Information Systems, Business…"
Mechanical Engineer,"Whiting, IN",bp,,3.9,Bachelor's Degree in Mechanical Engineering or Engineering preferred or relevant work experience. Responsible for engineering data management for routine…
IT Business Development Representative,"Chicago, IL",Progent Corp.,"Up to $72,001 a year",4.0,Generating and articulating key components of service engagement proposals which tie business requirements/needs to unique company deliverables.
Digital Business Analyst,"Chicago, IL 60654 (Loop area)",Alight,,3.2,3-5 years business analyst experience delivering web and/or mobile products or working at a management consultancy / agency.
Business Consultant,"Chicago, IL",Samex LLC,"$80,000 - $150,000 a year",,"Advertising, B2B Sales, SaaS, Digital Marketing, or outside sales background is helpful. Compensation: * To keep the earnings of our business consultant…"
Settlement Analyst,,Celero Commerce,"$42,000 - $48,000 a year",,Liaison with customer service & risk analyst as this role works closely with Customer Service and Risk analysts to manage the ticket process.
Robotics Engineer,"Woodridge, IL 60517",IRIS Custom Solutions LLC,"$65,000 - $80,000 a year",,"Sanitizing, disinfecting, or cleaning procedures in place. Our engineers are involved in all aspects of projects, including Machine Vision Implementation, PLC…"
Sr. Business Analyst,"Chicago, IL","Zing Health Holdings, Inc.",,,S/he will be responsible for retrieving andanalyzing data to assist end users with their business decisions. Developing test cases andperform testing to ensure…
"Research Analyst, Non-Investment Grade Fixed Income","Chicago, IL 60603 (The Loop area)",Neuberger Berman,,3.9,1 - 5 years of research experience (sell-side and/or buy-side). Experience or demonstrated interest in the leveraged loan and high yield bond market.
Principal Python Data Engineer,"Chicago, IL",Cresco Labs,,2.0,"Experience with distributed data storage systems/formats using parallel processes and/or columnar data stores such as Snowflake, or Redshift."
"Senior Analyst, Decision Sciences","Chicago, IL (The Loop area)",Starcom,,3.8,"1-2 years in media/marketing research, consumer insight, business consulting, or digital advertising research."
Data Modeler,"Chicago, IL",Savantis Solutions LLC,,,Validate business data objects for accuracy and completeness based on business requirements. Work with the Development teams to ensure alignment with…
"Research Analyst, Non-Investment Grade Fixed Income","Chicago, IL 60603 (The Loop area)",Neuberger Berman,,3.9,1 - 5 years of research experience (sell-side and/or buy-side). Experience or demonstrated interest in the leveraged loan and high yield bond market.
Principal Python Data Engineer,"Chicago, IL",Cresco Labs,,2.0,"Experience with distributed data storage systems/formats using parallel processes and/or columnar data stores such as Snowflake, or Redshift."
"Senior Analyst, Decision Sciences","Chicago, IL (The Loop area)",Starcom,,3.8,"1-2 years in media/marketing research, consumer insight, business consulting, or digital advertising research."
Financial Analyst,,Exelon Corporation,,4.0,Liaison to business units to ensure efficiency and effectiveness of information exchange. Assist in preparation of various reports and data requests and answers…
Data Modeler,"Chicago, IL",Savantis Solutions LLC,,,Validate business data objects for accuracy and completeness based on business requirements. Work with the Development teams to ensure alignment with…
Data Analyst (IT/Finance),"Chicago, IL 60628 (Roseland area)",Roseland Community Hospital,,3.1,"Technical expertise regarding data models, database design development, data mining and segmentation techniques."
Data Analytics Manager,"Chicago, IL 60604 (The Loop area)",Federal Reserve Bank of Chicago,,3.9,Set strategy and research agenda for the department’s data analytics group and partner with leadership to develop and execute broader data management strategy.
Analyst – Linen Utilization Manager,"Chicago, IL",Healthcare Linen Services Group,"$45,000 - $55,000 a year",2.6,Ability to review inaccurate or below standard data to determine root cause and root cure. Must be able to generate standard and custom reports summarizing…
IT Service Desk Manager,"Chicago, IL 60607 (Near West Side area)","MXOtech, Inc.",,4.1,Personal protective equipment provided or required. Analyze data and identify support trends and trigger opportunities to drive reliable support and identify…
Senior Analytics Data Engineer,"Chicago, IL 60603 (The Loop area)",SpotHero,,3.0,Collaborate with analysts to wade through structured and unstructured data lake to identify valuable data set. Strong SQL and data modeling skills.
Financial Analyst,"Chicago, IL 60603 (The Loop area)",BMO Harris Bank,,3.5,Specialized knowledge from education and/or business experience. Private equity or leveraged finance experience preferred. Focus may be on a business/group.
Senior Reference Data Analyst,"Chicago, IL",DRW,,,"Identification, investigation and promotion of new data sources to facilitate business growth and data product development, while reducing data operational risk…"
Compliance Analyst,"Chicago, IL",IMC Financial Markets,,4.5,Investigate and perform research related to compliance initiatives. Serve as the first line of defense in keeping our business compliant.
School Clerk 1,"Chicago, IL",Chicago Public Schools,,3.8,"Sedentary Work: Exerting up to ten (10) pounds of force occasionally and/or a negligible amount of force frequently to lift, carry, push, pull or otherwise move…"
Senior Credit Research Analyst - Bank Portfolio,"Chicago, IL",Northern Trust Corp.,,3.9,Minimum six or more years of fixed income securities or credit related financial analysis experience. Operates independently; has in-depth knowledge of business…
Senior Data Scientist / Engineer,,"AMI Group, LLC","$120,000 - $140,000 a year",,The Senior Data Scientist assists in overseeing the activities of the data analyst(s) and provides advanced expertise and guidance on statistical and…
Financial Analyst,,Exelon Corporation,,4.0,Liaison to business units to ensure efficiency and effectiveness of information exchange. Assist in preparation of various reports and data requests and answers…
IT Dynamics NAV ERP Developer,,Columbus Vegetable Oils,,,Has a high emotional intelligence and can communicate effectivity from the Shipping Dock to Senior Management. BlueCross BlueShield of IL PPO and HMO.
Sr Engineer (ComEd - Database Administrator),,Exelon Corporation,,4.0,Review engineering drawing and device settings to perform data validation on database data. Provides consultation and recommendations to the Company within and…
Data Engineer,"Chicago, IL",BRAZE,,,Degree in computer science or equivalent experience. Partner with the Customer Marketing team to drive adoption of advanced technical marketing techniques like…
Level 1 Service Desk Analyst,"Chicago, IL",Bee data Technology,$24 an hour,,"Small amounts of hardware troubleshooting – mostly application troubleshooting - TeamViewer experience for virtual troubleshooting, or similar virtual…"
SAP Analyst - Hana and MM Data Maintenance (Contract),"Chicago, IL 60606 (Loop area)",Lake Shore Associates,,2.0,At least 2 years of master data experience across BOMs and Batch jobs. SAP Analyst - Hana and MM Data Maintenance (Contract Position).
Senior BI Data Engineer,"Chicago, IL 60606 (Loop area)",RSM US LLP,,3.6,"Bachelors degree or similar education or experience within application development, DBA, data analytics required."
"Business Analyst, Fraud & Compliance","Chicago, IL (Near West Side area)",Uber,,3.7,"Commitment to continuously improving (self and business). Domain-specific knowledge in cargo risk & security, carrier & shipper fraud, compliance, and/or safety…"
Database Administrator,"Des Plaines, IL 60018",National Insurance Crime Bureau,"$90,000 - $100,000 a year",4.4,"5+ years of experience with, data migration tools, data integration, data warehousing, database design and SQL database / coding SQL Server , ETL."
Business Intelligence (BI) Solutions Architect,"Morton Grove, IL 60053",Bunzl Retail Services,"From $125,000 a year",,Be passionate about solving business problems with data-driven solutions. 3 years of experience of architecting solutions for business intelligence applications…
BUSINESS INTELLIGENCE DEVELOPER,"Chicago, IL 60611 (Streeterville area)",PDI,,,"High emotional intelligence and interpersonal skills. 2-3 years of professional experience in an analytical and/or client-facing role, preferably in retail or…"
Director of Enterprise Data and Healthcare Business Intelligence (Full Time),"Evanston, IL 60202",Erie Family Health Center,,3.6,"Identification of the organization's information needs and oversight of an enterprise data warehouse, the development, deployment, and adoption of business…"
Clinical Data Analyst: 40 Hours Per Week (Days),"Hammond, IN 46324",Alverno Laboratories,,3.4,"The analyst will work with leadership to understand current needs and future possibilities for clinical data applications. FTE: M-F, 8:00 AM - 4:30 PM."
Sr. Business/Research Analyst - Remote Opportunity,,"Proactive Worldwide, Inc.","$80,000 - $90,000 a year",,Experience with Tableau or other data visualization tools is a plus. Lead the analysis of research findings to identify key business and operational insights…
Senior Digital Marketing Analyst,,BlueChew,,,"Conduct competitive research and analyze benchmarking data. Must have a passion for data analysis. Use multiple data sources and tools to identify, interpret…"
Board Certified Behavior Analyst- Local Applicants Only,,Amys ABA Therapy Services,$59 - $61 an hour,5.0,"Related keywords: bcba, behavior analyst, board certified behavior analyst. Experience in training or supervising support staff."
Senior Product Designer,,CareAdvisors,"$80,000 - $110,000 a year",,At least 5 year(s) of experience working as a Product Designer or UX/UI Designer or similar roles. Collaborate with the product manager and the designer to…
Clinical Trial Analyst,"Chicago, IL",SimBioSys,,,Prior Experience with medical imaging segmentation and clinical data abstraction. We are looking for a clinical trial data analyst to lead clinical validation…
Database Engineer,"Chicago, IL",Citadel,,4.1,Implement and maintain database/data archiving and retention process. Manage database security automation and maintain data safety and integrity procedures.
Financial Data Analyst,"Des Plaines, IL 60018",Physicians Immediate Care,,3.3,1 to 2+ years of experience as a data analyst or relevant role. Healthcare data (CPT codes) and/or financial modeling.
Documentation and Data Control Analyst,"Franklin Park, IL 60131",Life Fitness,,3.5,The position requires navigation within numerous business systems to execute these functions to ensure proper documentation and data control across Life Fitness…
Financial Analyst,,Exelon Corporation,,4.0,Liaison to business units to ensure efficiency and effectiveness of information exchange. Assist in preparation of various reports and data requests and answers…
Avail - Trust and Safety Analyst,"Northbrook, IL",Allstate,"$64,700 a year",3.7,"2-4 years Trust and Safety or related experience in retail loss prevention, investigations or security project management."
Billing Reporting and Data Analyst,"Itasca, IL 60143",Livingston International,,3.2,"Knowledge of agile systems development, business intelligence and analysis, and continuous improvement methodologies. Preferred: Bachelors Degree or equivalent."
Database Administrator,"Chicago, IL",AI TEK Solutions,,,Min Education: Masters in Computer or Information Technology or Engineering or Business or Science or related with 6 months experience; or in alternate a…
Educational Sales Coordinator (Work from Home),,Varsity Tutors,$18 an hour,3.9,"Complete transactions and or schedule a follow-up conversations with prospective clients. Remote Position, fully work from home (or wherever you like!)."
Senior Data Engineer (Data Integration/Cloud/Hadoop),"Chicago, IL",zb.io,$35 - $40 an hour,,Experience in building data marts to support different business units. Scala or Java experience preferred. Strong knowledge of data structures and algorithms.
Financial Analyst,"Chicago, IL",Old Republic Professional,,,The analyst will prepare detailed written reviews and perform financial analysis using collected data. The analyst will present recommendations internally to…
Senior Cryptoasset Research Analyst,"Chicago, IL",DRW,,,Analyze new initiatives and products to produce data-driven research reports. Professional experience using Python (or a similar language) for time series or…
Accounts Receivable / Commission Analyst,"Chicago, IL 60661 (West Loop Gate area)",CA Fortune,,3.1,"The role requires the analyst to prepare detailed reconciliations, enter data into our systems, and analyze and research discrepancies."
"Financial Planning and Analysis, Associate","Chicago, IL 60603 (Loop area)",Oak Street Health,,2.7,Partner with operational leads and leverage financial expertise to drive strategic decisions and provide actionable recommendations to business partners.
Settlement Analyst,,Celero Commerce,"$42,000 - $48,000 a year",,Liaison with customer service & risk analyst as this role works closely with Customer Service and Risk analysts to manage the ticket process.
Sr Engineer (ComEd - Database Administrator),,Exelon Corporation,,4.0,Review engineering drawing and device settings to perform data validation on database data. Provides consultation and recommendations to the Company within and…
Senior Product Designer,,CareAdvisors,"$80,000 - $110,000 a year",,At least 5 year(s) of experience working as a Product Designer or UX/UI Designer or similar roles. Collaborate with the product manager and the designer to…
Sr. Business/Research Analyst - Remote Opportunity,,"Proactive Worldwide, Inc.","$80,000 - $90,000 a year",,Experience with Tableau or other data visualization tools is a plus. Lead the analysis of research findings to identify key business and operational insights…
Financial Analyst,,Exelon Corporation,,4.0,Liaison to business units to ensure efficiency and effectiveness of information exchange. Assist in preparation of various reports and data requests and answers…
Senior Data Engineer,"Chicago, IL 60601 (The Loop area)","Amount, Inc","From $130,000 a year",,"Amount is looking for Senior Data Engineers to help us build a robust and scalable data platform to support ETL, reporting, and data analysis as our business…"
Accounting AR Analyst,"Chicago, IL",eXp Realty,,4.4,This analyst role will focus on Accounts Receivable subledger data and using research and analysis skills to resolve old and aging subledger transactions to…
Data Engineer – Specialty Analytics Advisor,"Northbrook, IL","Data Science Works, Inc","$90,000 - $120,000 a year",,"∙ 1+ years of experience in healthcare data analysis constructing analytical and reporting solutions to business problems, including experience with special…"
Data Scientist,"Chicago, IL 60607 (West Town area)",Aspen Dental,,2.6,The Data Scientist will perform and interpret data studies and product experiments concerning new data sources or new uses for existing data sources.
IT Intern - Database Developer,"Oak Brook, IL 60523",ACE Hardware,,3.8,This position requires a basic level knowledge of SQL and database design and modeling. The SQL Developer Intern will learn and assist team members in…
Data Analyst,"Chicago, IL 60618 (North Center area)",Compass Health Center,,2.5,Validate that MS Power BI can meet requirements and educate business stakeholders on intelligence reporting capabilities.
Open-Source Intelligence Senior Analyst,"Chicago, IL 60606 (The Loop area)",JENSEN HUGHES,,3.7,Master’s degree or 10 years work at equivalent level. The position requires a strong interest or experience in Insider Security Threat and Analysis in the…
