job_title,location,company,salary,rating,summary
"Financial Analyst, Financial Planning and Analysis Hub","Chicago, IL (West Town area)",Google,,4.3,"Comfort and experience using SQL to extract and manipulate data, or experience with other programming or scripting languages."
"Financial Analyst, Project Authorization","Oakbrook Terrace, IL 60181",Exelon Corporation,,4.0,4 Liaison to business units to ensure efficiency and effectiveness of information exchange. 2 Assist in preparation of various data requests and answer ad-hoc…
SAP HANA Data Warehouse Engineer,"Northfield, IL",Medline Industries Inc,,3.4,Ability to optimize the performance of enterprise business intelligence solutions by means redesigning or re-architecting data structures or data flows.
Physiological Data Analyst,"Chicago, IL 60611 (Streeterville area)",Ann & Robert H. Lurie Children’s Hospital of Chica...,,3.9,Perform exploratory data analysis in pediatric biomedical research using quantitative methods incorporating heterogeneous and complex data types under direct…
Senior Business Sales Analyst,"Chicago, IL",U.S. Bank,,3.6,"Expert in PowerPoint, Excel and Access or other Business Intelligence tool for querying data and for data manipulation/transformation."
Financial Analyst,,IIT Research Institute,"From $60,000 a year",4.3,Strong interpersonal skills and the ability to collaborate with business operations team members and across all research related divisions.
Azure Data Engineer,"Chicago, IL 60601 (The Loop area)",Avanade,,3.7,Help to develop business intelligence tools. Stay up to date with business best practice in using and retrieving data. Experience in structured problem solving.
"Senior Data Scientist, Media Analytics","Chicago, IL",84.51°,,2.7,"Bachelor's or Master's degree or equivalent in statistics, mathematics, analytics, economics, or marketing. Supporting the development of junior data scientists…"
Lead Data Science Analyst,"Riverwoods, IL 60015",Discover Financial Services,,3.9,"Manages multiple priorities, communicate business performance and project progress to management & business partners. Group Auto, Home and Pet Insurance."
STATIONARY ENGINEER REGISTRY FEATURED,"Chicago, IL",Sinai Health System,,3.6,"Repairs or makes adjustments to mechanical equipment to maintain operation. Equipment status, pressures, temperatures and other prescribed data is recorded on…"
"Investment Banking, Mergers and Acquisitions Analyst","Chicago, IL 60601 (The Loop area)","Baker Tilly US, LLP",,3.9,"One (1)+ year of experience in investment banking, business valuation services, commercial banking, or public accounting."
Strategy Associate,"Chicago, IL",Magnetar,,,"GPA of 3.4 or higher from an accredited undergraduate college or university. Construct detailed financial models of existing strategies/businesses (e.g.,…"
SENIOR DATA ENGINEER,"Chicago, IL",Hyatt Corporate Office,,5.0,"5+ years of experience within the field of data engineering or related technical work including business intelligence, analytics."
Data Engineer,"Chicago, IL",Kalderos,,,"Proven data engineering experience that involved creating, and maintaining a database and implementing data processing pipelines."
IT Operations Apprenticeship (2021 Start),"Chicago, IL",Optiver US,,3.4,Our engineers work closely with traders to identify the business problems we face and determine how they should be solved.
Paid Search Analyst,"Chicago, IL 60606 (Loop area)",Synchrony,"$52,000 - $110,000 a year",3.9,"You must be 18 years or older. We are seeking aPaid Search Analyst to serve as a hands-on-keyboard SEM strategist and analyst, supporting business partners…"
Customer Experience Analyst,"Chicago, IL 60604 (Loop area)",Assurant,,3.5,"Perform analysis on anomalies in data to address challenges and maintain a regular flow of VOC data. As the ideal candidate, you will have an accomplished…"
Business Analyst - Chicago,"Chicago, IL 60607 (West Town area)",The Federal Savings Bank,,2.9,3+ years’ experience in business and systems analysis. Project Management (PMP) or Business Analysis Certification preferred.
Analyst,"Chicago, IL",Weber Shandwick,,3.9,"Bachelor's degree, with major in business or STEM preferred. Passion for working with data and deriving insights to answer client business questions."
Elixir Engineer,"Chicago, IL",Cohesion IB,"From $95,000 a year",,Architect and implement robust data pipelines for IoT data ingestion. Knowledge of timeseries databases and relevant data models.
Data Engineer,"Downers Grove, IL",Stenograph LLC,,3.3,"An experienced data engineer will help our growing data needs in general. Strong data ETL, Migration and Enterprise Data Integration skills to serve the…"
Senior Data Engineer- Analytics,"Chicago, IL",M1 Finance,,,"3+ years of experience in business intelligence, data engineering, database administration, or another technical analytics role."
Data Engineer,"Chicago, IL 60606 (West Loop Gate area)",Equity Residential,,3.8,"Create data models and data processes, providing the right format and structure for use case solutions. Equity Residential also prohibits retaliation against…"
Senior Data Scientist / Engineer,,"AMI Group, LLC","$120,000 - $140,000 a year",,The Senior Data Scientist assists in overseeing the activities of the data analyst(s) and provides advanced expertise and guidance on statistical and…
Financial Analyst,,Exelon Corporation,,4.0,Liaison to business units to ensure efficiency and effectiveness of information exchange. Assist in preparation of various reports and data requests and answers…
Board Certified Behavior Analyst,,ASD Life ABA Therapy,$60 an hour,,Have the opportunity to supervise those pursuing a BCBA or RBT certification. Update Behavior Plan and Treatment Plan weekly or monthly depending on client’s…
Sr. Business/Research Analyst - Remote Opportunity,,"Proactive Worldwide, Inc.","$80,000 - $90,000 a year",,Experience with Tableau or other data visualization tools is a plus. Lead the analysis of research findings to identify key business and operational insights…
Senior Director of Pharmaceutical Markets,,CardieX Limited,,,"Serve as an information conduit to ATCOR, providing a timely flow of market intelligence related to pharma industry developments, such as newly announced…"
Sr Engineer (ComEd - Database Administrator),,Exelon Corporation,,4.0,Review engineering drawing and device settings to perform data validation on database data. Provides consultation and recommendations to the Company within and…
Board Certified Behavior Analyst (BCBA) Supervisor - Orland Park,,The Place for Children with Autism,,,Conduct regular mentor meetings and established performance evaluations for clinical staff and provide feedback in areas of strength or improvement.
IT Dynamics NAV ERP Developer,,Columbus Vegetable Oils,,,Has a high emotional intelligence and can communicate effectivity from the Shipping Dock to Senior Management. BlueCross BlueShield of IL PPO and HMO.
Senior Product Designer,,CareAdvisors,"$80,000 - $110,000 a year",,At least 5 year(s) of experience working as a Product Designer or UX/UI Designer or similar roles. Collaborate with the product manager and the designer to…
"Financial Analyst, Financial Planning and Analysis Hub","Chicago, IL (West Town area)",Google,,4.3,"Comfort and experience using SQL to extract and manipulate data, or experience with other programming or scripting languages."
"Financial Analyst, Project Authorization","Oakbrook Terrace, IL 60181",Exelon Corporation,,4.0,4 Liaison to business units to ensure efficiency and effectiveness of information exchange. 2 Assist in preparation of various data requests and answer ad-hoc…
SAP HANA Data Warehouse Engineer,"Northfield, IL",Medline Industries Inc,,3.4,Ability to optimize the performance of enterprise business intelligence solutions by means redesigning or re-architecting data structures or data flows.
Physiological Data Analyst,"Chicago, IL 60611 (Streeterville area)",Ann & Robert H. Lurie Children’s Hospital of Chica...,,3.9,Perform exploratory data analysis in pediatric biomedical research using quantitative methods incorporating heterogeneous and complex data types under direct…
Senior Business Sales Analyst,"Chicago, IL",U.S. Bank,,3.6,"Expert in PowerPoint, Excel and Access or other Business Intelligence tool for querying data and for data manipulation/transformation."
Azure Data Engineer,"Chicago, IL 60601 (The Loop area)",Avanade,,3.7,Help to develop business intelligence tools. Stay up to date with business best practice in using and retrieving data. Experience in structured problem solving.
"Senior Data Scientist, Media Analytics","Chicago, IL",84.51°,,2.7,"Bachelor's or Master's degree or equivalent in statistics, mathematics, analytics, economics, or marketing. Supporting the development of junior data scientists…"
STATIONARY ENGINEER REGISTRY FEATURED,"Chicago, IL",Sinai Health System,,3.6,"Repairs or makes adjustments to mechanical equipment to maintain operation. Equipment status, pressures, temperatures and other prescribed data is recorded on…"
"Investment Banking, Mergers and Acquisitions Analyst","Chicago, IL 60601 (The Loop area)","Baker Tilly US, LLP",,3.9,"One (1)+ year of experience in investment banking, business valuation services, commercial banking, or public accounting."
Strategy Associate,"Chicago, IL",Magnetar,,,"GPA of 3.4 or higher from an accredited undergraduate college or university. Construct detailed financial models of existing strategies/businesses (e.g.,…"
Billing Reporting and Systems Analyst,,Polsinelli PC,,3.4,"Bachelor’s degree in accounting or business preferred. Personal protective equipment provided or required. Sanitizing, disinfecting, or cleaning procedures in…"
SENIOR DATA ENGINEER,"Chicago, IL",Hyatt Corporate Office,,5.0,"5+ years of experience within the field of data engineering or related technical work including business intelligence, analytics."
Web Developer,"Chicago, IL","Robis Elections, Inc.","$65,000 - $100,000 a year",,"NET web and database applications. Personal protective equipment provided or required. Sanitizing, disinfecting, or cleaning procedures in place."
"Investment Operations, Analyst","Chicago, IL 60637 (Woodlawn area)",The University of Chicago,,4.1,A minimum of two years of experience in middle office financial or treasury operations in an audit firm or bank. Reference Contact Information (3) (preferred).
Workforce Analyst,"Chicago, IL 60603 (The Loop area)",Getty Images,,3.9,Previous experience with Workforce Management system or equivalent experience in managing business resources across a global service organization.
Statistician,"Chicago, IL",Mathematica Policy Research,"$90,000 - $140,000 a year",3.8,"Mentorship. Oversee the analyses of junior statisticians and data scientists, and support their professional development."
Governance Administrator,"Chicago, IL (Fulton River District area)",Academy of General Dentistry,,3.9,"Personal protective equipment provided or required. High school or equivalent (Preferred). Association experience, particularly in Governance or Advocacy…"
Supply Chain Analyst,"Chicago, IL 60654 (River North area)",Phusion Projects,,4.3,Analytical - Synthesizes complex or diverse information; Collects and researches data; Uses intuition and experience to complement data; Designs work flows and…
CCHIP Regional System Data Analyst,"Chicago, IL 60608 (Illinois Medical District area)",Hektoen Institute LLC,,,"Provide data entry and data cleaning; ensuring accurate, complete, and timely submission of all required data reports; monitoring data quality according to…"
Client Insights Analyst,"Chicago, IL",IRI,,3.6,Marketing and/or sales analytics with a premier Consumer Packaged Goods (CPG) company or other companies using syndicated or POS data is preferred.
Analyst Sr Supply Chain,"Deerfield, IL 60015",WALGREENS,,3.6,Bachelor's Degree and at least 1 years of experience in a supply chain or business role OR a High School Diploma/GED and at least 4 years of experience in a…
Data Scientist,"Chicago, IL",Concurrency,,4.2,"Knowledge of data science tool-space, data analysis, data preparation, data verification, and software development concepts."
Product Analyst,"Chicago, IL",Kin Insurance,,4.7,"Identifying problems to solve, gathering user research and input, and outlining proposed solutions, supported with data. 1-2 years relevant product experience."
Data Engineer,"Rolling Meadows, IL",Cognizant Technology Solutions,,3.9,Of data sources using SQL and AWS ‘Big data’ technologies. And data scientist team members that assist them in building and optimizing our.
Risk and Strategy Analyst,"Chicago, IL 60654 (Loop area)","Dividend Finance, LLC",,3.5,Bachelors or Masters in STEM or Economic background with a focus on hypothesis and data driven solutions. The analyst community plays a pivotal role at Dividend…
"Analyst - C11, Chicago, Investment Banking (BCMA)","Chicago, IL",Citi,,3.9,Bachelor's degree in Finance or closely related areas of Business Administration. Bachelor's degree/University degree or equivalent experience.
Sr. Insight Analyst,"Chicago, IL",Retail Insight,,,"You'll have a deep understanding of the challenges we're addressing for our customers, their data and business processes, and our products."
"Analytics Developer - Enterprise Data Warehouse, Full-time, Days","Chicago, IL 60611 (Streeterville area)",Northwestern Memorial Healthcare,,3.9,Two or more years of experience in a role querying and/or analyzing data. Experience working with business users in developing analytical solutions to meet…
Sales and Marketing Operations Specialist,"Chicago, IL 60606 (The Loop area)",Displayr,"$60,000 - $90,000 a year",,Experience in data management - able to implement data best practices and processes for maintaining marketing data and improving data quality.
Client Service Manager - Chicago / Irvine,"Chicago, IL","JPMorgan Chase Bank, N.A.",,3.9,"§ Evaluate team and individual performance to achieve business objectives. § Drive change initiatives, business strategy and technology enhancements programs."
CCHIP Regional System Data Analyst,"Chicago, IL 60608 (Illinois Medical District area)",Hektoen Institute LLC,,,"Provide data entry and data cleaning; ensuring accurate, complete, and timely submission of all required data reports; monitoring data quality according to…"
Client Insights Analyst,"Chicago, IL",IRI,,3.6,Marketing and/or sales analytics with a premier Consumer Packaged Goods (CPG) company or other companies using syndicated or POS data is preferred.
Analyst Sr Supply Chain,"Deerfield, IL 60015",WALGREENS,,3.6,Bachelor's Degree and at least 1 years of experience in a supply chain or business role OR a High School Diploma/GED and at least 4 years of experience in a…
Data Scientist,"Chicago, IL",Concurrency,,4.2,"Knowledge of data science tool-space, data analysis, data preparation, data verification, and software development concepts."
Product Analyst,"Chicago, IL",Kin Insurance,,4.7,"Identifying problems to solve, gathering user research and input, and outlining proposed solutions, supported with data. 1-2 years relevant product experience."
Data Engineer,"Rolling Meadows, IL",Cognizant Technology Solutions,,3.9,Of data sources using SQL and AWS ‘Big data’ technologies. And data scientist team members that assist them in building and optimizing our.
Risk and Strategy Analyst,"Chicago, IL 60654 (Loop area)","Dividend Finance, LLC",,3.5,Bachelors or Masters in STEM or Economic background with a focus on hypothesis and data driven solutions. The analyst community plays a pivotal role at Dividend…
"Analyst - C11, Chicago, Investment Banking (BCMA)","Chicago, IL",Citi,,3.9,Bachelor's degree in Finance or closely related areas of Business Administration. Bachelor's degree/University degree or equivalent experience.
Sr. Insight Analyst,"Chicago, IL",Retail Insight,,,"You'll have a deep understanding of the challenges we're addressing for our customers, their data and business processes, and our products."
"Analytics Developer - Enterprise Data Warehouse, Full-time, Days","Chicago, IL 60611 (Streeterville area)",Northwestern Memorial Healthcare,,3.9,Two or more years of experience in a role querying and/or analyzing data. Experience working with business users in developing analytical solutions to meet…
Sales and Marketing Operations Specialist,"Chicago, IL 60606 (The Loop area)",Displayr,"$60,000 - $90,000 a year",,Experience in data management - able to implement data best practices and processes for maintaining marketing data and improving data quality.
Client Service Manager - Chicago / Irvine,"Chicago, IL","JPMorgan Chase Bank, N.A.",,3.9,"§ Evaluate team and individual performance to achieve business objectives. § Drive change initiatives, business strategy and technology enhancements programs."
Business Analyst III-Chicago Il-UALJP00009362,"Chicago, IL",ASAP Solutions,$45 an hour,4.1,Can perform analysis on large and complex forms of data in order to make informed business and technical decisions.
Executive Strategy Analyst,"Chicago, IL",#TeamGoHealth,,2.9,"BA or BS degree with an understanding of the foundational business concepts (e.g., EBITDA, market segmentation) and the primary KPIs/levers associated with each…"
Credit and Collections Analyst,"Chicago, IL 60606 (Loop area)",Intelsat,,3.7,"Spanish and/or Portuguese would be a great plus. At least 3 years of experience of Credit and Collections, Accounting or Finance."
"ABA Therapist, Part Time","Bronzeville, IL",Apex Pediatric Therapy Services,$18 - $22 an hour,,"Bachelor's degree in Psychology, Education, ABA or a related field. Complete daily paperwork and data collection notes in a detailed, accurate, and timely…"
Data and Analytics Engineer,"Chicago, IL 60603 (The Loop area)",Netrix LLC,,3.4,Ability to design and deliver solutions for enterprise data warehouse and business intelligence platforms. Perform testing for integrations and data pipelines…
Lease Analyst Intern,"Chicago, IL",MRI Software,,3.3,In this role you will be responsible for reading and entering data from legal documents and rent invoices on behalf of our Fortune 1000 customer base.
Finance Analyst,"Chicago, IL 60601 (The Loop area)",Razorfish Health,,3.8,Create ad hoc reports for by pulling data from SAP and working in Excel to construct standard/periodic information reports.
Loan Portfolio Analyst,"Chicago, IL 60601 (The Loop area)",Illinois Housing Development Authority,"$57,135 - $122,468 a year",3.7,"Personal protective equipment provided or required. Sanitizing, disinfecting, or cleaning procedures in place. Approves and processes said requests."
Support Engineer,"Oakbrook Terrace, IL",Precisely,,,"Nice to have: Experience or familiarity with EngageOne products or other similar solutions. BS degree in Information Technology, Computer Science or equivalent."
"Analyst, Finance & Analytics","Chicago, IL 60602 (The Loop area)","Grubhub Holdings, Inc.",,3.2,"SQL and/or Tableau highly desirable. Structure and analyze ambiguous problems, creating quantifiable answers to surface business recommendations."
Sr. Data Scientist,"Chicago, IL",Kar Global,,3.2,Own the development of predictive modeling and machine learning for data products helping to optimize the value and efficiency of our business.
Research Scientist I Neurosurgery,"Skokie, IL 60076","ASN, American Society for Neurochemistry",,,"Knowledge of current medical and scientific literature and research findings in related research areas. At least 1-2 year’s experience, after conferral of…"
Payroll Analyst,"Chicago, IL",City Colleges of Chicago,,3.8,"College level course work in accounting, business administration or finance strongly preferred. An Associate’s degree or sixty (60) semester hours of credit…"
Senior Research Scientist,"Chicago, IL 60637 (Woodlawn area)",The University of Chicago,,4.1,"Works independently to write articles, reports and manuscripts, and presents research findings at meetings and/or conferences."
Senior Data Analyst,"Chicago, IL",ShopRunner,,,Strong knowledge of database principles and data visualization concepts. Experience with translating business requirements into technical requirements with a…
Digital Associate (Influencer Strategy),"Chicago, IL 60611 (Streeterville area)",Golin,,3.8,"Bachelor's degree in marketing, communications or related field with 1-3 years' experience at a digital, advertising, media or PR agency, and a deep…"
0452 Associate Policy Analyst,"Chicago, IL 60637 (Woodlawn area)",Chapin Hall at the University of Chicago,,4.0,"Demonstrated facility with quantitative and/or qualitative data analysis required. Master’s degree in public policy, social work, developmental or clinical…"
Data Engineer Manager,"Chicago, IL",CreditNinja,,,The ideal candidate is an experienced data engineer and data wrangler who enjoys optimizing data systems and building them from the ground up.
Statistician,"Chicago, IL",Mathematica Policy Research,"$90,000 - $140,000 a year",3.8,"Mentorship. Oversee the analyses of junior statisticians and data scientists, and support their professional development."
Governance Administrator,"Chicago, IL (Fulton River District area)",Academy of General Dentistry,,3.9,"Personal protective equipment provided or required. High school or equivalent (Preferred). Association experience, particularly in Governance or Advocacy…"
Supply Chain Analyst,"Chicago, IL 60654 (River North area)",Phusion Projects,,4.3,Analytical - Synthesizes complex or diverse information; Collects and researches data; Uses intuition and experience to complement data; Designs work flows and…
CCHIP Regional System Data Analyst,"Chicago, IL 60608 (Illinois Medical District area)",Hektoen Institute LLC,,,"Provide data entry and data cleaning; ensuring accurate, complete, and timely submission of all required data reports; monitoring data quality according to…"
Client Insights Analyst,"Chicago, IL",IRI,,3.6,Marketing and/or sales analytics with a premier Consumer Packaged Goods (CPG) company or other companies using syndicated or POS data is preferred.
Analyst Sr Supply Chain,"Deerfield, IL 60015",WALGREENS,,3.6,Bachelor's Degree and at least 1 years of experience in a supply chain or business role OR a High School Diploma/GED and at least 4 years of experience in a…
Data Scientist,"Chicago, IL",Concurrency,,4.2,"Knowledge of data science tool-space, data analysis, data preparation, data verification, and software development concepts."
Workforce Scientist - Lead Consultant,"Northbrook, IL",Allstate,"$75,900 a year",3.7,"5 years’ experience (PhD) or 8 years’ experience (Master’s) in using data and analytics, experience with people data preferred."
Product Analyst,"Chicago, IL",Kin Insurance,,4.7,"Identifying problems to solve, gathering user research and input, and outlining proposed solutions, supported with data. 1-2 years relevant product experience."
Technology Analyst / Junior Architect,,BMO Harris Bank,,3.5,Some data placement and data integration background. Technical proficiency gained through education and/or business experience.
Data Engineer,"Rolling Meadows, IL",Cognizant Technology Solutions,,3.9,Of data sources using SQL and AWS ‘Big data’ technologies. And data scientist team members that assist them in building and optimizing our.
Risk and Strategy Analyst,"Chicago, IL 60654 (Loop area)","Dividend Finance, LLC",,3.5,Bachelors or Masters in STEM or Economic background with a focus on hypothesis and data driven solutions. The analyst community plays a pivotal role at Dividend…
"Analyst - C11, Chicago, Investment Banking (BCMA)","Chicago, IL",Citi,,3.9,Bachelor's degree in Finance or closely related areas of Business Administration. Bachelor's degree/University degree or equivalent experience.
Sr. Insight Analyst,"Chicago, IL",Retail Insight,,,"You'll have a deep understanding of the challenges we're addressing for our customers, their data and business processes, and our products."
"Analytics Developer - Enterprise Data Warehouse, Full-time, Days","Chicago, IL 60611 (Streeterville area)",Northwestern Memorial Healthcare,,3.9,Two or more years of experience in a role querying and/or analyzing data. Experience working with business users in developing analytical solutions to meet…
Client Service Manager - Chicago / Irvine,"Chicago, IL","JPMorgan Chase Bank, N.A.",,3.9,"§ Evaluate team and individual performance to achieve business objectives. § Drive change initiatives, business strategy and technology enhancements programs."
Business Analyst III-Chicago Il-UALJP00009362,"Chicago, IL",ASAP Solutions,$45 an hour,4.1,Can perform analysis on large and complex forms of data in order to make informed business and technical decisions.
Executive Strategy Analyst,"Chicago, IL",#TeamGoHealth,,2.9,"BA or BS degree with an understanding of the foundational business concepts (e.g., EBITDA, market segmentation) and the primary KPIs/levers associated with each…"
Credit and Collections Analyst,"Chicago, IL 60606 (Loop area)",Intelsat,,3.7,"Spanish and/or Portuguese would be a great plus. At least 3 years of experience of Credit and Collections, Accounting or Finance."
BI/ETL Developer,"Cicero, IL 60804",Sentinel,,3.5,Experience working with SQL to extract data for reporting purposes. Experience working with applications such as Skyward and/or Decision Ed would be a plus.
Sr Validation Engineer,"Morton Grove, IL 60053",Morton Grove Pharmaceuticals,,3.1,"Engineering or Technical Degree, with Science major. Collect, collate, and analyze validation data and prepare final validation reports for approval by…"
Technology Analyst / Junior Architect,,BMO Harris Bank,,3.5,Some data placement and data integration background. Technical proficiency gained through education and/or business experience.
