job_title,location,company,salary,rating,summary
AVP Analytics & Business Intelligence,"Phoenix, AZ 85012 (Encanto area)",CopperPoint Insurance Company,,,Lead a team of business intelligence resources to deliver business insights through reports and dashboards. Collaborate with business partners to identify new…
Credit Analyst- Commercial,"Phoenix, AZ 85016 (Camelback East area)",Pacific Premier Bank,,3.1,Develop global cash flow analysis for business credits of all types. Experience as a credit analyst at a similar financial institution preferred.
Operations Metrics & Reporting Analyst,"Phoenix, AZ 85012 (Encanto area)",CopperPoint Insurance Company,,,"Bachelor’s Degree in Information Systems, Mathematics, Finance or another quantitative or related subject as well as a minimum 3 years’ experience in data…"
Business Analyst,"Scottsdale, AZ 85257 (South Scottsdale area)",Arizona State University,,4.2,Experience or knowledge of salesforce or similar CRM systems. Experience or knowledge of Workday or similar financial planning/ERP systems.
BI Data Engineer Sr,"Tempe, AZ","Insight Enterprises, Inc.",,3.6,"Designing and planning for solutions in the various engineering subject areas as it relates to data storage and movement solutions: data warehousing, enterprise…"
Pam Analyst,"Tempe, AZ 85281",Silicon Valley Bank,,3.8,"Works with business users to ensure roles and processes meet business needs, while adhering to IAM standards. Conducts user access certifications, as defined by…"
Senior Research Scientist,"Phoenix, AZ",Pearson,,3.7,"Familiarity with data privacy and ethics considerations associated with human subjects research. Locate, identify and/or extract usable data, both on- and off…"
Staff Engineer - Data Engineering - Big Data,"Scottsdale, AZ 85260 (North Scottsdale area)",Early Warning Services,,2.9,"Education and/or experience typically obtained through a Bachelor’s degree in computer science or related technical field. Big Data Platforms (Cloudera, S3)."
Senior Big Data Engineer,"Gilbert, AZ",Ascend Learning,,3.4,Partner with data scientists to build an infrastructure/pipeline to collect and analyze data. Build tools for data scientists to access and use the platform.
Infrastructure Business Analyst,"Tempe, AZ 85281",Silicon Valley Bank,,3.8,"Bachelor’s degree in related field or equivalent experience. Work effectively with business, technology and vendor partners on new initiatives."
Infrastructure Business Analyst,"Tempe, AZ 85281",Silicon Valley Bank,,3.8,"Bachelor’s degree in related field or equivalent experience. Work effectively with business, technology and vendor partners on new initiatives."
Interface Specialist,"Phoenix, AZ 85004 (Central City area)","STChealth, LLC",,,"You may have a business or related college degree, or you may have the equivalent work experience. You have experience with electronic data exchange and HL7…"
WorkForce Scheduling Manager,"Phoenix, AZ 85008 (Camelback East area)",ModivCare,"$65,000 - $80,000 a year",2.0,"4-year degree in business or related field, or equivalent experience in scheduling, planning, or operational support roles. Advanced level proficiency in Excel."
Loan Origination Analyst,"Phoenix, AZ","JPMorgan Chase Bank, N.A.",,3.9,"Order flood determinations and obtain flood compliance packages for all flood trigger events and flood insurance renewals, engage Valuation Services Group and…"
Quantitative Risk Analyst,"Scottsdale, AZ",Flack Global Metals,,,"Working towards or completed an undergraduate degree in a quantitative field (preferably in computer programing, statistics, mathematics or engineering)."
Pet Claims Experience Advocate (AZ or Remote),"Scottsdale, AZ",Lemonade Insurance Company,,2.5,"Comfortable with and adaptable to new technology and business tools. If you have a background in customer experience and a genuine passion for helping others,…"
Assistant Research Scientist - Phytochemistry,"Tempe, AZ 85282",SW COLLEGE,,,3 years of research experience in chemistry or phytochemistry. Conduct scientific literature research related to research projects.
Financial Analyst,,Trox,,3.9,Experience with business intelligence or analysis software tools preferred. Intermediate alpha/numeric data entry skills.
"MTS 1, Data Engineer","Chandler, AZ 85286",PayPal,,3.9,"Knowledge of data warehousing concepts. Strong fundamentals of object-oriented design, data structures, algorithms and design patterns."
Staff Data Engineer,"Tempe, AZ 85281",Freedom Financial Network,,3.5,"Experience working with various data stores: SQL, NoSQL, and/or key-value store. Bachelor’s in Computer Science or related field, or relevant experience in…"
Financial Analyst - Field Operations,"Glendale, AZ 85301","City of Glendale, AZ",,3.8,"Maintain confidentiality of information processed or prepared. Bachelor's Degree in Accounting, Finance, Business Administration or related field and three…"
Research Associate,"Scottsdale, AZ",Voya Financial,,3.4,Provide research assistance to portfolio managers and analysts as needed. Strong database and spreadsheet skills a requirement.
Data & Integration Engineer,"Tempe, AZ 85284",NewRez,,3.5,Provide end user support to other data engineers and analysts. Experience with Hadoop or other big data technologies. Real time streaming data delivery.
"Data Scientist, Account Management Automation","Phoenix, AZ",Square,,3.6,"3+ years of analytics and data science experience or equivalent. Deeply understand the Account Management data ecosystem, and apply data science to support the…"
QA Engineer,"Tempe, AZ",Alt Thirty Six,,,Can communicate to technical and business stake holders. Document the new code for administrators and end users. Highly familiar with web technology.
Data Analyst III,"Tempe, AZ 85280 (Broadmor area)",ADP,,3.8,"Related experience in analytics, market intelligence and analytics, financial modelinga or statistical analysis. Conducts NPS project initiation activities."
"Data Analyst II (Pharmacy, PBM Pricing)","Tempe, AZ",Envolve Pharmacy,,3.2,O Internal data cleansing and data reconciliation analysis. 2+ years of statistical analysis or data analysis experience. Responsible for analytical data needs.
"System Analyst I, II, III, Senior","Glendale, AZ 85306",Alaska USA Federal Credit Union,,3.9,An active Agile team member with business stakeholders and software engineers developing solutions to achieve strategic business outcomes.
Mechanical Engineer Graduate Intern,"Phoenix, AZ 85018 (Camelback East area)",Intel,,4.1,Experience listed below would be obtained through a combination of your school work classes/research and/or relevant previous job and/or internship experiences.
"Analyst, Centralized Planning","Phoenix, AZ",Carvana,,2.7,Performing vehicle delay root-cause analysis to provide clear data and visibility across multiple systems. With the ability to search thousands of vehicles from…
Production Data Operations and Automation Engineer,"Phoenix, AZ 85001 (Central City area)",Splunk,,4.1,"5+ years of relevant work experience surrounding data warehouse, data lake operations and production support. As a Production Operations Engineer, you will work…"
Senior Data Engineers,"Phoenix, AZ",American Express,,4.1,"Document data requirements and data stories, and maintain data models to ensure seamless integration into existing data architectures."
Business Analyst - Water Services,"Glendale, AZ 85301","City of Glendale, AZ",,3.8,Manipulate and create data tables to troubleshoot problems or enhance data information. May assist with grant applications related to information and/or…
Experience Assurance Analyst,"Phoenix, AZ 85012 (Encanto area)",Cable One Inc.,,3.7,"Associate’s Degree A.A. or equivalent from two-year college or technical school required. 2 years or more in related professional-level customer service,…"
Educational Sales Coordinator (Work from Home),,Varsity Tutors,$18 an hour,3.9,"Complete transactions and or schedule a follow-up conversations with prospective clients. Remote Position, fully work from home (or wherever you like!)."
IT Engineer I,"Mesa, AZ","City of Mesa, AZ","$68,586 - $102,523 a year",3.9,"Any combination of training, education, and experience equivalent to graduation from an accredited college or university with an Associate's Degree in Computer…"
Cost Engineer,"Phoenix, AZ 85043 (Estrella area)",Harder Mechanical Contractors,,4.0,Familiarity and conceptual understanding of online database use. Assisting project teams with database related set up and maintenance of projects.
Research Fellow - Artificial Intelligence,"Scottsdale, AZ 85250 (South Scottsdale area)",Mayo Clinic,,4.1,Qualified individuals will demonstrate the potential for research as evidenced by their training and peer-reviewed publications and should become competitive…
Data Specialist,"Phoenix, AZ 85044 (Ahwatukee Foothills area)","Hanley Wood Media, Inc.",,,"Organize the data collected, match municipal data with internally tracked new home community data. Collect housing data from municipalities (typically online or…"
Clinical Database Developer,"Scottsdale, AZ 85258 (North Scottsdale area)",Imaging Endpoints,,3.0,Minimum of 3 years of experience developing data collection modules within EDC or other clinical database systems is required.
Research Fellow - Artificial Intelligence,"Scottsdale, AZ 85250 (South Scottsdale area)",Mayo Clinic,,4.1,Qualified individuals will demonstrate the potential for research as evidenced by their training and peer-reviewed publications and should become competitive…
Data Specialist,"Phoenix, AZ 85044 (Ahwatukee Foothills area)","Hanley Wood Media, Inc.",,,"Organize the data collected, match municipal data with internally tracked new home community data. Collect housing data from municipalities (typically online or…"
Clinical Database Developer,"Scottsdale, AZ 85258 (North Scottsdale area)",Imaging Endpoints,,3.0,Minimum of 3 years of experience developing data collection modules within EDC or other clinical database systems is required.
Laboratory Scientist,"Phoenix, AZ","A-TEK Inc,",,,Laboratory training that is assigned or accompanies an associated course is not considered applicable training.
Finance Metadata Analyst,"Phoenix, AZ",American Express,,4.1,"Review and/or define data element definition values in partnership with data stewards, data custodians and information architects."
Lead Business / Data Quality Analyst (Financial Crimes),"Tempe, AZ","Mufg Union Bank, National Association",,,"Ensure data sourcing best practices, straight-through data sourcing approach meets SLA. Participate and contribute to data source identification (lineage), data…"
Lead Data Engineer (remote),"Phoenix, AZ",ThoughtWorks,,4.2,You are comfortable taking data-driven approaches and applying data security strategy to solve business problems.
INVESTIGATIVE ASSISTANT,"Phoenix, AZ 85004 (Encanto area)",State of Arizona,,3.5,"Skilled in communicating data information to others orally or through spreadsheet format. Must be skilled in compiling, organizing and analyzing data."
Database Administrator 5,"Mesa, AZ",iknowvate technologies,,,Migrate data from enterprise-hosted databases to cloud-hosted data services like Azure. Assist developers with complex query tuning and schema refinement.
Educational Sales Coordinator (Work from Home),,Varsity Tutors,$18 an hour,3.9,"Complete transactions and or schedule a follow-up conversations with prospective clients. Remote Position, fully work from home (or wherever you like!)."
ANALYST II,"Tempe, AZ 85283",Lumen,,3.5,"Answers business questions through data analytics. Analyze data, identifies several different solutions along with pros and cons with respect to impact on the…"
"Application Support Analyst (Remote or Scottsdale, AZ)","Scottsdale, AZ 85258 (North Scottsdale area)",Matrix Medical Network,"$64,000 - $70,000 a year",2.9,"B.S. or a B.A. college degree preferred and/or equivalent work experience in a System Administrator role. MCSE, Azure or other MS certifications."
Student Information Specialist,"Glendale, AZ 85301",Glendale Elementary School District No. 40,,,Works collaboratively and cooperatively with all District student database users and administrators for. And site users for the purpose of compiling accurate…
FINANCIAL ANALYST I,"Phoenix, AZ 85007 (Central City area)",State of Arizona,,3.5,"Skills in accurately analyzing and interpreting data. Knowledge in Microsoft Word, Excel and/or similar related software. Paid vacation and sick time."
Senior Network Analyst/Engineer,,SGTech Solutions,,,"Knowledge of brokerage or financial company processes. A bachelor's degree in Information Technology preferred, or related work experience."
Business Analyst,"Phoenix, AZ 85016 (Camelback East area)",Marcus & Millichap,,3.5,"Compile data and material for the use of writing copy, developing infographics, and providing targeted research."
Sr. Privacy Analyst,"Tempe, AZ 85281",Silicon Valley Bank,,3.8,One or more professional certifications related to privacy such as Certified Information Privacy Professional or equivalent (or willingness to obtain within 6…
Crime Analyst (Critical Position),"Phoenix, AZ 85003 (Central City area)",City of Phoenix,,4.2,Bachelor's degree in public or business administration or criminal justice or related field. Two years of experience with a military or law enforcement agency…
Quality Assurance Analyst,"Scottsdale, AZ 85257 (South Scottsdale area)",Arizona State University,"$48,960 - $70,000 a year",4.2,"Bachelor’s degree in Computer Science or similar; two years practical experience or relevant experience. Creates, updates and executes test plans, cases, data…"
Project Manager,"Phoenix, AZ 85014 (Encanto area)",Valley of the Sun United Way,"$65,000 - $70,000 a year",4.2,Develop and cultivate business relationships vital to success of projects / business initiatives. At least three (3) years of experience as a project analyst or…
Research Scientist: DNA Nucleotide Chemistry,"Scottsdale, AZ 85255 (North Scottsdale area)",INanoBio,,,"Doctorate in chemistry, biochemistry, or related field. A strong record of outstanding research and publication history is expected."
Senior Operations Business Analyst,"Tempe, AZ",Cenlar FSB,,2.9,Strong analytical skills – Ability to work with large amounts of data and translate into analytical findings and business recommendations.
Data Engineer – Insurance Group Domain client,"Phoenix, AZ 85001 (Central City area)",Ivy Tech Solutions inc,,,Develops data models to define new or modify existing data structures in support of data integration initiatives. Data Engineer – Insurance Group Domain client.
BUSINESS SYSTEMS ANALYST,"Scottsdale, AZ 85260 (North Scottsdale area)",Electronic Payment Providers Inc,,,5 years of hands-on experience as a business systems analyst or Agile Scrum product owner delivering cutting edge technology solutions.
"Senior Analyst, Global Data Governance & Strategy","Tempe, AZ 85284",Circle K,,3.3,Ensures data element lineage and business/technical metadata is well documented. Aid in the development of the business data dictionary across all functions.
Small Business Development Analyst Senior (Specially Funded),"Maricopa County, AZ",Maricopa Community Colleges,"$48,728 - $63,347 a year",3.8,"A. Four (4) or more years of experience in financial analysis, business planning, access to capital, gathering information on business operations, conducting…"
Operations Analyst,"Phoenix, AZ",Synchronoss Technologies,,3.4,This role contributes to Synchronoss’ Media Support team by providing assistance to business operations such as front end document or transaction content…
Business Process Analyst,"Chandler, AZ 85286",PayPal,,3.9,"Business analyst or equivalent experience. Knowledge of solutions that utilize artificial intelligence, machine learning and/or neural networking."
Business Process Management Analyst,"Phoenix, AZ 85003",Public Consulting Group,,3.9,"Experience: Minimum of 2 years of experience in a health or human services related field, lean six sigma role, or similar industry required."
Business System Analyst 3,"Chandler, AZ 85286",PayPal,,3.9,"Experience in building Insights from data - associations among data, business rules/logics, data flows, data usages. Conduct user acceptance testing (UAT)."
Analyst,"Phoenix, AZ 85012 (Encanto area)",Paradigm Tax Group,,3.8,"Analyzing data for completeness by reconciling to balance sheets. BS/BA preferred with concentration in real estate, finance, accounting, economics, and/or…"
Data Scientist,"Phoenix, AZ",Caris Life Sciences,,2.8,Ability to query complex data from database. Experience in developing database and data-driven applications. Manipulate and process large multisource data sets.
"Sr. Director, Data Engineering","Tempe, AZ 85281",Silicon Valley Bank,,3.8,"Collaborate with the data analysts, data architect, and business users to design the data models for high-performance analytics while ensuring data accuracy and…"
Business Intake Analyst,"Phoenix, AZ 85004 (Central City area)",Lewis Roca Rothgerber Christie LLP,,3.7,"Synchronize and maintain data flow between 3E and new business intake system. Perform conflict database searches as required for data analysis, troubleshooting,…"
Tech StartUp - Business Development Representative,"Phoenix, AZ 85004 (Central City area)",BlueOptima,,4.0,"Bachelors and/or Master’s degree in Business, tech or equivalent expertise. Our position includes a comprehensive training and development programme - prior…"
"Data Center Engineer, Senior","Tempe, AZ 85284",Sentinel,,3.5,The candidate should have a variety of experience with modern data center solutions. The Senior Data Center Engineer will be responsible for supporting Sentinel…
Clinical Data Analyst,"Tempe, AZ",Statistics & Data Corporation (SDC),,3.5,"Comply with SDC’s data integrity & business ethics requirements. Under supervision, performs data management activities in support of clinical and/or non…"
Deloitte Advisory GPS Data Scientist,"Gilbert, AZ 85297",Deloitte,,4.0,"This is a cross-functional role where teams will interact with data collection, reporting, system designers, architects, database administrators, and cyber risk…"
Analyst - Commercial Real Estate,"Phoenix, AZ",NorthMarq Capital,,4.1,Gather and track critical financial data points for research and negotiation purposes. Individuals with prior Investment Banking or Private Equity experience …
Business Analyst - Campus Recruiting,"Tempe, AZ 85280 (Broadmor area)","CGI Group, Inc.",,3.6,Make data driven recommendations regarding business issues and resource allocation. Solve interesting problems for our clients to create or improve a system.
Battery Scientist,"Phoenix, AZ",Nikola Motor Company,,,Candidates must have current U.S. work authorization or be TN eligible from Mexico or Canada. Analyze test data and provide optimal parameter for performance…
Senior Data Warehouse Architect/Analyst,"Tempe, AZ 85287",Shutterfly,,3.7,Design data structures and data integrations to meet current and future business needs. Knowledge and understanding of emerging trends in data infrastructures…
Program Analyst (Senior Program Analyst),"Phoenix, AZ",US Department of the Treasury,"$108,885 - $172,500 a year",4.0,"The studies or projects involve complex programs, information technology systems, or issues and have impact on multiple IRS locations and/or organizations."
Business Analyst,"Phoenix, AZ 85016 (Camelback East area)",Marcus & Millichap,,3.5,"Compile data and material for the use of writing copy, developing infographics, and providing targeted research."
Sr. Privacy Analyst,"Tempe, AZ 85281",Silicon Valley Bank,,3.8,One or more professional certifications related to privacy such as Certified Information Privacy Professional or equivalent (or willingness to obtain within 6…
Quality Assurance Analyst,"Scottsdale, AZ 85257 (South Scottsdale area)",Arizona State University,"$48,960 - $70,000 a year",4.2,"Bachelor’s degree in Computer Science or similar; two years practical experience or relevant experience. Creates, updates and executes test plans, cases, data…"
Project Manager,"Phoenix, AZ 85014 (Encanto area)",Valley of the Sun United Way,"$65,000 - $70,000 a year",4.2,Develop and cultivate business relationships vital to success of projects / business initiatives. At least three (3) years of experience as a project analyst or…
Research Scientist: DNA Nucleotide Chemistry,"Scottsdale, AZ 85255 (North Scottsdale area)",INanoBio,,,"Doctorate in chemistry, biochemistry, or related field. A strong record of outstanding research and publication history is expected."
Senior Operations Business Analyst,"Tempe, AZ",Cenlar FSB,,2.9,Strong analytical skills – Ability to work with large amounts of data and translate into analytical findings and business recommendations.
Data Engineer – Insurance Group Domain client,"Phoenix, AZ 85001 (Central City area)",Ivy Tech Solutions inc,,,Develops data models to define new or modify existing data structures in support of data integration initiatives. Data Engineer – Insurance Group Domain client.
BUSINESS SYSTEMS ANALYST,"Scottsdale, AZ 85260 (North Scottsdale area)",Electronic Payment Providers Inc,,,5 years of hands-on experience as a business systems analyst or Agile Scrum product owner delivering cutting edge technology solutions.
"Senior Analyst, Global Data Governance & Strategy","Tempe, AZ 85284",Circle K,,3.3,Ensures data element lineage and business/technical metadata is well documented. Aid in the development of the business data dictionary across all functions.
Project Coordinator,,HILGARTWILSON,,4.4,Assist in preparation of engineers cost estimates and spreadsheets. Coordinate pickup (scanning) or downloading of redlines.
Small Business Development Analyst Senior (Specially Funded),"Maricopa County, AZ",Maricopa Community Colleges,"$48,728 - $63,347 a year",3.8,"A. Four (4) or more years of experience in financial analysis, business planning, access to capital, gathering information on business operations, conducting…"
Operations Analyst,"Phoenix, AZ",Synchronoss Technologies,,3.4,This role contributes to Synchronoss’ Media Support team by providing assistance to business operations such as front end document or transaction content…
Business Process Analyst,"Chandler, AZ 85286",PayPal,,3.9,"Business analyst or equivalent experience. Knowledge of solutions that utilize artificial intelligence, machine learning and/or neural networking."
Business Process Management Analyst,"Phoenix, AZ 85003",Public Consulting Group,,3.9,"Experience: Minimum of 2 years of experience in a health or human services related field, lean six sigma role, or similar industry required."
Business System Analyst 3,"Chandler, AZ 85286",PayPal,,3.9,"Experience in building Insights from data - associations among data, business rules/logics, data flows, data usages. Conduct user acceptance testing (UAT)."
Big Data Engineer,"Phoenix, AZ 85016 (Camelback East area)",Accenture,,4.0,A Big Data engineering maestro who knows how to build modern data architectures to provide mountains of data to data analysts and scientists.
Senior Training Specialist,"Phoenix, AZ",Equity LifeStyle Properties,,2.9,College degree or commensurate industry experience required. Review and update learning solutions as the business evolves.
Database Administrator II,"Phoenix, AZ 85012 (Encanto area)",Adelante Healthcare Inc,,3.0,3+ years analyst experience with healthcare data. Aggregate data from separate database systems and external sources. Level 1 Fingerprint Clearance Required.
Programmer Analyst,"Phoenix, AZ",Goodwill of Central Arizona,,3.0,Experience with relational database technology and knowledge of MySQL. 2-4+ years progressive experience as a programmer/analyst.
"intern, graduate and undergraduate - software engineer - summer 2021 - remote","Scottsdale, AZ 85257 (South Scottsdale area)",Starbucks,,4.0,"Active enrollment in an accredited Undergraduate or Graduate degree program. In our quest for connecting customers to Starbucks products they love, the…"
Engineer,"Phoenix, AZ 85009 (Estrella area)","Gas Transmission Systems, Inc.",,,"Acquire and analyze data using appropriate standard quantitative methods. Under supervision and with latitude for independent action and decision, GTS Engineers…"
"Process Engineer I - Chandler, AZ (T)","Chandler, AZ",Exyte,,,Bachelor’s degree in Chemical Engineering or related field required. The Process Engineer I provides design and engineering support for the design of Process…
Salesforce Marketing Cloud Business Analyst,"Phoenix, AZ 85016 (Camelback East area)",Accenture,,4.0,Bachelor's degree or equivalent (minimum 12 years) work experience. Work with business and technology client representatives to gather functional and technical…
Software SR Engineer - Big Data Developer,"Chandler, AZ",Wells Fargo,,3.7,"Design high performing data models on big-data architecture as data services. Work with business analysts, development teams and project managers for…"
Actuary Analyst,"Phoenix, AZ",Banner Health,$37.30 an hour,3.7,"Knowledge of software for data analysis; specifically, spreadsheets (e.g. MS Excel, VBA), data extraction and manipulation (e.g. SAS, Teradata, R) and data…"
Sr. Database Developer,"Scottsdale, AZ",Universal Electronics,,3.2,"Design and develop tools to process large data sets with statistical algorithms, machine learning, data mining and predictive simulation."
Big Data Engineer,"Phoenix, AZ",Impetus Technologies,,4.1,Actively participate in various architecture and design calls with big data customers. Strong previous professional experience building Distributed Solutions…
