job_title,location,company,salary,rating,summary
Data Engineer,"Austin, TX",Sansutek,,,"Seattle, Austin or Bay Area. 5+ years of Java or Scala programming experience as their primary language. Job Types: Full-time, Contract."
Data Analyst,"Austin, TX 78701 (Downtown area)",RoverPass,,,Perform strategic data analysis and research to support business needs. Validate business data for accuracy and completeness.
Business Intelligence Analyst,"Austin, TX 78730",All Web Leads,,3.2,"You will interact closely with executives, stakeholders, engineers, and other analysts to optimize the business. 2+ years experience with Microsoft SQL."
Data Analyst,"Austin, TX",NexGenT,,,Help different business unit leaders on driving business insights through data presentation / visualization. The data analyst role will report to COO at NexGenT…
Food & Nutrition-Business Analyst,"Austin, TX 78749",Prolim,$57 - $74 an hour,,"Documents relevant data reporting elements. Queries, analyzes, and provides data. Ability to quickly and clearly communicate technical information to non…"
Business Analyst 2-Ops,"Austin, TX",Oracle,,3.8,Provide management with economic impact and compliance issues surrounding key business decisions and/or deals. Provides business practices and processes.
Junior Data Engineer,"Austin, TX 78744",EBQ,,,"If you are an individual with a disability and require a reasonable accommodation to complete any part of the application process, or are limited in the ability…"
Business Data Analyst,"Austin, TX 78731",SALI Fund Services,,,Minimum 1 year of data analytics / business intelligence experience. Personal protective equipment provided or required.
Data Analyst Intern,"Austin, TX 78729",PayPal,,3.9,Aggregate data from various sources to construct streamlined data pipelines and integrate data from multiple PayPal systems.
"Business Intelligence Analyst, P&T","Austin, TX",Procore Technologies,,4.1,"Identify business intelligence, reporting, and data analysis needs. Partner with Product Managers, UX Designers, and Engineers to determine business…"
Data Analyst Engineer,"Austin, TX",Breakthrough PT Marketing,,,"Identify, implement and own business intelligence software to provide business insights cross-functionally. Experience with data pipeline management."
Business Intelligence Developer,"Austin, TX 78738",Dosh,,4.5,"2+ years of industry and client consulting experience in a data science, business analytics, business intelligence, or comparable data role."
Business Intelligence Analyst,"Austin, TX",Spectrum Brands,,3.5,"Experienced at visualizing data in Excel, PowerBI or equivalent. The right candidate will have a passion for discovering solutions hidden in large data sets,…"
Business Intelligence Analyst ll (B3),"Austin, TX",Applied Materials Inc.,,3.9,Analyzes and interprets data and business intelligence reports. Works with others in the development of data warehouses and other data sources to support…
ETL / Data Warehouse Developer,"Austin, TX",New York Life Insurance Co,,3.7,"Create SSIS packages to import/export data, and load and process data. Prepare data for job runs. The primary job function is to develop, test, tune, and…"
Business Intelligence Analyst ll (B3),"Austin, TX",Applied Materials Inc.,,3.9,Analyzes and interprets data and business intelligence reports. Works with others in the development of data warehouses and other data sources to support…
ETL / Data Warehouse Developer,"Austin, TX",New York Life Insurance Co,,3.7,"Create SSIS packages to import/export data, and load and process data. Prepare data for job runs. The primary job function is to develop, test, tune, and…"
Supplier Operations Support Analyst,"Austin, TX",Tesla,,3.5,"For senior analyst positions, 6 years or more of experience are expected. At least 2 years of work experience in supply chain, manufacturing or other process…"
Business Analyst,"Austin, TX",Talentiqo,$45 - $60 an hour,,The initial assignment for the Business Analyst will be to support the migration of an existing major data warehouse solution and associated web applications…
Marketing Data Scientist,"Austin, TX 78731",Indeed,"$70,000 - $92,000 a year",4.3,"Day-to-day activities will involve using Python, or R, to pull together large data sets. Whether creating impactful advertising, coding bidding algorithms, or…"
Data Analyst,"Austin, TX 78703",Austin Pets Alive!,,3.8,Summarize monthly data and write monthly data reports. Assist Data Coordinator and other data positions in summarizing surveys and data to generate survey and…
Business Intelligence Analyst - Sales,"Austin, TX 78703 (Old West Austin area)",Miro,,4.8,Find the stories buried in data and build insightful dashboards that enable everyone at Miro to be an analyst. Competitive salaries + Flexible time off.
Senior Data Engineer,"Austin, TX",Apgar Consulting,"$83,000 - $103,000 a year",,"Personal protective equipment provided or required. Master data management: 3 years (Required). Sanitizing, disinfecting, or cleaning procedures in place."
Business Analyst II,"Austin, TX",EvereTech LLC,$45 - $60 an hour,5.0,"The Business Analyst should possess both business and systems analyst skills, perform business process and requirements analyses by leading stakeholder…"
Research Scientist/Engineer - Product Development and Testing,"Round Rock, TX 78664","Ametrine, Inc.","$50,000 - $65,000 a year",,"May require domestic and/or international travel (25% or less). Bachelors Degree in Engineering, Physics, or Chemistry. 0-2 years of experience."
Data Analyst V,"Austin, TX 78751 (Triangle State area)",Health & Human Services Comm,"$5,785 - $9,783 a month",3.4,"Evaluate research data: to prepare reports and research findings: and to. Experience in data reporting, database structures and presenting findings."
Data Scientist,"Austin, TX 78730",CDK Global,,3.2,. Take business requirements and turn them into a research project which includes designing and implementing A/B testing.
Business Intelligence Analyst - Operations,"Austin, TX",Babylon Health,,3.0,1+ years of business experience using SQL. Help build the foundational data infrastructure and analytics platform to assist data-driven teams within the product…
Data Analyst,"Austin, TX",Lagomaj Capital,,,Our new data analyst should have a STEM background and be open to working quickly on problems by finding patterns and creating solutions grounded in data.
Business Analyst - New Jersey,"Austin, TX",Celsius,,3.6,"Ability to articulate data requirements and data quality standards. Communicate complex business needs into clear, actionable systems requirements."
Data Engineer,"Austin, TX 78702 (East Cesar Chavez area)",Literati,,,"Building data objects, procedures, and data streams in Snowflake. Building new tables, schemas in the data warehouse to increase consistency and accuracy of the…"
Liaison Business Analyst,"Austin, TX","PMCS Services, Inc",$70 - $80 an hour,,"Business analyst: 10 years (Required). Documents relevant data reporting elements. Queries analyze and provide data. Job Types: Full-time, Contract."
Data Engineer,"Austin, TX 78705 (Hancock area)",REX,,4.7,"Map-Reduce, Hive or any big data technology. As a data Engineer, you will build from scratch highly available and highly scalable data processing systems using…"
Data Engineer,"Austin, TX",Sage IT Inc,$55 - $60 an hour,,"B.S./M.S. in Computer Science or Computer Engineering or 3+ years of equivalent experience. Strong skills in SQL, Java and/or Python."
Business Analyst,"Austin, TX 78701 (Downtown area)","GB Tech, Inc.",,3.7,"Documents relevant data reporting elements. Queries, analyzes, and provides data. The position is the FND program liaison with TDA’s Information Technology (IT)…"
"Intern (Associate Market Analyst, Business Development)","Austin, TX 78757 (North Shoal Creek area)",Pearson,$20 an hour,3.7,Perform market research and analysis. Evaluate costs and benefits of multiple actions and/or solutions and provide data-driven recommendations.
Business Intelligence Analyst,"Austin, TX",ZVRS Purple Communications,,,Experience with call center and/or telecom data is a plus. This position is responsible for analyzing data that is used by the business to ensure these concepts…
Claims Data Analyst II,"Austin, TX 78717","Continental LTC, Inc.",,,Develops knowledge of business information data sources used to gain new insights and understanding of business performance based on data.
Business Intelligence Data Analyst,"Austin, TX 78758 (North Austin area)",Pitney Bowes,,3.6,Must have hands-on experience in data modeling: statistical or quant. Utilize data visualization software products to enhance understanding of data analyses.
Business Intelligence Consultant,"Austin, TX 78704 (Bouldin area)",City of Austin,$31.47 - $40.91 an hour,4.1,Troubleshoots reported data loads or reconciliation inconsistencies in conjunction with the sites for data models and/or reports.
Operations Research Analyst,"Austin, TX (Downtown area)",Facebook,,4.2,"Build/maintain data infrastructure (data pipelines, aggregated data sets, reports, dashboards) to monitor the performance of our operations and drive business…"
Cloud Data Engineer,"Austin, TX",Ursi Technologies Inc,"$76,185 - $154,901 a year",,"Experience building and optimizing ‘big data’ data pipelines, architectures and data sets. Working knowledge of message queuing, stream processing, and highly…"
Data Scientist,"Austin, TX 78751",Digital Pharmacist,,5.0,"M.S. in quantitative discipline (Computer Science, Machine Learning, Statistics, Operations Research or related field) with 2+ years experience applying data…"
IT Data Architect (ETL Developer and Administrator),"Austin, TX 78704 (Bouldin area)",City of Austin,$37.12 - $49.18 an hour,4.1,"Extensive experience developing data-centric applications and/or large-scale data integrations and transformations using ETL toolsets, SQL and/or other database…"
"SW Engineer, Research (83061)","Austin, TX","Advanced Micro Devices, Inc.",,3.8,"B.S. in computer science, computer engineering, or equivalent experience as a software developer. Familiar with at least one other major language or framework …"
Data Entry Specialist,"Austin, TX 78727",CONSOLIDATED REINFORCEMENT,"$40,000 - $50,000 a year",3.6,1+ years’ experience performing data analysis or data entry. Log all new job information into database daily. Willing to cross train with other departments.
Research Analyst,"Austin, TX 78701 (Downtown area)",Vista Equity Partners Management,,,"Domo, Tableau, or other data analytics and visualization experience preferred. Manage and optimize Vista’s research vendor relationships."
Location Intelligence (GIS) Analyst,"Austin, TX 78735",The Retail Strategy,"$50,000 - $60,000 a year",,"Retailer or Franchise mapping experience. Understanding of cell phone data platforms. The role demands strong technical knowledge of designing, developing and…"
Data Analyst,"Austin, TX",Everlywell,,2.5,Perform strategic data analysis and research to support business needs. The data analyst will work both independently and with business stakeholders to analyze…
Data Analyst,"Austin, TX",Celsius,,3.6,"Continuously work to Integrate new data sources and increase data quality, integrity, and cleanliness from existing data sources."
Business Analyst - SQL & Excel Analysis,"Austin, TX",The Teltech Group,"$90,000 - $104,960 a year",,"Documents relevant data reporting elements. Queries, analyzes, and provides data. Ability to quickly and clearly communicate technical information to non…"
Data Warehouse Developer (1285),"Austin, TX 78701 (Downtown area)",Employees Retirement System of Texas,"$7,000 - $8,167 a month",3.7,"Works closely with business SMEs to reverse engineer the rules that govern business processes, corresponding data streams, and associated source systems."
Data Integrity Analyst,"Austin, TX 78758 (North Austin area)",woom bikes,,,Load data into inventory analysis database. Gather necessary data needed for new part creation (or parts edits). Process previous day’s fulfilment.
"Business Systems Analyst, Business Intelligence and Analytics","Austin, TX (Downtown area)",Google,,4.3,Closely collaborate with business users to translate data requirements into clearly defined technical requirements.
Data Analyst,,PayPal,,3.9,Proficiency in Python and/or R for data analysis. Some experience in cloud data warehouse technologies like Google Big query or AWS Redshift.
Business Analyst,"Austin, TX 78741 (Pleasant Valley area)",Falcontek,"$90,000 - $109,000 a year",,"A Bachelor’s Degree in Operations Research, Mathematics, Computer Science, Cost Accounting or related scientific or technical discipline with 5 years of…"
Emerging Operations Analyst,"Austin, TX 78731",Indeed,$19.23 - $25.00 an hour,4.3,"Analytics experience on data from a diverse array of data sources, and the ability to synthesize and visualize data for making timely decisions and developing…"
Business Intelligence Analyst - SQL Server,"Austin, TX 78741 (Parker Lane area)",ZVRS,,3.6,Experience with call center and/or telecom data is a plus. This position is responsible for analyzing data that is used by the business to ensure these concepts…
"Data Scientist - Job Seeker, Invitation Quality","Austin, TX 78731",Indeed,"Up to $128,000 a year",4.3,"Passion to answer Product/Engineering questions with data. Have full stack experience in data collection, aggregation, analysis, visualization,…"
Business Intelligence Systems Analyst,"Austin, TX",Steck Systems,,,
Business Intelligence Analyst - SQL Server,"Austin, TX 78741 (Parker Lane area)",ZVRS,,3.6,Experience with call center and/or telecom data is a plus. This position is responsible for analyzing data that is used by the business to ensure these concepts…
"Data Scientist - Job Seeker, Invitation Quality","Austin, TX 78731",Indeed,"Up to $128,000 a year",4.3,"Passion to answer Product/Engineering questions with data. Have full stack experience in data collection, aggregation, analysis, visualization,…"
Data Analyst,,PayPal,,3.9,Proficiency in Python and/or R for data analysis. Some experience in cloud data warehouse technologies like Google Big query or AWS Redshift.
Business Intelligence Systems Analyst,"Austin, TX",Steck Systems,,,
Financial and Operations Business Analyst,"Austin, TX",Knock,,3.7,3+ years as a business analyst or similar role integrating large data sets from various sources and converting it into digestible dashboards and metrics.
Business Analyst,"Austin, TX 78701 (Downtown area)",Amer Technology Inc,$60 - $65 an hour,3.2,"Documents relevant data reporting elements. Queries, analyzes, and provides data. Ability to quickly and clearly communicate technical information to non…"
Senior Business Operations Analyst,"Austin, TX 78746",BazaarVoice,,3.8,Partner with team business intelligence analysts to serve as central points of contact and the source of truth for critical business information.
Database Analyst (Data Base Administrator II-IV 21-0180),"Austin, TX 78701 (Downtown area)",OFFICE OF THE ATTORNEY GENERAL,"$4,301 - $7,500 a month",4.0,"Supports data analytics and business intelligence systems. Experience: Two years building data models, database design, and data extraction."
Strategic Data Analyst,"Austin, TX",Acrisure Technology Group,,,Use research insights to help drive overall data strategy and our underlying systematic approach to data acquisition measurement.
Business Analyst,"Austin, TX 78701 (Downtown area)","GB Tech, Inc",,3.7,"Documents relevant data reporting elements. Queries, analyzes, and provides data. The position is the FND program liaison with TDA’s Information Technology (IT)…"
"Data Analyst, Enterprise","Austin, TX",One Drop,,,"3+ years experience in a data or business analyst role, building data models and analytics visualizations. This role seeks to develop solutions by automating…"
Competitive Intelligence Analyst,"Austin, TX 78703 (Downtown area)",Whole Foods Market,,3.8,"Turn and translate big data into meaningful insights and/or business recommendations. 1+ years of experience in Data Science, Business Analytics, Business…"
"Data Scientist, ML Engineering - Duo Security","Austin, TX 78759 (Arboretum area)",Cisco Systems,,4.1,"Formal training in ML, statistics, or data science research. Comfort wrangling data and interacting with data pipelines and data warehouses."
Strategy Analyst,"Austin, TX 78731",Indeed,"$62,000 - $80,000 a year",4.3,Savvy in data analysis and problem-solving. Strong business acumen and structured thinking with a global perspective; international experience is preferred.
Data Scientist Intern,"Austin, TX 78701 (Downtown area)",Silicon Labs,,4.3,"Interaction with data sources and working with data lakes. Collaborate with our Marketing and IT business intelligence team to drive analytics, give updates to…"
Data Intelligence Analyst,"Austin, TX 78758 (North Burnett area)",Health & Human Services Comm,"$4,599 - $6,066 a month",3.4,"Data research work consists primarily of case-specific research, data collection and analysis. Knowledge of or familiarity with social science research methods,…"
"Data Scientist, Analytics","Austin, TX (Downtown area)",Facebook,,4.2,"Experience manipulating data sets through statistical software (e.g. R, SAS) or other methods. Apply your expertise in quantitative analysis, data mining, and…"
Data Analyst,"Austin, TX",Arrive Logistics,,3.0,"Expert with Excel, SQL, SSRS and Power BI or other data visualization tools. Data validation and researching data discrepancies. In This Role, You Will:"
Business Analyst,"Austin, TX",General Motors,,4.1,In-depth understanding of business analyst fundamentals. Knowledge in a functional area or business process domain.
Data Analyst,"Austin, TX 78701 (Downtown area)",Caritas of Austin,,3.9,"The Data Analyst will be responsible for data collection, data quality, data analysis, and reporting for all of Caritas' programs."
"Data Analyst, Performance Management","Austin, TX (Downtown area)",Facebook,,4.2,Experience creating data infrastructure (e.g. pipeline creation). 5+ years of experience in data and analytical problem solving.
Business Operations Analyst - Service & Support,"Pflugerville, TX",EOS North America,"$70,000 - $80,000 a year",4.0,"Data collection, data pipeline development and data analysis for problem solving or ad hoc needs. Work with business stakeholders to determine their business…"
"Senior Financial Analyst, Business Partner","Austin, TX 78757 (North Shoal Creek area)",Pearson,,3.7,Responsible for financial business partnering activities in support of the school operations and services organizations in the Online & Blended Learning…
Data Migration Analyst,"Austin, TX",Q2ebanking,,2.8,Contribute to a knowledge/FAQ database for supported software. Availability to work occasional weekends or late night / early morning is required.
Business Intelligence Analyst V (B5),"Austin, TX",Applied Materials Inc.,,3.9,"Document rules and processes for business intelligence or IT reports, dashboards, change requests, projects, or other outputs; Maintain library of model…"
Data Analyst,"Austin, TX 78751 (Triangle State area)",Dept of Family & Protectve Svc,"$4,599 - $5,500 a month",3.4,Explain data and analysis in a way that is understandable to those with limited data knowledge or experience. The Team then works with the multiple divisions to…
Database Administrator,"Round Rock, TX 78664",Steck Systems,,,Conducts database performance monitoring and performs appropriate database tuning tasks to maintain optimal application and reporting response times.
"Data Scientist - Internal Platforms, Hire Signal","Austin, TX 78731",Indeed,"$130,000 - $156,000 a year",4.3,"Can develop production-grade data science solutions using Python, R, Scala, or Java. We build the centralized data source of hires that occur on Indeed, and we…"
Business Intelligence Analyst - SQL Server,"Austin, TX","Purple Communications, Inc.",,,Experience with call center and/or telecom data is a plus. This position is responsible for analyzing data that is used by the business to ensure these concepts…
Business Analyst,"Austin, TX 78704 (St. Edwards area)","iHeartMedia, Inc.",,3.6,Train end-users on new products or processes. Effective negotiation skills to resolve conflicts and meet business objectives.
"Data Scientist - Internal Platforms, Hire Signal","Austin, TX 78731",Indeed,"$130,000 - $156,000 a year",4.3,"Can develop production-grade data science solutions using Python, R, Scala, or Java. We build the centralized data source of hires that occur on Indeed, and we…"
Business Intelligence Analyst - SQL Server,"Austin, TX","Purple Communications, Inc.",,,Experience with call center and/or telecom data is a plus. This position is responsible for analyzing data that is used by the business to ensure these concepts…
Business Analyst,"Austin, TX 78704 (St. Edwards area)","iHeartMedia, Inc.",,3.6,Train end-users on new products or processes. Effective negotiation skills to resolve conflicts and meet business objectives.
Senior Business Intelligence Data Analyst,"Austin, TX",Tango Card,,4.0,"5+ years of experience working directly in a data warehouse or data lake environment including: cleaning and preparing data, querying and conducting exploratory…"
Data & Insights Analyst,"Austin, TX",StitcherAds,,,Experience with experimental design and/or statistical analysis to drive business decision making. Perform scientifically sound data analysis for key insights…
Analyst for Educator Data and Preparation Program Management,"Austin, TX 78701 (Downtown area)",Texas Education Agency,"Up to $68,046 a year",3.7,"Experience: At least two (2) years of experience in data analysis, research, compilation, and/or reporting work."
"Emerging Operations Analyst, Messaging","Austin, TX 78731",Indeed,$19.23 - $25.00 an hour,4.3,"Text analytics experience on data from a diverse array of data sources, and the ability to synthesize and visualize data for making timely decisions and…"
IT Business Systems Analyst Senior,"Austin, TX 78704 (South River City area)",City of Austin,$33.36 - $43.36 an hour,4.1,Experience conducting research on new and existing system upgrades and/or replacements. Verification of your education (which may include high school graduation…
Institutional Research Analyst,"Austin, TX 78712 (University of Texas area)",University of Texas at Austin,,4.3,"Familiarity with institutional/higher education data, research, and federal (IPEDS) and/or state (THECB) compliance reporting."
Service Delivery Sr. Analyst Engineer (Azul) – US Remote,"Round Rock, TX",Dell Technologies,,4.0,Focus on activities like data analytics and reporting. Bachelor’s degree or an advanced degree. Service Delivery is all about making sure our technical…
Experienced Business Planning Analyst,"Austin, TX 78746",Benchmark International,"$45,000 - $65,000 a year",4.0,"Bachelor’s degree with a concentration or advanced degree Finance, Marketing, or Accounting or an unrelated degree with significant work experience in one or…"
GIS ANALYST,"Cedar Park, TX 78613",The City of Cedar Park,$20.53 - $25.03 an hour,,"Bachelor’s or Associate’s degree in Geographic Information System Science, Planning, Geography, or in a field related to the work from an accredited college or…"
Research Data Scientist,"Austin, TX 78752 (Highland area)",Texas A&M Transportation Institute,,4.4,"Experience in analysis of large travel-related data sets such as cell, GPS, LBS or other ‘big data’ sources and use of such data in travel model development and…"
DMV Business Analyst Manager,"Austin, TX 78731 (Rosedale area)",TEXAS DEPARTMENT OF MOTOR VEHICLES,"$5,259 - $7,500 a month",3.5,Satisfactory driving records are required for driving state or personal vehicles and motor driven equipment to conduct agency business.
Operational Data Analyst,,Cofiroute USA,,2.5,Performs highly complex data analysis and data research work. Responsible for building data models to organize important data for different teams across the…
"Data Engineer (Hadoop, AWS, Java)","Austin, TX 78731",Indeed,"$116,000 - $142,000 a year",4.3,"Skilled in sourcing, extracting, transforming, and loading data, you are able to translate business requests into database design."
Operational Data Analyst,,Cofiroute USA,,2.5,Performs highly complex data analysis and data research work. Responsible for building data models to organize important data for different teams across the…
Principal Data Scientist / Engineer,"Austin, TX 73301 (St Edwards area)",Splunk,,4.1,"Demonstrated ability to work across business stakeholders, structure data science problems, independently execute analysis, and also mentor other engineers…"
Summer 2021 Business & Process Analyst Co-Op/Intern - (82922),"Austin, TX","Advanced Micro Devices, Inc.",,3.8,"Understanding of data, statistical analysis and metrics a plus. Review current processes and research industry best practices to highlight areas for improvement…"
Crime Analyst (Investigator IV 21-0209),"Austin, TX 78701 (Downtown area)",OFFICE OF THE ATTORNEY GENERAL,"$4,095 a month",4.0,Accesses and researches various specialized databases for intelligence investigations. Accesses and researches the Texas Department of Public Safety’s databases…
Big Data Engineer,"Austin, TX",Intone Networks,,4.2,In Computer Science or Computer Engineering or 3+ years of equivalent experience Please provide answers to the qualifying questions below: How many yrs of…
Business Analyst,"Austin, TX",Accenture,,4.0,"2 years of demonstrated experience working with healthcare data (i.e. medical claims, encounters, eligibility or provider data). 1 year of SQL experience."
