job_title,location,company,salary,rating,summary
AI/ML Data Scientist,"Austin, TX 78746",Dematic,,3.5,"Define data strategies for algorithm development. Master’s or PhD preferred. 3+ years of OR, statistical or data mining algorithm development experience,…"
Senior Data Analyst - Post Market Surveillance,"Cedar Creek, TX 78612","Agilent Technologies, Inc.",,4.1,Translating data and trends into actions to drive business decisions. Developing and deliver dashboards and data visualizations needed to optimally monitor Post…
Emerging Operations Team Lead,"Austin, TX 78731",Indeed,"$59,000 - $82,000 a year",4.3,"Statistical analytics experience on data from a diverse array of data sources, and the ability to synthesize and visualize data for making timely decisions,…"
(Senior/ Lead) Product Analyst - Data Intelligence,,Salesforce,,4.3,"When analyses or data science models are ready to be productized, own the delivery by working with engineers and other data scientists to turn insights into…"
Product Scientist - Ask'em,"Austin, TX 78731",Indeed,"$116,000 - $142,000 a year",4.3,"Experience building and/or pulling data using SQL. Work alongside other data scientists and software engineers to expand Indeed's catalog of tools, techniques,…"
Business Analyst / UML 2.5.1 / Ralph Kimball methodology,"Austin, TX",The Teltech Group,"$75,000 - $85,280 a year",,"The Business Analyst should possess both business and systems analyst skills, perform business process and requirements analyses by leading stakeholder…"
"Research Engineering Scientist Associate I, Department of Neurology, Dell Medical School","Austin, TX 78712 (University of Texas area)",University of Texas at Austin,,4.3,Experience with design and implementation of human subjects and/or animal research. Experience with research presentations and manuscript writing.
Data Scientist,"Austin, TX 78759 (Arboretum area)",SparkCognition,,4.4,Experience managing large volumes of data (terabytes or more). Use and/or pioneer procedures and/or automated toolsets to more efficiently and effectively…
Data Scientist,"Austin, TX",ANALYTOS,,,A strong passion for empirical research and for answering hard questions with data. Deploy data-science and technology based algorithmic solutions to address…
Data Engineer,"Austin, TX 73301 (St Edwards area)",Cognizant Technology Solutions,,3.9,Knowledge of PLSQL or any NoSQL such as MongoDB or Cassandra. B.S./M.S. in Computer Science or Computer Engineering or 3+ years of equivalent experience.
Business Analyst - IT,"Austin, TX",Citizens Inc,,3.4,Â· Partner with the business to understand challenges and process impacts in order achieve business objectives. Fluency in Spanish and/or Mandarin.
Healthcare Business Operations Analyst- SQL,"Austin, TX 78750",TransUnion,,3.8,"5+ years of professional experience as an analyst, customer success manager, or account manager. 3 - 5 years of professional experience as an analyst, customer…"
Data Engineer,"Austin, TX 78726",Zenoss,,3.9,MS/BS in Computer Science/Electrical Engineering or equivalent work experience in an enterprise software engineering organization with a focus on data science…
Technical Data Analyst - BP&T,"Austin, TX (Downtown area)",Facebook,,4.2,"Experience with data visualization tools such as Tableau or packages in R/Python. Apply expertise in quantitative analysis, data mining, and data visualization…"
Customer Success Scientist - Engineer,"Austin, TX 78703",L7 Informatics Inc,,,Minimum of a MS in a relevant life sciences field or engineering or BS with 5 years industry/research experience.
Senior Data Analyst,"Austin, TX 78731",ZenBusiness PBC,,,"Having a deep understanding in one or more verticals of the business by way of ensuring data quality, doing data analysis, and data ownership."
Senior Research Scientist,"Austin, TX 78757 (North Shoal Creek area)",Pearson,,3.7,"Familiarity with data privacy and ethics considerations associated with human subjects research. Locate, identify and/or extract usable data, both on- and off…"
AI/ML Data Scientist,"Austin, TX 78746",Dematic,,3.5,"Define data strategies for algorithm development. Master’s or PhD preferred. 3+ years of OR, statistical or data mining algorithm development experience,…"
"Research Intern, Artificial Intelligence","Austin, TX (Downtown area)",Facebook,,4.2,"Currently has, or is in the process of obtaining, a degree (PhD, Masters, or Bachelors with relevant research experience) in Computer Science or related field."
Business Process Analyst,"Pflugerville, TX 78660",City of Pflugerville,"$51,000 - $59,000 a year",3.9,Prepare special reports and conduct research as requested by department management. Develop or modify written procedures relating to departmental processes and…
Business Analyst II or III - Toll Operations Division,"Austin, TX 78754",Texas Department of Transportation,"$51,614 - $77,862 a year",3.9,"Analyzing and organizing business and technical data. Captures, documents and/or implements functional business requirements."
Research Associate,"Austin, TX",KANTAR,,3.7,"Assist with research project management tasks, from fieldwork to delivery, and develop an understanding of research processes and methods."
Data Quality Analyst,"Austin, TX 78758 (North Austin area)",The Zebra,,3.8,Prior experience with Looker or other data analytics platforms. Manage data quality metrics and technical definitions of data objects.
Publishing Manager,"Austin, TX",Scribe Media,"$60,000 a year",3.0,(You will not be writing or editing the manuscript yourself.). You're a Project Manager in that you're responsible for a book creation and publishing process.
Engineer – Fab Engineering,"Austin, TX 78754",Samsung Electronics,,4.0,"Applies data science tools to find root cause. Trains and mentors junior engineers on duties and projects. Manages data collection, disposition and actions for…"
Research Analyst,"Austin, TX 78733",Attia Medical,,,"You will digest large amounts of research, mostly from formal scientific publications, but also government data and popular media."
Inventory Analyst,"Austin, TX 78701 (Downtown area)",Cirrus Logic,,4.0,"Record and maintain accurate records through data entry and analysis. Identify and resolve discrepancies in WIP via extensive Excel comparison, analysis of…"
Data Engineer,"Austin, TX 78735 (East Oak Hill area)",Kestra Financial,,2.8,"Build a data model to get actionable insights from data, operational efficiency, and other key business performance metrics."
"Talent Partner, Onboarding","Austin, TX",Tesla,,3.5,"Highly Analytical / Able to make data-driven decisions. 3-5 years’ experience in human resources, training, general business OR 5+ years related work experience…"
GIS Analyst,"Austin, TX 78702 (East Cesar Chavez area)",ForeFlight,,3.8,A person in this role will convert data from various sources into digital and graphic formats for use in support of ForeFlight's airport mapping database.
Database Administrator,"Round Rock, TX 78681 (La Frontera area)",FIELD SERVICES PARTNER,,,"Thorough understanding of database logic, database design, relational databases. Review and administer guidelines for database training for data-entry staff,…"
Senior Business Analyst,"Austin, TX 78750",Indeed Flex,"$80,000 - $95,000 a year",5.0,Looking at business data proactively and find opportunities for improvement and share insights with relevant senior stakeholders. 3+ Years working with SQL.
Operations Analyst,"Austin, TX 78730",Khoros,,4.1,"Basic experience with or understanding of the SaaS business model. Experience with SalesForce, or Professional Services Automation (PSA) software such as…"
IT Business Systems Analyst Senior (Project & Technologies),"Austin, TX 78741 (Pleasant Valley area)",City of Austin,$33.36 - $43.36 an hour,4.1,"Verification of your education (which may include high school graduation or GED, undergraduate and/or graduate degrees) will be required."
Business Process Analyst,"Pflugerville, TX 78660",City of Pflugerville,"$51,000 - $59,000 a year",3.9,Prepare special reports and conduct research as requested by department management. Develop or modify written procedures relating to departmental processes and…
Business Analyst II or III - Toll Operations Division,"Austin, TX 78754",Texas Department of Transportation,"$51,614 - $77,862 a year",3.9,"Analyzing and organizing business and technical data. Captures, documents and/or implements functional business requirements."
"Research Intern, Artificial Intelligence","Austin, TX (Downtown area)",Facebook,,4.2,"Currently has, or is in the process of obtaining, a degree (PhD, Masters, or Bachelors with relevant research experience) in Computer Science or related field."
Research Associate,"Austin, TX",KANTAR,,3.7,"Assist with research project management tasks, from fieldwork to delivery, and develop an understanding of research processes and methods."
Data Quality Analyst,"Austin, TX 78758 (North Austin area)",The Zebra,,3.8,Prior experience with Looker or other data analytics platforms. Manage data quality metrics and technical definitions of data objects.
Publishing Manager,"Austin, TX",Scribe Media,"$60,000 a year",3.0,(You will not be writing or editing the manuscript yourself.). You're a Project Manager in that you're responsible for a book creation and publishing process.
Research Analyst,"Austin, TX 78733",Attia Medical,,,"You will digest large amounts of research, mostly from formal scientific publications, but also government data and popular media."
Engineer – Fab Engineering,"Austin, TX 78754",Samsung Electronics,,4.0,"Applies data science tools to find root cause. Trains and mentors junior engineers on duties and projects. Manages data collection, disposition and actions for…"
Senior Telecommunications Engineer,,VERSA Integrated Solutions,"$66,000 - $72,000 a year",3.9,"VERSA takes the time to fully understand our customers' business needs, and engineers’ solutions that are both flexible and scalable to evolve as the customer…"
Inventory Analyst,"Austin, TX 78701 (Downtown area)",Cirrus Logic,,4.0,"Record and maintain accurate records through data entry and analysis. Identify and resolve discrepancies in WIP via extensive Excel comparison, analysis of…"
Data Engineer,"Austin, TX 78735 (East Oak Hill area)",Kestra Financial,,2.8,"Build a data model to get actionable insights from data, operational efficiency, and other key business performance metrics."
"Talent Partner, Onboarding","Austin, TX",Tesla,,3.5,"Highly Analytical / Able to make data-driven decisions. 3-5 years’ experience in human resources, training, general business OR 5+ years related work experience…"
GIS Analyst,"Austin, TX 78702 (East Cesar Chavez area)",ForeFlight,,3.8,A person in this role will convert data from various sources into digital and graphic formats for use in support of ForeFlight's airport mapping database.
Database Administrator,"Round Rock, TX 78681 (La Frontera area)",FIELD SERVICES PARTNER,,,"Thorough understanding of database logic, database design, relational databases. Review and administer guidelines for database training for data-entry staff,…"
Logical Data Base Administrator,"Austin, TX 78754",Health & Human Services Comm,"$5,785 - $9,783 a month",3.4,"(10%) Work together with scrum masters/agile coaches, architects, web/java developers, database developers & administrators, system administrators, business…"
Contract Database Engineer,"Austin, TX 78746",Samsung Electronics,,4.0,Work with application engineers to help them improve their scripts that feed the data into the data warehouse. Design a data expiration system.
Data Modeler,"Austin, TX",Ursi Technologies Inc,$40 - $75 an hour,,"He/she should be well versed in understanding relational data, dimensional data, unstructured data, and master data. Data modeling software (6 years)."
Product Strategy Manager,"Austin, TX 78731",Indeed,"$112,000 - $156,000 a year",4.3,Strong analytical skills across multiple types of data from financial / accounting data to product data. Great emotional intelligence - must be able to build…
Real Estate Analyst I and II - Right Of Way Division,"Austin, TX 78704 (South River City area)",Texas Department of Transportation,"$48,278 - $90,393 a year",3.9,Coordinates leasing or disposal of surplus property or other asset-related matters. Analyzes new or proposed legislation or regulations to determine impact on…
Machine Learning Engineer,,Real Estate Technology Start-up,"$70,000 - $110,000 a year",,Knowledge of batch and streaming data processing techniques. Strong knowledge of AWS or similar cloud platforms. Machine Learning: 3 years (Preferred).
"Marketing Data Analyst - Remote US, UK or Brazil. [AMGR]","Austin, TX 78759 (Arboretum area)",Marvel Marketers,,4.0,You will build dashboards in order to provide analysis of data findings. Our team member will develop business requirements with lead routing process flows and…
Middle School Attendance Clerk,"Leander, TX",Leander Independent School District,$14.78 an hour,4.1,"Collect, enter and maintain attendance and PEIMS data into student database including the update of parent/doctor notes. Assist with court referral process."
Data Processing Specialist,"Austin, TX 78758 (North Austin area)",Script Care LTD,,4.3,Load data files into database tables using automated job. Responsible for managing and pulling data files from FTP server. Submission of Bi-Monthly Claim Files.
Structures Analyst (Spacecraft),"Cedar Park, TX 78613",Firefly Aerospace,,3.3,"Validate finite element analysis with hand calculations and test data. Master’s Degree in Mechanical, Aerospace, or related engineering discipline."
"Senior Business Analyst, Customer Support Services (Austin or Remote)","Austin, TX 78701 (Downtown area)",Atlassian,,4.6,Work closely with data engineers to build a scalable data infrastructure for analytics. We’re looking for a Senior Business Analyst with a passion for…
"Associate, Strategy and Operations (Data Analyst IV)","Austin, TX 78701 (Downtown area)",TEXAS EDUCATION AGENCY,"$4,917 - $6,489 a month",3.7,"Consulting, data science, or other equally rigorous and quantitative experience preferred. Passionate about working with data, measuring performance, and making…"
Business Analyst,"Austin, TX",Assa Abloy,,3.6,Experience in analyzing data to draw business-relevant conclusions and in data visualization techniques and tools. Solid experience in writing SQL queries.
Sr. Data Engineer,"Austin, TX 78726",SailPoint,,4.2,"BS in Computer Science, or a related field. Deliver efficient, maintainable, robust Java based microservices. Produce designs and rough estimates, and implement…"
"Sr. Analyst, Healthcare Business Analytics","Austin, TX 78750",TransUnion,,3.8,Analytical and data-driven with a knack for driving business decisions through data and analytics. Experienced presenting data insights with data visualization…
M&A Intern,"Austin, TX 78701 (Downtown area)",Pathway,,3.5,Evaluate pertinent data by performing a variety of task analysis and business processes. Provide support to the business analysis team in preparing business…
"People Research Scientist, Manager Effectiveness","Austin, TX (Downtown area)",Facebook,,4.2,"Collaborate with data engineering and visualization engineers to access and manipulate data, explain data gathering requirements, and visualize results."
Presales Research Analyst - NetSuite,"Austin, TX 78704 (South Lamar-South Congress area)",RSM US LLP,,3.6,"Work with practice leaders and business developers to develop industry/regional business plans. Bachelor’s Degree in sales, marketing, business or related…"
"Senior Data Scientist, Vice President","Austin, TX",State Street,,3.5,Lead and coach a team of talented data scientists and ML engineers for solving a rich set of challenging problems.
Logical Data Base Administrator,"Austin, TX 78754",Health & Human Services Comm,"$5,785 - $9,783 a month",3.4,"(10%) Work together with scrum masters/agile coaches, architects, web/java developers, database developers & administrators, system administrators, business…"
Home Health Scheduler,,TheraCare Home Health,,2.9,¨ Maintains staff and client database. Personal protective equipment provided or required. ¨ Produces reports and articulates interpretation to the…
Data Analyst - Bilingual (German),,CSS Corp,Up to $18 an hour,3.6,Perform data attribute editing - Make accurate edits on map as required & evident from research. Review and research requests to determine if map attributes…
Contract Database Engineer,"Austin, TX 78746",Samsung Electronics,,4.0,Work with application engineers to help them improve their scripts that feed the data into the data warehouse. Design a data expiration system.
Data Modeler,"Austin, TX",Ursi Technologies Inc,$40 - $75 an hour,,"He/she should be well versed in understanding relational data, dimensional data, unstructured data, and master data. Data modeling software (6 years)."
Product Strategy Manager,"Austin, TX 78731",Indeed,"$112,000 - $156,000 a year",4.3,Strong analytical skills across multiple types of data from financial / accounting data to product data. Great emotional intelligence - must be able to build…
Data Warehouse Engineer,,Dealerware,,,Experience in data analytics and/or business intelligence. 3+ years of experience in a data warehousing or data engineering role.
Real Estate Analyst I and II - Right Of Way Division,"Austin, TX 78704 (South River City area)",Texas Department of Transportation,"$48,278 - $90,393 a year",3.9,Coordinates leasing or disposal of surplus property or other asset-related matters. Analyzes new or proposed legislation or regulations to determine impact on…
"Marketing Data Analyst - Remote US, UK or Brazil. [AMGR]","Austin, TX 78759 (Arboretum area)",Marvel Marketers,,4.0,You will build dashboards in order to provide analysis of data findings. Our team member will develop business requirements with lead routing process flows and…
Middle School Attendance Clerk,"Leander, TX",Leander Independent School District,$14.78 an hour,4.1,"Collect, enter and maintain attendance and PEIMS data into student database including the update of parent/doctor notes. Assist with court referral process."
Data Processing Specialist,"Austin, TX 78758 (North Austin area)",Script Care LTD,,4.3,Load data files into database tables using automated job. Responsible for managing and pulling data files from FTP server. Submission of Bi-Monthly Claim Files.
Business Analyst,,L&T Infotech,,3.7,Translates business strategies and objectives into business requirements. Identifies data elements and provides data mappings/dictionaries.
Big Data Software Engineer-Druid,"Austin, TX 78759 (Arboretum area)",Cisco Systems,,4.1,"You will be embedded within cross-functional teams that include big data engineers, data scientists and UX/UI engineers. Strong analytical and debugging skills."
Data Engineer,"Austin, TX",Scientific Games,,3.5,"Minimum 1 year of experience with Amazon AWS or similar cloud-based data storage solution. Bachelor’s degree or higher in Computer Science, MIS, or equivalent…"
Business Intelligence Platform Engineer,"Austin, TX",General Motors,,4.1,Linux/Unix or Windows system administration skills or experience with a focus on business intelligence and analytics tools.
"Senior Business Intelligence Analyst, P&T","Austin, TX",Procore Technologies,,4.1,"Identify business intelligence, reporting, and data analysis needs. Strong SQL knowledge with database design, ETL and data modeling experience."
Data & Business Process Coordinator,"Austin, TX 78758 (North Burnett area)",Global Resale,,2.5,"The Data & Business Process Coordinator will support our Sales Operations teams as well as our software developers, database architects, to ensure optimal data…"
Data Engineer,"Austin, TX",Science 37,,3.7,"Experience designing and building data lake and data warehouse solutions. Working with cloud distributed file systems, data lakes, and data warehouses."
Senior Gameplay Analyst - Studio Data and Insights,"Austin, TX",Electronic Arts,,3.8,SQL proficiency and the ability to extract data from large data sources with differing structures. Familiarity with version control and reproducible research…
Business Analyst,"Austin, TX","Purple Communications, Inc.",,,Minimum education - Bachelor’s Degree or similar in Computer Science or equivalent work experience. IIBA certification is strongly desired or equivalent…
Technical Business Analyst,"Austin, TX 78757 (North Shoal Creek area)",Austin Capital Bank,,4.0,Comfortable with database structures and using SQL for filtering/querying data. Data Analytics knowledge and knowing how to apply data to business cases.
Energy Analyst,"Austin, TX 78704 (Bouldin area)",City of Austin,,4.1,Coordinates with metering operations on deployment of sampled customers and collection of interval data in support of load research.
Senior Data Scientist,,dMASS,"From $126,000 a year",,"Masters degree or Ph.D. in Computer Science, AI or related computational fields. Experience managing manual data annotation projects."
Enterprise Architect,,Texas Association of Counties,"$75,000 - $90,000 a year",3.7,"Knowledge of full-life cycle data warehousing, data exchange, data integration, data quality, data security and architectural principles of data integration."
Business Analyst,,"ImplantBase, LLC","$70,000 - $80,000 a year",,Document to ensure business requirements are adequately reflected in development documents. Provide input and support the development of business and functional…
Hardware Engineer,,SimplyNUC,"From $70,000 a year",,Personal protective equipment provided or required. Image database: 2 years (Preferred). Bachelor’s Degree in Engineering (such as Mechanical or Electrical) and…
Customer Success Scientist/Engineer,,Scismic,,,"Collaborate with clients to plan/map their workflow requirements, process, data . Client consultations to ensure best practice translation of their workflows…"
Zoho CRM Administrator,,AnyPlace MD,,,"On-board and train users in data entry, data security procedures, reporting requirements, and develop and update training materials and resources."
"Senior Data Scientist - Located in Austin, TX",,Whole Foods Market,,3.8,We are looking for an experienced analyst or data scientist responsible for delivering data-driven and actionable insights about our customers / strategic…
Database Administrator and Developer,,Olea Edge Analytics Inc.,"$70,000 - $85,000 a year",,"This role will ensure that: data remains consistent across the database, data is clearly defined, users access data concurrently, in a form that suits their…"
Events Producer,"Austin, TX 78701 (Downtown area)",The Texas Tribune,,4.0,"Downtown office with paid parking or commuting stipend. Collect audience data and event metrics, run post-event evaluation and produce reports for stakeholders."
Search Quality Risk Operations Analyst,"Austin, TX 78731",Indeed,$19.23 - $25.00 an hour,4.3,Technical knowledge with a proficiency in manipulating data sets in SQL or equivalent and drawing insights from data.
Senior Data Engineer,"Austin, TX",Gametime,"$125,000 - $170,000 a year",,Familiarity with business intelligence/analytics tools like Tableau or Periscope Data. Collaborate with our data scientists to productionize their models.
Data Engineer,"Austin, TX",Planoly,,,"Experience communicating data analysis to business and peers, using data visualizations and reproducible analysis. Using version control (e.g. Git)."
Data Collection Engineer,"Austin, TX 78731","Uhnder, Inc.",,,"Curate data repository: catalog data, enable search, based on defined criteria and publish to stakeholders. Review and analyze data for correctness."
Data Scientist,"Austin, TX",Cloudflare,,3.8,"Capable of working closely with business, engineering, and product teams to ensure data initiatives are aligned with business needs."
9-1-1 Data Analyst,"Austin, TX 78701 (Downtown area)",911 Datamaster Inc,"$40,000 a year",,"Identify data inconsistencies and conflicts in address data sets. Complex data analysis to initiate, define and manage database migration efforts."
Junior Business Process Developer,"Austin, TX 78730",Computer Services Incorporated,,3.9,"The developer will need to work closely with system administrators and business analysts to plan and design new systems tools, integrations and processes."
Data Quality Analyst,"Austin, TX",REEF,,3.3,"Strong business acumen, with an affinity for data exploration, analysis, and working with business intelligence tools and large amounts of data."
Research Associate,"Austin, TX",Kantar TNS,,3.7,"Assist with research project management tasks, from fieldwork to delivery, and develop an understanding of research processes and methods."
Data Analyst,,"Raybeam, Inc.",,,"Build scalable data-driven processes to achieve business outcomes. 4+ years of discovery and assessment of a client’s data portfolio, data tools, and data…"
Customer Success Scientist/Engineer,,Scismic,,,"Collaborate with clients to plan/map their workflow requirements, process, data . Client consultations to ensure best practice translation of their workflows…"
Zoho CRM Administrator,,AnyPlace MD,,,"On-board and train users in data entry, data security procedures, reporting requirements, and develop and update training materials and resources."
Database Administrator and Developer,,Olea Edge Analytics Inc.,"$70,000 - $85,000 a year",,"This role will ensure that: data remains consistent across the database, data is clearly defined, users access data concurrently, in a form that suits their…"
Business Analyst,,L&T Infotech,,3.7,Translates business strategies and objectives into business requirements. Identifies data elements and provides data mappings/dictionaries.
