job_title,location,company,salary,rating,summary
Sr. IT Business Analyst - Texas Department of Agriculture (Long Term Contract Opportunity),"Austin, TX 78701 (Downtown area)",Darby Consulting,,4.5,"The position is the FND program liaison with TDA’s Information Technology (IT) Department (analysts and developers), and is required to understand the reporting…"
Financial Reporting Analyst Sr,"Austin, TX 78703",Lower Colorado River Authority,,3.6,Analyze business operations to gather requirements through documenting overall business processes and collecting reporting needs. 401(k) match up to 8%.
"Supply Planning Analyst, Global Operations","Austin, TX (Downtown area)",Facebook,,4.2,"Full proficiency in Excel, Tableau, or similar data visualization applications. Provide input into data-driven strategies balancing the priorities and timelines…"
"Scientist, Translational Research","Austin, TX",Forbius,,,Demonstrated excellence in oncology and/or fibrosis research through a track record of high impact publications.
Launch Mechanical Design Engineer- Battery Module,"Austin, TX",Tesla,,3.5,Proficiency with statistics and data analysis. Take over design responsibility from new product development engineers during production.
Software Engineering Internship - Summer 2021,"Austin, TX 78756 (Rosedale area)",CDK Global,,3.2,Actively enrolled in a Bachelor’s or Master’s Computer Science or related program. CDK Global solutions automate and integrate critical processes from pre-sale…
Cybersecurity Operations Analyst (Cybersecurity Analyst II),"Austin, TX 78701 (Downtown area)",TEXAS EDUCATION AGENCY,"$6,363 - $7,750 a month",3.7,"Ability to interact with personnel at all levels and across all business units and organizations, and to comprehend business imperatives."
Centers Tech Support Mgr,"Austin, TX",AT&T,,3.7,Education: High School Diploma or GED preferred. Works on several or all technical phases of operations. Key Roles and Responsibilities: Actively participates…
Quant and Trading Analyst,"Austin, TX 78701 (Downtown area)",Invesco,,4.0,"Prior experience working with FactSet, Bloomberg or similar market data providers is a plus. A degree in business administration, finance, engineering,…"
Senior Competitive Intelligence Analyst,"Austin, TX 78703 (Downtown area)",Whole Foods Market,,3.8,"Turn and translate complex data into meaningful insights and/or business recommendations. 5+ years of experience in Data Science, Business Analytics, Business…"
(Senior/ Lead) Product Analyst - Data Intelligence,"Austin, TX",Salesforce,,4.3,"When analyses or data science models are ready to be productized, own the delivery by working with engineers and other data scientists to turn insights into…"
"Senior Business Analyst, Customer Support Services (Austin or Remote)","Austin, TX 78701 (Downtown area)",Atlassian,,4.6,Work closely with data engineers to build a scalable data infrastructure for analytics. We’re looking for a Senior Business Analyst with a passion for…
"Associate, Strategy and Operations (Data Analyst IV)","Austin, TX 78701 (Downtown area)",TEXAS EDUCATION AGENCY,"$4,917 - $6,489 a month",3.7,"Consulting, data science, or other equally rigorous and quantitative experience preferred. Passionate about working with data, measuring performance, and making…"
Business Analyst,"Austin, TX",Assa Abloy,,3.6,Experience in analyzing data to draw business-relevant conclusions and in data visualization techniques and tools. Solid experience in writing SQL queries.
Sr. Data Engineer,"Austin, TX 78726",SailPoint,,4.2,"BS in Computer Science, or a related field. Deliver efficient, maintainable, robust Java based microservices. Produce designs and rough estimates, and implement…"
"Sr. Analyst, Healthcare Business Analytics","Austin, TX 78750",TransUnion,,3.8,Analytical and data-driven with a knack for driving business decisions through data and analytics. Experienced presenting data insights with data visualization…
Data Engineer,"Austin, TX",Vectra,,3.8,"S or Ph.D. in Computer Science (or equivalent experience). 6+ years in software development, data engineering, or equivalent."
Data Analyst III,"Austin, TX 78756 (Brentwood area)",Dept of State Health Services,"$4,301 - $5,671 a month",3.4,"Knowledge of data models and database design development. Provides training, development and implementation of research methods and analytical procedures for…"
Business Analyst,"Austin, TX",Quatro Consulting,,,Background as software developer preferred. Data analysis experience including querying data with SQL. Attention to detail and drive to understand business…
"Data Analyst, Partner Health Monitoring","Austin, TX (Downtown area)",Facebook,,4.2,Demonstrated success presenting complex research data (qualitative and quantitative) in a clear and compelling manner that inspires action.
Senior Data Scientist,,dMASS,"From $126,000 a year",,"Masters degree or Ph.D. in Computer Science, AI or related computational fields. Experience managing manual data annotation projects."
Business Analyst,,L&T Infotech,,3.7,Translates business strategies and objectives into business requirements. Identifies data elements and provides data mappings/dictionaries.
Customer Success Scientist/Engineer,,Scismic,,,"Collaborate with clients to plan/map their workflow requirements, process, data . Client consultations to ensure best practice translation of their workflows…"
Zoho CRM Administrator,,AnyPlace MD,,,"On-board and train users in data entry, data security procedures, reporting requirements, and develop and update training materials and resources."
"Senior Data Scientist - Located in Austin, TX",,Whole Foods Market,,3.8,We are looking for an experienced analyst or data scientist responsible for delivering data-driven and actionable insights about our customers / strategic…
Database Administrator and Developer,,Olea Edge Analytics Inc.,"$70,000 - $85,000 a year",,"This role will ensure that: data remains consistent across the database, data is clearly defined, users access data concurrently, in a form that suits their…"
Principal Database Engineer,"Austin, TX",SmartX Advisory Solutions,,,"Mentor software developers on how to think about data models in scalable software solutions. 5+ years experience in cloud database architecture, design, and/or…"
Lab Analyst - Senior,"Round Rock, TX","City of Round Rock, TX",$21.35 - $26.69 an hour,,Three (3) or more years of experience as a laboratory analyst or in a similar position. Reviews all analytical data produced by the laboratory for compliance…
Systems Analyst / Developer,"Austin, TX 78756 (Brentwood area)",Health & Human Services Comm,"$4,917 - $8,060 a month",3.4,(5%) Other duties as assigned include but are not limited to actively participating and/or serving in a supporting role to meet the agency’s obligations for…
Social Admin,"Austin, TX 78701 (Downtown area)",Crushvertise,,,"We’re masters of advertising, traffic delivery, campaign maintenance and tracking. Full-time 40 hours / week, fixed schedule."
Emerging Operations Senior Analyst,"Austin, TX 78731",Indeed,$24.03 - $30.77 an hour,4.3,"Statistical analytics experience on data from a diverse array of data sources, and the ability to synthesize and visualize data for making timely decisions,…"
Site Reliability Engineer - Data Stream Processing,"Austin, TX 73301 (St Edwards area)",Splunk,,4.1,Site Reliability Engineers (SREs) in this role will be engaging with multiple service owners across the platform to teach and implement modern interpretations…
Manufacturing Engineer II - (E2),"Austin, TX",Applied Materials Inc.,,3.9,Understands key business drivers; uses this understanding to accomplish own work. Interfaces with other engineering functions to coordinate the release of…
Support Analyst,"Austin, TX 78727",Abrigo,,3.0,"Strong academic credentials, Bachelors degree in Finance, Economics or other related field preferred. Resolve support requests and enhancements that come in…"
Informatica ETL Developer,"Austin, TX",Accenture,,4.0,"2 years of developing data warehouse, business intelligence, and/or data analytics systems. Work locally or remotely, significantly reducing or eliminating the…"
"Manufacturing Engineer - General Assembly, Gigafactory Texas","Austin, TX",Tesla,,3.5,"Analyzing downtime data to identify processes causing downtime, or trends in overall performance. Willingness to travel domestically or internationally."
Senior Project Manager - SMB,"Austin, TX 78731",Indeed,"$75,000 - $100,000 a year",4.3,Able to analyze information to find trends or diagnose problem areas. Recommend improvements to established business processes while continuing to deliver high…
"BUSINESS ANALYST, SENIOR","Austin, TX",GigaTECH,,,"Education Level: Bachelor’s Degree in Operations Research, Mathematics, Computer Science, Cost Accounting or related scientific or technical discipline."
Research Engineering/ Scientist Assistant,"Austin, TX 78723 (RMMA area)",University of Texas at Austin,,4.3,Present research data and findings in public and private forums (seminars/laboratory meetings). Uniforms and/or personal protection equipment (furnished).
"Data Integration Engineer (Mid-Level), Permanent Remote, U.S.","Austin, TX",Aledade,,3.5,Two or more years of experience working with SQL or other relational database querying language on large multi-table data sets. 401(k) with up to 4% match.
Consumer Accounts Receivable,"Austin, TX 78727","TechPro, LLC",$32 an hour,,"Bachelors degree in accounting, Finance or similar. Provide timely and accurate analysis and reporting to track key performance metrics and communicate…"
Senior ERP Business Analyst - Finance,"Austin, TX 73301 (St Edwards area)",La-Z-Boy,,3.4,Work with business stakeholders to analyze current business processes and document AS-IS business process flows. Master’s Degree in Finance or Accounting.
Supply Chain Planner - 82717,"Austin, TX","Advanced Micro Devices, Inc.",,3.8,Recommend demand shaping opportunities to achieve business goals. Provide product intelligence and required actions in the generation of the inventory forecast.
Photo Process Engineer,"Austin, TX 78754",Samsung Electronics,,4.0,"Fix those problems or document and escalate. Knowledge of statistical analysis tools (JMP, Minitab or otherwise). Work days and hours: 1st Shift."
Technical Content Developer,"Austin, TX 78746",BazaarVoice,,3.8,"3-5 years experience authoring high-quality knowledge content, delivered through one or more visual media. Interface with product managers, product developers,…"
Systems Engineer - Database,"Austin, TX",Cloudflare,,3.8,"Interest in newer database technologies like CockroachDB. Experience with data warehousing tools and patterns. Experience writing, debugging, and tuning SQL."
Senior Data Engineer,"Austin, TX",Blackbaud,,3.5,"Have experience integrating multiple data sources into a common set of data assets or common data models. You have a degree in Computer Science, Engineering, or…"
Global Order Management Analyst,"Austin, TX",Cloudera,,3.9,Bachelor's degree or equivalent. Solid analytical and business modeling skills required. Strong experience in using Salesforce CRM or equivalent.
"Senior Business Analyst, Business Process Transformation","Austin, TX 78758 (North Burnett area)",Charles Schwab Inc.,,4.0,5+ years of experience in technical analysis or operations experience with an asset or investment management firm with a focus on data-related functions; highly…
Regulatory & Government Relations Specialist,"Austin, TX",Aceable,,3.7,"Experience conducting independent research on various rules, regulations, and market data and produce summary reporting of results to key stakeholders."
Service Delivery Engineer (Azul) - US Remote,"Round Rock, TX",Dell Technologies,,4.0,"Focus on data collection and analysis of specific issues with internal team. Build and review design, functional, technical and/or process documentation."
"Product Manager, Growth","Austin, TX 78702 (East Cesar Chavez area)",Literati,,,"Experience facilitating the delivery of projects by working with engineers, data scientists, and designers. Understand the art and science of growth and when to…"
Senior Healthcare ETL Developer/Database Administrator,"Austin, TX","ApplicaScientific, Inc.","$65,000 - $135,000 a year",,"Preferred: Experience with OLAP cubs, data mining, data presentation,. Familiar with estimating database migration projects and tasks."
BI Engineer Intern (Summer 2021),"Austin, TX",Electronic Arts,,3.8,You will work with Senior BI developers and data engineers to architect BI platforms that bring data on demand. Analytical and creative thinking skills .
Integration Consultant,"Austin, TX",Intone Networks,,4.2,HL7 integration Engineers Remote ok for now · Experience in EMR integration · PM integration · Hospital Workflow knowledge is required.
TMD-Geographic Information Specialist I (Geographic Information Specialist),"Austin, TX 78703",TEXAS MILITARY DEPARTMENT,"$4,500 - $4,900 a month",3.7,"A satisfactory driving record is required for driving state or personal vehicles to conduct agency business. In support of Army strategy, build and maintain SRP…"
Senior Healthcare ETL Developer/Database Administrator,"Austin, TX","ApplicaScientific, Inc.","$65,000 - $135,000 a year",,"Preferred: Experience with OLAP cubs, data mining, data presentation,. Familiar with estimating database migration projects and tasks."
BI Engineer Intern (Summer 2021),"Austin, TX",Electronic Arts,,3.8,You will work with Senior BI developers and data engineers to architect BI platforms that bring data on demand. Analytical and creative thinking skills .
Integration Consultant,"Austin, TX",Intone Networks,,4.2,HL7 integration Engineers Remote ok for now · Experience in EMR integration · PM integration · Hospital Workflow knowledge is required.
TMD-Geographic Information Specialist I (Geographic Information Specialist),"Austin, TX 78703",TEXAS MILITARY DEPARTMENT,"$4,500 - $4,900 a month",3.7,"A satisfactory driving record is required for driving state or personal vehicles to conduct agency business. In support of Army strategy, build and maintain SRP…"
Market Research Analyst 4,"Austin, TX",Oracle,,3.8,"Initiate and develop techniques for research and analysis of current and future markets, products and services identifying business opportunities that support…"
Associate Blade Engineer - Wind Turbines,"Austin, TX",RWE Renewables Americas LLC,,,"Support the team with the blade unscheduled-maintenance model revision and update, based on the previous operational data. Perform blade damage dispositions."
Part Time GIS Analyst,"Austin, TX",Kennedy/Jenks Consultants,,4.0,"Bachelor’s degree in GIS or a related field. GIS database management (Enterprise/GDB/shapefile). Experience with ArcGIS Indoors, programming languages (Python…"
Project Engineer,"Austin, TX 78722 (Upper Boggy Creek area)",Sabre Commercial Inc,,4.5,"Project Communication Liaison: Point of contact for important project data. Bachelor’s degree in construction management, architecture, engineering, or related…"
"Sr. Data Analyst, Vendor Analytics","Austin, TX",Gartner,,3.7,"Minimum of 2+ years of experience in analytics, business intelligence, data science or similar role. Experience in high-volume data businesses (preferably…"
Compliance Analyst,"Austin, TX",RWE,,4.0,"Experience in Excel, SharePoint, database tools or compliance monitoring programs. Bachelor's degree or equivalent and experience in regulatory, legal or a…"
Senior Analyst - Emerging Operations,"Austin, TX 78731",Indeed,$24.03 - $30.77 an hour,4.3,"Statistical analytics experience on data from a diverse array of data sources, and the ability to synthesize and visualize data for making timely decisions,…"
FP&A Center of Excellence Analyst,"Austin, TX (Downtown area)",Facebook,,4.2,2+ years accounting or financial experience. Set up templates and be responsible for Hyperion data loads. Assist or own quarterly forecast cycles and annual…
Lead Data Engineer,"Austin, TX",BigCommerce,,3.7,"BS or MS in Computer Science or equivalent experience or field. Build scalable near real time data pipelines on AWS and GCP that collects, transforms, loads and…"
Quality Assurance Analyst,"Austin, TX 78744 (Mckinney area)",Four Hands,,4.0,Identify data and system/technical environment needs testing. Evaluate large data amounts from different sources and develop useful summary reports.
Manufacturing Scientist,"Cedar Creek, TX 78612","Agilent Technologies, Inc.",,4.1,"Record and maintain issues or errors that occur within the manufacturing processes. Additionally, you will work on problems of diverse scope in which analysis…"
RRC - MS SQL/SQL Server Database Administrator IV,"Austin, TX 78701 (Downtown area)",RAILROAD COMMISSION OF TEXAS,"$5,785 - $8,333 a month",3.6,Or disability in employment or in the provision of services. At least four (4) years of experience with Database Administration for MSSQL Server 2014 or later…
Senior Business Intelligence Engineer,"Austin, TX",SADA,,3.8,"Experience in business intelligence role, including data warehousing, business intelligence, data visualization tools, techniques and technology."
Research Scientist,"Austin, TX 78757 (North Shoal Creek area)",Pearson,,3.7,"Works closely with other research scientists, data analysts, subject-matter experts, and/or clients/customers in the construction of test forms and the…"
Budget Analyst,"Leander, TX",Leander Independent School District,"$55,216 a year",4.1,"Associate’s degree in accounting, business administration or equivalent combination of training/experience to demonstrate ability to do the job."
Product Manager,,PNI Media,,,Gather market requirements and competitive intelligence. Define and communicate the portfolio road map to continually improve the user experience based on…
Bank Teller,,Horizon Bank Texas,,4.7,"Minimum: BA/BS and 2+ years of customer service experience; or the equivalent combination of education and experience, which demonstrates the knowledge, skills…"
Business Unit Analyst III,"Austin, TX 78723 (St. Johns area)",Texas Mutual Insurance Company,,3.9,Uses data storytelling skills to deliver business insights. Working directly with business partners to consult on business needs and deliver analytical…
Accountant,"Austin, TX 78746",Per Stirling Capital Management,"$45,000 - $55,000 a year",,Personal protective equipment provided or required. Bachelor’s degree in Accounting or equivalent required. Generate summary sheets to be used by supervisor or…
"Software Engineer, Intern/Co-op","Austin, TX (Downtown area)",Facebook,,4.2,"Build report interfaces and data feeds. 1 or more years of experience with perl, java, php, python, or c++. It's common to write code and have it running live…"
Data Insights & Analytics Specialist,"Austin, TX 78746",AffiniPay,,4.4,"You have demonstrated ability in a data role (analytics, business intelligence) passionate about working with large and sophisticated datasets."
Production Data Operations and Automation Engineer,"Austin, TX 73301 (St Edwards area)",Splunk,,4.1,"5+ years of relevant work experience surrounding data warehouse, data lake operations and production support. As a Production Operations Engineer, you will work…"
Data Engineer- Remote,"Austin, TX 78768 (Downtown area)",Trianz,,3.4,"Experience analyzing data to discover opportunities and address gaps. Experience working with cloud or on-prem Big Data/MPP analytics platform(i.e. Netezza,…"
Principal Competitive Intelligence Analyst,"Austin, TX 78703 (Downtown area)",Whole Foods Market,,3.8,"5+ years of experience in Data Science, Business Analytics, Business Intelligence, or comparable research role, including use of business intelligence tools."
Data Manager,"Austin, TX 78704 (South Lamar-South Congress area)",Adia,,3.7,Track long-term feature and business performance data. Perform analyses on large sets of data to extract actionable insights that will help drive decisions…
Student Intern - Material Data Analytics,"Austin, TX 78757 (Allandale area)",Altair Engineering,,4.2,"You will validate and identify errors in the material data, extract important information from the materials data based on analysis, and help present this data…"
Medical Clean Bill Analyst (Claims Examiner I 21-0229),"Austin, TX 78701 (Downtown area)",STATE OFFICE OF RISK MANAGEMENT,"$3,150 a month",4.2,Education: Graduation from an accredited Medical Billing/Coding secondary education program or four-year college or university with major coursework in health…
Frontend Engineer,"Austin, TX",Zapier,,,"Refactor or improve existing code as languages, frameworks, or techniques evolve. 14 weeks paid leave for new parents of biological or adopted children."
Developer Trainee,"Austin, TX",USLI,,4.8,"New hire right out of college (with applicable technology courses) or equivalent experience. You will also work with senior leaders, team leaders, end users and…"
Staff Data Engineer,"Austin, TX",SADA,,3.8,"Engagements vary from being purely consultative to requiring heavy hands-on work, and cover a diverse array of domain areas, such as data migrations, data…"
Temporary - Parking Enforcement Officer (10 positions),"Austin, TX 78701 (Downtown area)",City of Austin,$15.91 - $18.77 an hour,4.1,"Issues citations for expired meters, improper use of specially designated or timed zones or lots, improper parking such as parking in crosswalks or other…"
Senior Product Analyst,"Austin, TX",Babylon Health,,3.0,Experience building models and dashboards to tight timelines and embedding this data into operations or product team decision making to inform real-time…
Data / Integration Engineer - REMOTE,"Austin, TX 78753 (Windsor Hills area)",Grid Dynamics,,,Design and build robust data integrations within our data platform and between the engineering systems to enable touchless data processing.
"Account Analyst/Associate, Austin","Austin, TX",Pacific Investment Management Company LLC,,3.8,"Evaluate risk reports, perform attribution research and conduct scenario analysis. A strong background and/or interest in fixed income and economics is…"
Software Engineer II,"Round Rock, TX 78664",BriteCore Intuitive Web Solutions,,,Recognizes and acts on inconsistencies in data or results and escalates unusual problems. Understand business needs behind system requirements.
Credit Analyst,"Austin, TX 78701 (Downtown area)",PlainsCapital Bank,,3.3,"Strong preference for Finance or Accounting major or concentration. Professional experience in financial, credit, or statistical analysis, and/or statement…"
Campus Technologist - Elementary,"Leander, TX",Leander Independent School District,$36.45 an hour,4.1,"May work prolonged or irregular hours. Ability to compute, analyze and interpret numerical data for reporting purposes."
Senior Business Analyst,"Austin, TX",Stamps.com,,3.8,"One or more (1+) years of experience managing and developing business intelligence solutions, such as Tableau, Looker, or Sisense for Cloud Data Teams."
Sr. Data Scientist (Remote),"Austin, TX 78708 (North Austin area)",Ayasdi,,2.3,MS or PhD in quantitative field (ideally in data science) or similar hands-on experience within the financial services community.
Statistical Analyst,"Austin, TX 78757 (North Shoal Creek area)",Pearson,,3.7,"Conducts analyses using exploratory techniques such as data mining, data summarization, and statistics. Takes direction from Ph.D. level research staff."
"Sr. Global Business Analyst, Sales Effectiveness","Austin, TX",Abbott Laboratories,,4.0,"Bachelor’s degree in information science, data management or related field or equivalent combination of education and experience. Ability to travel up to 20%."
Data Steward - SQL (82098),"Austin, TX","Advanced Micro Devices, Inc.",,3.8,"Provide stewardship of incoming data supporting Global data initiatives. The ideal candidate will have knowledge of data stewardship and administration, data…"
Compliance Analyst I - Remote Position,,D.R. Horton Inc.,,3.5,"Create and maintain data documentation for all reporting. One (1) plus years in role specific to mortgage compliance duties, or related mortgage production…"
Command and Data Handling Lead Engineer (Spacecraft),"Cedar Park, TX 78613",Firefly Aerospace,,3.3,BS in Electrical Engineering or related engineering discipline. 3+ years of experience in related engineering discipline supporting spacecraft or launch vehicle…
Financial Analyst,"Austin, TX 78759 (Arboretum area)",Social Solutions,,3.5,Experience with building Tableau or comparable business intelligence reports is a plus. Resourceful / able to find or develop compelling data and hungry for…
Oracle Apps & Core Database Administrator,"Austin, TX 78717",Blizzard Entertainment,,4.0,Work weekend and/or weeknight shifts as needed. Undertakes technical evaluation of new and/or prospective implementations and work with vendors where required.
Real Estate Investment Analyst,"Austin, TX",Teacher Retirement System of Texas,,2.8,"Assists in conducting investment research on various industries, companies or countries using computer databases."
Sr. Data Warehouse Developer,"Austin, TX",Radiology Partners,,2.7,"8+ years of relevant experience in a data warehousing and/or data development. 2+ years of tech lead experience in a DW/BI, data integration and/or data…"
Office Administrator,"Austin, TX 78702 (East Cesar Chavez area)",Christ Church of Austin,$18 - $22 an hour,,High school or equivalent (Required). High school or equivalent (Preferred). Have the ability to analyze and organize complex data.
Programmatic Analyst,"Austin, TX 78701 (Downtown area)",DWA US,,,Applicants with disabilities may be entitled to reasonable accommodation under the terms of the Americans with Disabilities Act and/or certain state or local…
